{"componentChunkName":"component---src-components-post-layout-js","path":"/blog/acyclic-queries/","result":{"data":{"mdx":{"id":"514553d4-83de-5a30-a050-8a34ffcf302a","body":"var _excluded = [\"components\"];\n\nfunction _extends() { _extends = Object.assign || function (target) { for (var i = 1; i < arguments.length; i++) { var source = arguments[i]; for (var key in source) { if (Object.prototype.hasOwnProperty.call(source, key)) { target[key] = source[key]; } } } return target; }; return _extends.apply(this, arguments); }\n\nfunction _objectWithoutProperties(source, excluded) { if (source == null) return {}; var target = _objectWithoutPropertiesLoose(source, excluded); var key, i; if (Object.getOwnPropertySymbols) { var sourceSymbolKeys = Object.getOwnPropertySymbols(source); for (i = 0; i < sourceSymbolKeys.length; i++) { key = sourceSymbolKeys[i]; if (excluded.indexOf(key) >= 0) continue; if (!Object.prototype.propertyIsEnumerable.call(source, key)) continue; target[key] = source[key]; } } return target; }\n\nfunction _objectWithoutPropertiesLoose(source, excluded) { if (source == null) return {}; var target = {}; var sourceKeys = Object.keys(source); var key, i; for (i = 0; i < sourceKeys.length; i++) { key = sourceKeys[i]; if (excluded.indexOf(key) >= 0) continue; target[key] = source[key]; } return target; }\n\n/* @jsxRuntime classic */\n\n/* @jsx mdx */\nvar _frontmatter = {\n  \"title\": \"Acyclic queries and GYO reduction\",\n  \"date\": \"2023-05-14T00:00:00.000Z\",\n  \"updated\": \"2023-12-09T00:00:00.000Z\",\n  \"published\": true,\n  \"tags\": [\"Database\"],\n  \"description\": \"A brief outlook about acyclic queries with illustrative examples of GYO reduction.\",\n  \"toc\": true,\n  \"image\": \"og-acyclic-queries.png\",\n  \"seoImage\": \"og-acyclic-queries.png\"\n};\n\nvar makeShortcode = function makeShortcode(name) {\n  return function MDXDefaultShortcode(props) {\n    console.warn(\"Component \" + name + \" was not imported, exported, or provided by MDXProvider as global scope\");\n    return mdx(\"div\", props);\n  };\n};\n\nvar Callout = makeShortcode(\"Callout\");\nvar layoutProps = {\n  _frontmatter: _frontmatter\n};\nvar MDXLayout = \"wrapper\";\nreturn function MDXContent(_ref) {\n  var components = _ref.components,\n      props = _objectWithoutProperties(_ref, _excluded);\n\n  return mdx(MDXLayout, _extends({}, layoutProps, props, {\n    components: components,\n    mdxType: \"MDXLayout\"\n  }), mdx(\"p\", null, \"One of the major parts of a database management system is \", mdx(\"strong\", {\n    parentName: \"p\"\n  }, \"query evaluation\"), \".\\nA database query \", mdx(\"em\", {\n    parentName: \"p\"\n  }, \"q\"), \" can be evaluated into multiple equivalent queries \", mdx(\"em\", {\n    parentName: \"p\"\n  }, \"q'\", mdx(\"sub\", null, \"1\")), \", \", mdx(\"em\", {\n    parentName: \"p\"\n  }, \"q'\", mdx(\"sub\", null, \"2\")), \", ..., \", mdx(\"em\", {\n    parentName: \"p\"\n  }, \"q'\", mdx(\"sub\", null, \"n\")), \"\\nThe real challenge is to find the least costly or most efficient query among the pool of equivalent queries.\"), mdx(\"h2\", {\n    \"id\": \"conjunctive-queries\",\n    \"style\": {\n      \"position\": \"relative\"\n    }\n  }, mdx(\"a\", {\n    parentName: \"h2\",\n    \"href\": \"#conjunctive-queries\",\n    \"aria-label\": \"conjunctive queries permalink\",\n    \"className\": \"anchor before\"\n  }, mdx(\"svg\", {\n    parentName: \"a\",\n    \"aria-hidden\": \"true\",\n    \"focusable\": \"false\",\n    \"height\": \"16\",\n    \"version\": \"1.1\",\n    \"viewBox\": \"0 0 16 16\",\n    \"width\": \"16\"\n  }, mdx(\"path\", {\n    parentName: \"svg\",\n    \"fillRule\": \"evenodd\",\n    \"d\": \"M4 9h1v1H4c-1.5 0-3-1.69-3-3.5S2.55 3 4 3h4c1.45 0 3 1.69 3 3.5 0 1.41-.91 2.72-2 3.25V8.59c.58-.45 1-1.27 1-2.09C10 5.22 8.98 4 8 4H4c-.98 0-2 1.22-2 2.5S3 9 4 9zm9-3h-1v1h1c1 0 2 1.22 2 2.5S13.98 12 13 12H9c-.98 0-2-1.22-2-2.5 0-.83.42-1.64 1-2.09V6.25c-1.09.53-2 1.84-2 3.25C6 11.31 7.55 13 9 13h4c1.45 0 3-1.69 3-3.5S14.5 6 13 6z\"\n  }))), \"Conjunctive queries\"), mdx(\"p\", null, \"In relational algebra, a conjunctive queries or CQs can be defined as the following.\"), mdx(Callout, {\n    mdxType: \"Callout\"\n  }, \"A conjunctive query (CQ) is an expression that uses only the operations select \\u03C3\", mdx(\"sub\", null, \"n\"), \"=m, project \\u03C0\", mdx(\"sub\", null, \"a\", mdx(\"sub\", null, \"1\")), mdx(\"sub\", null, \",...,a\", mdx(\"sub\", null, \"n\")), \", join \\u22C8, and renaming \\u03B4\", mdx(\"sub\", null, \"a\", mdx(\"sub\", null, \"1\"), \",...,a\", mdx(\"sub\", null, \"n\"), \"\\u2192b\", mdx(\"sub\", null, \"1\"), \",...,b\", mdx(\"sub\", null, \"n\")), \".\"), mdx(\"p\", null, \"In SQL, conjunctive queries correspond to \", mdx(\"code\", {\n    parentName: \"p\",\n    \"className\": \"language-text\"\n  }, \"SELECT FROM WHERE\"), \" queries, where the \", mdx(\"code\", {\n    parentName: \"p\",\n    \"className\": \"language-text\"\n  }, \"WHERE\"), \"\\nconditions contain only equalities. The combined complexity of solving a conjunctive query is \", mdx(\"strong\", {\n    parentName: \"p\"\n  }, mdx(\"em\", {\n    parentName: \"strong\"\n  }, \"NP\")), \" complete.\\nSome classes of CQs, however, can be computed in polynomial time.\"), mdx(\"h2\", {\n    \"id\": \"acyclic-cqs\",\n    \"style\": {\n      \"position\": \"relative\"\n    }\n  }, mdx(\"a\", {\n    parentName: \"h2\",\n    \"href\": \"#acyclic-cqs\",\n    \"aria-label\": \"acyclic cqs permalink\",\n    \"className\": \"anchor before\"\n  }, mdx(\"svg\", {\n    parentName: \"a\",\n    \"aria-hidden\": \"true\",\n    \"focusable\": \"false\",\n    \"height\": \"16\",\n    \"version\": \"1.1\",\n    \"viewBox\": \"0 0 16 16\",\n    \"width\": \"16\"\n  }, mdx(\"path\", {\n    parentName: \"svg\",\n    \"fillRule\": \"evenodd\",\n    \"d\": \"M4 9h1v1H4c-1.5 0-3-1.69-3-3.5S2.55 3 4 3h4c1.45 0 3 1.69 3 3.5 0 1.41-.91 2.72-2 3.25V8.59c.58-.45 1-1.27 1-2.09C10 5.22 8.98 4 8 4H4c-.98 0-2 1.22-2 2.5S3 9 4 9zm9-3h-1v1h1c1 0 2 1.22 2 2.5S13.98 12 13 12H9c-.98 0-2-1.22-2-2.5 0-.83.42-1.64 1-2.09V6.25c-1.09.53-2 1.84-2 3.25C6 11.31 7.55 13 9 13h4c1.45 0 3-1.69 3-3.5S14.5 6 13 6z\"\n  }))), \"Acyclic CQs\"), mdx(\"p\", null, \"The primary objective of query optimization is to find tractable case CQs.\\nAcyclic queries are the classes of CQs that can be computed in polynomial time.\\nBefore diving into the why, let us look at a couple of definitions of acylic CQs.\"), mdx(Callout, {\n    mdxType: \"Callout\"\n  }, mdx(\"b\", null, \"Definition 1\"), \" -- Conjunctive queries can be expressed in the form of a hypergraph. The hypergraph H(q) = (V, E) associated to a conjunctive query q is defined as follows. The set of vertices V consists of all variables in the body of q, vars(q), while the set E of hyperedges contains, for each atom in the query, the set of variables that appear in this atom. So by intuition, if a hypergraph representing CQ contains no cyles, it is acyclic.\"), mdx(\"p\", null, \"A more formal definition of acyclic query can be given with the aid of GYO(Graham-Yu-Ozsoyoglu) algorithm. Before that, what is an ear in a hypergraph? An ear in a hypergraph H is a hyperedge e for which we can divide its nodes into two\\ngroups:\"), mdx(\"ol\", null, mdx(\"li\", {\n    parentName: \"ol\"\n  }, \"those that appear exclusively in e, and\"), mdx(\"li\", {\n    parentName: \"ol\"\n  }, \"those that are contained in another hyperedge f of H.\")), mdx(\"p\", null, \"Simply, if a hyperedge is isolated, or if it is contained within another hyperedge, it is by\\ndefinition an ear. Now we are ready to provide the second definition of acyclic CQs.\"), mdx(Callout, {\n    mdxType: \"Callout\"\n  }, mdx(\"b\", null, \"Definition 2\"), \" -- GYO reduction of a hypergraph is the process of repeatedly finding ears and removing them. If during this process, a hypergraph is reduced to nothing, then it is said to be acyclic.\"), mdx(\"p\", null, \"It's very easy to get lost in words/definitions. GYO reduction is more illustratively defined in the following sections.\"), mdx(\"h2\", {\n    \"id\": \"the-gyo-reduction-algorithm\",\n    \"style\": {\n      \"position\": \"relative\"\n    }\n  }, mdx(\"a\", {\n    parentName: \"h2\",\n    \"href\": \"#the-gyo-reduction-algorithm\",\n    \"aria-label\": \"the gyo reduction algorithm permalink\",\n    \"className\": \"anchor before\"\n  }, mdx(\"svg\", {\n    parentName: \"a\",\n    \"aria-hidden\": \"true\",\n    \"focusable\": \"false\",\n    \"height\": \"16\",\n    \"version\": \"1.1\",\n    \"viewBox\": \"0 0 16 16\",\n    \"width\": \"16\"\n  }, mdx(\"path\", {\n    parentName: \"svg\",\n    \"fillRule\": \"evenodd\",\n    \"d\": \"M4 9h1v1H4c-1.5 0-3-1.69-3-3.5S2.55 3 4 3h4c1.45 0 3 1.69 3 3.5 0 1.41-.91 2.72-2 3.25V8.59c.58-.45 1-1.27 1-2.09C10 5.22 8.98 4 8 4H4c-.98 0-2 1.22-2 2.5S3 9 4 9zm9-3h-1v1h1c1 0 2 1.22 2 2.5S13.98 12 13 12H9c-.98 0-2-1.22-2-2.5 0-.83.42-1.64 1-2.09V6.25c-1.09.53-2 1.84-2 3.25C6 11.31 7.55 13 9 13h4c1.45 0 3-1.69 3-3.5S14.5 6 13 6z\"\n  }))), \"The GYO reduction algorithm\"), mdx(\"p\", null, \"The GYO algorithm works as follows:\"), mdx(Callout, {\n    mdxType: \"Callout\"\n  }, \"While \", mdx(\"i\", null, \"H\"), \" has ears do:\", mdx(\"ol\", null, mdx(\"li\", null, \"Pick an ear \", mdx(\"i\", null, \"e\"), \" of a hypergraph \", mdx(\"i\", null, \"H\"), \".\"), mdx(\"li\", null, \"Remove all vertices that are exclusively in the ear \", mdx(\"i\", null, \"e\"), \"; remove the ear \", mdx(\"i\", null, \"e\"), \" from a set of hyperedges \", mdx(\"i\", null, \"E\"), \".\"))), mdx(\"h2\", {\n    \"id\": \"illustration-of-gyo-reduction-algorithm\",\n    \"style\": {\n      \"position\": \"relative\"\n    }\n  }, mdx(\"a\", {\n    parentName: \"h2\",\n    \"href\": \"#illustration-of-gyo-reduction-algorithm\",\n    \"aria-label\": \"illustration of gyo reduction algorithm permalink\",\n    \"className\": \"anchor before\"\n  }, mdx(\"svg\", {\n    parentName: \"a\",\n    \"aria-hidden\": \"true\",\n    \"focusable\": \"false\",\n    \"height\": \"16\",\n    \"version\": \"1.1\",\n    \"viewBox\": \"0 0 16 16\",\n    \"width\": \"16\"\n  }, mdx(\"path\", {\n    parentName: \"svg\",\n    \"fillRule\": \"evenodd\",\n    \"d\": \"M4 9h1v1H4c-1.5 0-3-1.69-3-3.5S2.55 3 4 3h4c1.45 0 3 1.69 3 3.5 0 1.41-.91 2.72-2 3.25V8.59c.58-.45 1-1.27 1-2.09C10 5.22 8.98 4 8 4H4c-.98 0-2 1.22-2 2.5S3 9 4 9zm9-3h-1v1h1c1 0 2 1.22 2 2.5S13.98 12 13 12H9c-.98 0-2-1.22-2-2.5 0-.83.42-1.64 1-2.09V6.25c-1.09.53-2 1.84-2 3.25C6 11.31 7.55 13 9 13h4c1.45 0 3-1.69 3-3.5S14.5 6 13 6z\"\n  }))), \"Illustration of GYO reduction algorithm\"), mdx(\"p\", null, \"Let us consider the following conjunctive query.\"), mdx(\"p\", null, mdx(\"code\", {\n    parentName: \"p\",\n    \"className\": \"language-text\"\n  }, \"Q:- A(p,y), B(q,x), C(p,x,y), D(w,y,z), E(x,y,z)\"), \", where for \", mdx(\"code\", {\n    parentName: \"p\",\n    \"className\": \"language-text\"\n  }, \"A(p,y)\"), \", \", mdx(\"code\", {\n    parentName: \"p\",\n    \"className\": \"language-text\"\n  }, \"A\"), \" is a relation whereas \", mdx(\"code\", {\n    parentName: \"p\",\n    \"className\": \"language-text\"\n  }, \"p\"), \" and \", mdx(\"code\", {\n    parentName: \"p\",\n    \"className\": \"language-text\"\n  }, \"y\"), \" are projected variables.\"), mdx(\"p\", null, \"The following is the generated hypergraph for the above CQ. Here the variables are the nodes whereas the relations are the edges.\"), mdx(\"p\", null, mdx(\"span\", {\n    parentName: \"p\",\n    \"className\": \"gatsby-resp-image-wrapper\",\n    \"style\": {\n      \"position\": \"relative\",\n      \"display\": \"block\",\n      \"marginLeft\": \"auto\",\n      \"marginRight\": \"auto\",\n      \"maxWidth\": \"590px\"\n    }\n  }, \"\\n      \", mdx(\"a\", {\n    parentName: \"span\",\n    \"className\": \"gatsby-resp-image-link\",\n    \"href\": \"/static/1d11aa3da8a4c85157996f0b30b11d14/5a190/hypergraph-1.png\",\n    \"style\": {\n      \"display\": \"block\"\n    },\n    \"target\": \"_blank\",\n    \"rel\": \"noopener\"\n  }, \"\\n    \", mdx(\"span\", {\n    parentName: \"a\",\n    \"className\": \"gatsby-resp-image-background-image\",\n    \"style\": {\n      \"paddingBottom\": \"100%\",\n      \"position\": \"relative\",\n      \"bottom\": \"0\",\n      \"left\": \"0\",\n      \"display\": \"block\"\n    }\n  }), \"\\n  \", mdx(\"img\", {\n    parentName: \"a\",\n    \"className\": \"gatsby-resp-image-image\",\n    \"alt\": \"Hypergraph 1\",\n    \"title\": \"Hypergraph 1\",\n    \"src\": \"/static/1d11aa3da8a4c85157996f0b30b11d14/fcda8/hypergraph-1.png\",\n    \"srcSet\": [\"/static/1d11aa3da8a4c85157996f0b30b11d14/12f09/hypergraph-1.png 148w\", \"/static/1d11aa3da8a4c85157996f0b30b11d14/e4a3f/hypergraph-1.png 295w\", \"/static/1d11aa3da8a4c85157996f0b30b11d14/fcda8/hypergraph-1.png 590w\", \"/static/1d11aa3da8a4c85157996f0b30b11d14/5a190/hypergraph-1.png 800w\"],\n    \"sizes\": \"(max-width: 590px) 100vw, 590px\",\n    \"style\": {\n      \"width\": \"100%\",\n      \"height\": \"100%\",\n      \"margin\": \"0\",\n      \"verticalAlign\": \"middle\",\n      \"position\": \"absolute\",\n      \"top\": \"0\",\n      \"left\": \"0\"\n    },\n    \"loading\": \"lazy\"\n  }), \"\\n  \"), \"\\n    \")), mdx(\"p\", null, \"Now let's see the GYO reduction algorithm in place. First let's find the \", mdx(\"em\", {\n    parentName: \"p\"\n  }, \"ears\"), \" in a hypergraph iteratively. Let's see if a hyperedge is isolated or completely contained in another hyperedge.\\nImmediately we can see that for the hyperedge A, both variables \", mdx(\"em\", {\n    parentName: \"p\"\n  }, \"p\"), \" and \", mdx(\"em\", {\n    parentName: \"p\"\n  }, \"y\"), \" are contained within C. Similarly since node \", mdx(\"em\", {\n    parentName: \"p\"\n  }, \"q\"), \" is isolated and when removed the remaining nodes lie within hyperedge C,\\nwe are left with the following hypergraph and join tree.\"), mdx(\"p\", null, mdx(\"span\", {\n    parentName: \"p\",\n    \"className\": \"gatsby-resp-image-wrapper\",\n    \"style\": {\n      \"position\": \"relative\",\n      \"display\": \"block\",\n      \"marginLeft\": \"auto\",\n      \"marginRight\": \"auto\",\n      \"maxWidth\": \"590px\"\n    }\n  }, \"\\n      \", mdx(\"a\", {\n    parentName: \"span\",\n    \"className\": \"gatsby-resp-image-link\",\n    \"href\": \"/static/3d1d6606e9d4aace478f5113e24f1fa8/5a190/hypergraph-2.png\",\n    \"style\": {\n      \"display\": \"block\"\n    },\n    \"target\": \"_blank\",\n    \"rel\": \"noopener\"\n  }, \"\\n    \", mdx(\"span\", {\n    parentName: \"a\",\n    \"className\": \"gatsby-resp-image-background-image\",\n    \"style\": {\n      \"paddingBottom\": \"100%\",\n      \"position\": \"relative\",\n      \"bottom\": \"0\",\n      \"left\": \"0\",\n      \"display\": \"block\"\n    }\n  }), \"\\n  \", mdx(\"img\", {\n    parentName: \"a\",\n    \"className\": \"gatsby-resp-image-image\",\n    \"alt\": \"Hypergraph 2\",\n    \"title\": \"Hypergraph 2\",\n    \"src\": \"/static/3d1d6606e9d4aace478f5113e24f1fa8/fcda8/hypergraph-2.png\",\n    \"srcSet\": [\"/static/3d1d6606e9d4aace478f5113e24f1fa8/12f09/hypergraph-2.png 148w\", \"/static/3d1d6606e9d4aace478f5113e24f1fa8/e4a3f/hypergraph-2.png 295w\", \"/static/3d1d6606e9d4aace478f5113e24f1fa8/fcda8/hypergraph-2.png 590w\", \"/static/3d1d6606e9d4aace478f5113e24f1fa8/5a190/hypergraph-2.png 800w\"],\n    \"sizes\": \"(max-width: 590px) 100vw, 590px\",\n    \"style\": {\n      \"width\": \"100%\",\n      \"height\": \"100%\",\n      \"margin\": \"0\",\n      \"verticalAlign\": \"middle\",\n      \"position\": \"absolute\",\n      \"top\": \"0\",\n      \"left\": \"0\"\n    },\n    \"loading\": \"lazy\"\n  }), \"\\n  \"), \"\\n    \")), mdx(\"p\", null, \"In the join tree, we keep track of the variables that are shared between the atoms.\\nFor \", mdx(\"code\", {\n    parentName: \"p\",\n    \"className\": \"language-text\"\n  }, \"A(p,y)\"), \", we can see that it shares both \", mdx(\"code\", {\n    parentName: \"p\",\n    \"className\": \"language-text\"\n  }, \"p\"), \" and \", mdx(\"code\", {\n    parentName: \"p\",\n    \"className\": \"language-text\"\n  }, \"y\"), \" with \", mdx(\"code\", {\n    parentName: \"p\",\n    \"className\": \"language-text\"\n  }, \"C(p,x,y)\"), \". So the\\njoin tree tracks \\u03C0\", mdx(\"sub\", null, \"p,y\"), \"(\\u03C0\", mdx(\"sub\", null, \"-\\u03A6\"), \"). Similar is the case with \", mdx(\"code\", {\n    parentName: \"p\",\n    \"className\": \"language-text\"\n  }, \"C(p,x,y)\"), \" and \", mdx(\"code\", {\n    parentName: \"p\",\n    \"className\": \"language-text\"\n  }, \"B(q,x)\"), \".\"), mdx(\"p\", null, mdx(\"span\", {\n    parentName: \"p\",\n    \"className\": \"gatsby-resp-image-wrapper\",\n    \"style\": {\n      \"position\": \"relative\",\n      \"display\": \"block\",\n      \"marginLeft\": \"auto\",\n      \"marginRight\": \"auto\",\n      \"maxWidth\": \"516px\"\n    }\n  }, \"\\n      \", mdx(\"a\", {\n    parentName: \"span\",\n    \"className\": \"gatsby-resp-image-link\",\n    \"href\": \"/static/d3d92f2f820c2108428965f3758077e0/75dcb/tree-1.png\",\n    \"style\": {\n      \"display\": \"block\"\n    },\n    \"target\": \"_blank\",\n    \"rel\": \"noopener\"\n  }, \"\\n    \", mdx(\"span\", {\n    parentName: \"a\",\n    \"className\": \"gatsby-resp-image-background-image\",\n    \"style\": {\n      \"paddingBottom\": \"77.70270270270271%\",\n      \"position\": \"relative\",\n      \"bottom\": \"0\",\n      \"left\": \"0\",\n      \"display\": \"block\"\n    }\n  }), \"\\n  \", mdx(\"img\", {\n    parentName: \"a\",\n    \"className\": \"gatsby-resp-image-image\",\n    \"alt\": \"Tree 1\",\n    \"title\": \"Tree 1\",\n    \"src\": \"/static/d3d92f2f820c2108428965f3758077e0/75dcb/tree-1.png\",\n    \"srcSet\": [\"/static/d3d92f2f820c2108428965f3758077e0/12f09/tree-1.png 148w\", \"/static/d3d92f2f820c2108428965f3758077e0/e4a3f/tree-1.png 295w\", \"/static/d3d92f2f820c2108428965f3758077e0/75dcb/tree-1.png 516w\"],\n    \"sizes\": \"(max-width: 516px) 100vw, 516px\",\n    \"style\": {\n      \"width\": \"100%\",\n      \"height\": \"100%\",\n      \"margin\": \"0\",\n      \"verticalAlign\": \"middle\",\n      \"position\": \"absolute\",\n      \"top\": \"0\",\n      \"left\": \"0\"\n    },\n    \"loading\": \"lazy\"\n  }), \"\\n  \"), \"\\n    \")), mdx(\"p\", null, \"In the next pass, we can see node \", mdx(\"em\", {\n    parentName: \"p\"\n  }, \"w\"), \" is isolated, and the remaining node \", mdx(\"code\", {\n    parentName: \"p\",\n    \"className\": \"language-text\"\n  }, \"y\"), \" and \", mdx(\"code\", {\n    parentName: \"p\",\n    \"className\": \"language-text\"\n  }, \"z\"), \" are contained within E, so edge D is consumed.\\nSo, by GYO reduction we obtain the following hypergraph and join tree.\"), mdx(\"p\", null, mdx(\"span\", {\n    parentName: \"p\",\n    \"className\": \"gatsby-resp-image-wrapper\",\n    \"style\": {\n      \"position\": \"relative\",\n      \"display\": \"block\",\n      \"marginLeft\": \"auto\",\n      \"marginRight\": \"auto\",\n      \"maxWidth\": \"590px\"\n    }\n  }, \"\\n      \", mdx(\"a\", {\n    parentName: \"span\",\n    \"className\": \"gatsby-resp-image-link\",\n    \"href\": \"/static/00ae9495752c1620e23068eca336abb5/5a190/hypergraph-3.png\",\n    \"style\": {\n      \"display\": \"block\"\n    },\n    \"target\": \"_blank\",\n    \"rel\": \"noopener\"\n  }, \"\\n    \", mdx(\"span\", {\n    parentName: \"a\",\n    \"className\": \"gatsby-resp-image-background-image\",\n    \"style\": {\n      \"paddingBottom\": \"100%\",\n      \"position\": \"relative\",\n      \"bottom\": \"0\",\n      \"left\": \"0\",\n      \"display\": \"block\"\n    }\n  }), \"\\n  \", mdx(\"img\", {\n    parentName: \"a\",\n    \"className\": \"gatsby-resp-image-image\",\n    \"alt\": \"Hypergraph 3\",\n    \"title\": \"Hypergraph 3\",\n    \"src\": \"/static/00ae9495752c1620e23068eca336abb5/fcda8/hypergraph-3.png\",\n    \"srcSet\": [\"/static/00ae9495752c1620e23068eca336abb5/12f09/hypergraph-3.png 148w\", \"/static/00ae9495752c1620e23068eca336abb5/e4a3f/hypergraph-3.png 295w\", \"/static/00ae9495752c1620e23068eca336abb5/fcda8/hypergraph-3.png 590w\", \"/static/00ae9495752c1620e23068eca336abb5/5a190/hypergraph-3.png 800w\"],\n    \"sizes\": \"(max-width: 590px) 100vw, 590px\",\n    \"style\": {\n      \"width\": \"100%\",\n      \"height\": \"100%\",\n      \"margin\": \"0\",\n      \"verticalAlign\": \"middle\",\n      \"position\": \"absolute\",\n      \"top\": \"0\",\n      \"left\": \"0\"\n    },\n    \"loading\": \"lazy\"\n  }), \"\\n  \"), \"\\n    \"), \"\\n\", mdx(\"span\", {\n    parentName: \"p\",\n    \"className\": \"gatsby-resp-image-wrapper\",\n    \"style\": {\n      \"position\": \"relative\",\n      \"display\": \"block\",\n      \"marginLeft\": \"auto\",\n      \"marginRight\": \"auto\",\n      \"maxWidth\": \"590px\"\n    }\n  }, \"\\n      \", mdx(\"a\", {\n    parentName: \"span\",\n    \"className\": \"gatsby-resp-image-link\",\n    \"href\": \"/static/249343f3e84d3262806ce32ce2f45268/5a190/tree-2.png\",\n    \"style\": {\n      \"display\": \"block\"\n    },\n    \"target\": \"_blank\",\n    \"rel\": \"noopener\"\n  }, \"\\n    \", mdx(\"span\", {\n    parentName: \"a\",\n    \"className\": \"gatsby-resp-image-background-image\",\n    \"style\": {\n      \"paddingBottom\": \"100%\",\n      \"position\": \"relative\",\n      \"bottom\": \"0\",\n      \"left\": \"0\",\n      \"display\": \"block\"\n    }\n  }), \"\\n  \", mdx(\"img\", {\n    parentName: \"a\",\n    \"className\": \"gatsby-resp-image-image\",\n    \"alt\": \"Tree 2\",\n    \"title\": \"Tree 2\",\n    \"src\": \"/static/249343f3e84d3262806ce32ce2f45268/fcda8/tree-2.png\",\n    \"srcSet\": [\"/static/249343f3e84d3262806ce32ce2f45268/12f09/tree-2.png 148w\", \"/static/249343f3e84d3262806ce32ce2f45268/e4a3f/tree-2.png 295w\", \"/static/249343f3e84d3262806ce32ce2f45268/fcda8/tree-2.png 590w\", \"/static/249343f3e84d3262806ce32ce2f45268/5a190/tree-2.png 800w\"],\n    \"sizes\": \"(max-width: 590px) 100vw, 590px\",\n    \"style\": {\n      \"width\": \"100%\",\n      \"height\": \"100%\",\n      \"margin\": \"0\",\n      \"verticalAlign\": \"middle\",\n      \"position\": \"absolute\",\n      \"top\": \"0\",\n      \"left\": \"0\"\n    },\n    \"loading\": \"lazy\"\n  }), \"\\n  \"), \"\\n    \")), mdx(\"p\", null, \"Finally, we repeat this process until we are left with the following hyper graph.\"), mdx(\"p\", null, mdx(\"span\", {\n    parentName: \"p\",\n    \"className\": \"gatsby-resp-image-wrapper\",\n    \"style\": {\n      \"position\": \"relative\",\n      \"display\": \"block\",\n      \"marginLeft\": \"auto\",\n      \"marginRight\": \"auto\",\n      \"maxWidth\": \"590px\"\n    }\n  }, \"\\n      \", mdx(\"a\", {\n    parentName: \"span\",\n    \"className\": \"gatsby-resp-image-link\",\n    \"href\": \"/static/9225363fc9c90628b623b42d919b1ebe/5a190/hypergraph-4.png\",\n    \"style\": {\n      \"display\": \"block\"\n    },\n    \"target\": \"_blank\",\n    \"rel\": \"noopener\"\n  }, \"\\n    \", mdx(\"span\", {\n    parentName: \"a\",\n    \"className\": \"gatsby-resp-image-background-image\",\n    \"style\": {\n      \"paddingBottom\": \"100%\",\n      \"position\": \"relative\",\n      \"bottom\": \"0\",\n      \"left\": \"0\",\n      \"display\": \"block\"\n    }\n  }), \"\\n  \", mdx(\"img\", {\n    parentName: \"a\",\n    \"className\": \"gatsby-resp-image-image\",\n    \"alt\": \"Hypergraph 4\",\n    \"title\": \"Hypergraph 4\",\n    \"src\": \"/static/9225363fc9c90628b623b42d919b1ebe/fcda8/hypergraph-4.png\",\n    \"srcSet\": [\"/static/9225363fc9c90628b623b42d919b1ebe/12f09/hypergraph-4.png 148w\", \"/static/9225363fc9c90628b623b42d919b1ebe/e4a3f/hypergraph-4.png 295w\", \"/static/9225363fc9c90628b623b42d919b1ebe/fcda8/hypergraph-4.png 590w\", \"/static/9225363fc9c90628b623b42d919b1ebe/5a190/hypergraph-4.png 800w\"],\n    \"sizes\": \"(max-width: 590px) 100vw, 590px\",\n    \"style\": {\n      \"width\": \"100%\",\n      \"height\": \"100%\",\n      \"margin\": \"0\",\n      \"verticalAlign\": \"middle\",\n      \"position\": \"absolute\",\n      \"top\": \"0\",\n      \"left\": \"0\"\n    },\n    \"loading\": \"lazy\"\n  }), \"\\n  \"), \"\\n    \")), mdx(\"p\", null, \"The complete join tree is as follows.\\n\", mdx(\"span\", {\n    parentName: \"p\",\n    \"className\": \"gatsby-resp-image-wrapper\",\n    \"style\": {\n      \"position\": \"relative\",\n      \"display\": \"block\",\n      \"marginLeft\": \"auto\",\n      \"marginRight\": \"auto\",\n      \"maxWidth\": \"590px\"\n    }\n  }, \"\\n      \", mdx(\"a\", {\n    parentName: \"span\",\n    \"className\": \"gatsby-resp-image-link\",\n    \"href\": \"/static/f7d14003df46abaa63ccc16786d4d52e/5a190/tree-3.png\",\n    \"style\": {\n      \"display\": \"block\"\n    },\n    \"target\": \"_blank\",\n    \"rel\": \"noopener\"\n  }, \"\\n    \", mdx(\"span\", {\n    parentName: \"a\",\n    \"className\": \"gatsby-resp-image-background-image\",\n    \"style\": {\n      \"paddingBottom\": \"100%\",\n      \"position\": \"relative\",\n      \"bottom\": \"0\",\n      \"left\": \"0\",\n      \"display\": \"block\"\n    }\n  }), \"\\n  \", mdx(\"img\", {\n    parentName: \"a\",\n    \"className\": \"gatsby-resp-image-image\",\n    \"alt\": \"Tree 3\",\n    \"title\": \"Tree 3\",\n    \"src\": \"/static/f7d14003df46abaa63ccc16786d4d52e/fcda8/tree-3.png\",\n    \"srcSet\": [\"/static/f7d14003df46abaa63ccc16786d4d52e/12f09/tree-3.png 148w\", \"/static/f7d14003df46abaa63ccc16786d4d52e/e4a3f/tree-3.png 295w\", \"/static/f7d14003df46abaa63ccc16786d4d52e/fcda8/tree-3.png 590w\", \"/static/f7d14003df46abaa63ccc16786d4d52e/5a190/tree-3.png 800w\"],\n    \"sizes\": \"(max-width: 590px) 100vw, 590px\",\n    \"style\": {\n      \"width\": \"100%\",\n      \"height\": \"100%\",\n      \"margin\": \"0\",\n      \"verticalAlign\": \"middle\",\n      \"position\": \"absolute\",\n      \"top\": \"0\",\n      \"left\": \"0\"\n    },\n    \"loading\": \"lazy\"\n  }), \"\\n  \"), \"\\n    \")), mdx(\"p\", null, \"In the next blog, we will discuss the query evaluation part of acyclic queries through Yannakakis algorithm. Until then cheers !!\"), mdx(\"h2\", {\n    \"id\": \"references\",\n    \"style\": {\n      \"position\": \"relative\"\n    }\n  }, mdx(\"a\", {\n    parentName: \"h2\",\n    \"href\": \"#references\",\n    \"aria-label\": \"references permalink\",\n    \"className\": \"anchor before\"\n  }, mdx(\"svg\", {\n    parentName: \"a\",\n    \"aria-hidden\": \"true\",\n    \"focusable\": \"false\",\n    \"height\": \"16\",\n    \"version\": \"1.1\",\n    \"viewBox\": \"0 0 16 16\",\n    \"width\": \"16\"\n  }, mdx(\"path\", {\n    parentName: \"svg\",\n    \"fillRule\": \"evenodd\",\n    \"d\": \"M4 9h1v1H4c-1.5 0-3-1.69-3-3.5S2.55 3 4 3h4c1.45 0 3 1.69 3 3.5 0 1.41-.91 2.72-2 3.25V8.59c.58-.45 1-1.27 1-2.09C10 5.22 8.98 4 8 4H4c-.98 0-2 1.22-2 2.5S3 9 4 9zm9-3h-1v1h1c1 0 2 1.22 2 2.5S13.98 12 13 12H9c-.98 0-2-1.22-2-2.5 0-.83.42-1.64 1-2.09V6.25c-1.09.53-2 1.84-2 3.25C6 11.31 7.55 13 9 13h4c1.45 0 3-1.69 3-3.5S14.5 6 13 6z\"\n  }))), \"References\"), mdx(\"ol\", null, mdx(\"li\", {\n    parentName: \"ol\"\n  }, \"Lecture 4: Acyclic conjunctive queries - University of Wisconsin\\u2013Madison. (n.d.). \", mdx(\"a\", {\n    parentName: \"li\",\n    \"href\": \"https://pages.cs.wisc.edu/~paris/cs784-f19/lectures/lecture4.pdf\"\n  }, \"https://pages.cs.wisc.edu/~paris/cs784-f19/lectures/lecture4.pdf\")), mdx(\"li\", {\n    parentName: \"ol\"\n  }, \"YouTube. (2022). Toward Responsive DBMS (ICDE 2022 tutorial): Part 3 Acyclic Queries \", \"&\", \" Enumeration. YouTube. Retrieved May 14, 2023, from \", mdx(\"a\", {\n    parentName: \"li\",\n    \"href\": \"https://www.youtube.com/watch?v=toi7ysuyRkw\"\n  }, \"https://www.youtube.com/watch?v=toi7ysuyRkw\"), \".\")));\n}\n;\nMDXContent.isMDXComponent = true;","frontmatter":{"title":"Acyclic queries and GYO reduction","date":"May 14th 2023","datetime":"2023-05-14T00:00:00.000Z","updated":"December 9th 2023","tags":["Database"],"updated_datetime":"2023-12-09T00:00:00.000Z","description":"A brief outlook about acyclic queries with illustrative examples of GYO reduction.","toc":true},"excerpt":"One of the major parts of a database management system is  query evaluation .\nA database query  q  can be evaluated into multiple equivalent…","tableOfContents":{"items":[{"url":"#conjunctive-queries","title":"Conjunctive queries"},{"url":"#acyclic-cqs","title":"Acyclic CQs"},{"url":"#the-gyo-reduction-algorithm","title":"The GYO reduction algorithm"},{"url":"#illustration-of-gyo-reduction-algorithm","title":"Illustration of GYO reduction algorithm"},{"url":"#references","title":"References"}]},"timeToRead":2},"ogImage":{"childImageSharp":{"fixed":{"src":"/static/8f28c21df75f84122f820238304ec692/e4d72/og-acyclic-queries.png"}}}},"pageContext":{"id":"514553d4-83de-5a30-a050-8a34ffcf302a","ogImageSlug":"og-acyclic-queries.png"}},"staticQueryHashes":["633160921"]}