{"componentChunkName":"component---src-components-post-layout-js","path":"/blog/tpch-benchmark-postgres/","result":{"data":{"mdx":{"id":"8a9830c3-46b6-5c95-8c39-c099ede55c86","body":"var _excluded = [\"components\"];\n\nfunction _extends() { _extends = Object.assign || function (target) { for (var i = 1; i < arguments.length; i++) { var source = arguments[i]; for (var key in source) { if (Object.prototype.hasOwnProperty.call(source, key)) { target[key] = source[key]; } } } return target; }; return _extends.apply(this, arguments); }\n\nfunction _objectWithoutProperties(source, excluded) { if (source == null) return {}; var target = _objectWithoutPropertiesLoose(source, excluded); var key, i; if (Object.getOwnPropertySymbols) { var sourceSymbolKeys = Object.getOwnPropertySymbols(source); for (i = 0; i < sourceSymbolKeys.length; i++) { key = sourceSymbolKeys[i]; if (excluded.indexOf(key) >= 0) continue; if (!Object.prototype.propertyIsEnumerable.call(source, key)) continue; target[key] = source[key]; } } return target; }\n\nfunction _objectWithoutPropertiesLoose(source, excluded) { if (source == null) return {}; var target = {}; var sourceKeys = Object.keys(source); var key, i; for (i = 0; i < sourceKeys.length; i++) { key = sourceKeys[i]; if (excluded.indexOf(key) >= 0) continue; target[key] = source[key]; } return target; }\n\n/* @jsxRuntime classic */\n\n/* @jsx mdx */\nvar _frontmatter = {\n  \"title\": \"Performing TPC-H benchmark in Postgresql\",\n  \"date\": \"2023-11-14T00:00:00.000Z\",\n  \"updated\": \"2023-11-27T00:00:00.000Z\",\n  \"published\": true,\n  \"tags\": [\"Database\", \"dbt-3\"],\n  \"description\": \"Using TPC-H compliant dbt-3 to benchmark Postgresql.\",\n  \"toc\": true,\n  \"image\": \"og-tpch-benchmark-postgres.png\",\n  \"seoImage\": \"og-tpch-benchmark-postgres.png\"\n};\n\nvar makeShortcode = function makeShortcode(name) {\n  return function MDXDefaultShortcode(props) {\n    console.warn(\"Component \" + name + \" was not imported, exported, or provided by MDXProvider as global scope\");\n    return mdx(\"div\", props);\n  };\n};\n\nvar Callout = makeShortcode(\"Callout\");\nvar layoutProps = {\n  _frontmatter: _frontmatter\n};\nvar MDXLayout = \"wrapper\";\nreturn function MDXContent(_ref) {\n  var components = _ref.components,\n      props = _objectWithoutProperties(_ref, _excluded);\n\n  return mdx(MDXLayout, _extends({}, layoutProps, props, {\n    components: components,\n    mdxType: \"MDXLayout\"\n  }), mdx(\"p\", null, \"TPC-H is a decision support benchmark, which consists of a set of business-oriented special query and concurrent data modification. The data that is queried and populates the database has broad industry relevance.\\nThis benchmark reflects multiple aspects of a system's ability to process queries.\\nTPC-H consists of database agnostic data generation specifications. DBT-3 is a fair usage implementation of TPC-H benchmark for many RDBMS including Postgres.\"), mdx(\"h2\", {\n    \"id\": \"hardware-specification\",\n    \"style\": {\n      \"position\": \"relative\"\n    }\n  }, mdx(\"a\", {\n    parentName: \"h2\",\n    \"href\": \"#hardware-specification\",\n    \"aria-label\": \"hardware specification permalink\",\n    \"className\": \"anchor before\"\n  }, mdx(\"svg\", {\n    parentName: \"a\",\n    \"aria-hidden\": \"true\",\n    \"focusable\": \"false\",\n    \"height\": \"16\",\n    \"version\": \"1.1\",\n    \"viewBox\": \"0 0 16 16\",\n    \"width\": \"16\"\n  }, mdx(\"path\", {\n    parentName: \"svg\",\n    \"fillRule\": \"evenodd\",\n    \"d\": \"M4 9h1v1H4c-1.5 0-3-1.69-3-3.5S2.55 3 4 3h4c1.45 0 3 1.69 3 3.5 0 1.41-.91 2.72-2 3.25V8.59c.58-.45 1-1.27 1-2.09C10 5.22 8.98 4 8 4H4c-.98 0-2 1.22-2 2.5S3 9 4 9zm9-3h-1v1h1c1 0 2 1.22 2 2.5S13.98 12 13 12H9c-.98 0-2-1.22-2-2.5 0-.83.42-1.64 1-2.09V6.25c-1.09.53-2 1.84-2 3.25C6 11.31 7.55 13 9 13h4c1.45 0 3-1.69 3-3.5S14.5 6 13 6z\"\n  }))), \"Hardware specification\"), mdx(\"p\", null, \"A VM with the following specs was rented in Azure for this benchmarking.\"), mdx(\"table\", null, mdx(\"thead\", {\n    parentName: \"table\"\n  }, mdx(\"tr\", {\n    parentName: \"thead\"\n  }, mdx(\"th\", {\n    parentName: \"tr\",\n    \"align\": null\n  }, \"Hardware\"), mdx(\"th\", {\n    parentName: \"tr\",\n    \"align\": null\n  }, \"Configuration\"))), mdx(\"tbody\", {\n    parentName: \"table\"\n  }, mdx(\"tr\", {\n    parentName: \"tbody\"\n  }, mdx(\"td\", {\n    parentName: \"tr\",\n    \"align\": null\n  }, \"VM Cloud provider\"), mdx(\"td\", {\n    parentName: \"tr\",\n    \"align\": null\n  }, \"Azure\")), mdx(\"tr\", {\n    parentName: \"tbody\"\n  }, mdx(\"td\", {\n    parentName: \"tr\",\n    \"align\": null\n  }, \"VM series\"), mdx(\"td\", {\n    parentName: \"tr\",\n    \"align\": null\n  }, \"F-Series\")), mdx(\"tr\", {\n    parentName: \"tbody\"\n  }, mdx(\"td\", {\n    parentName: \"tr\",\n    \"align\": null\n  }, \"Instance\"), mdx(\"td\", {\n    parentName: \"tr\",\n    \"align\": null\n  }, \"Standard F16s v2\")), mdx(\"tr\", {\n    parentName: \"tbody\"\n  }, mdx(\"td\", {\n    parentName: \"tr\",\n    \"align\": null\n  }, \"CPU\"), mdx(\"td\", {\n    parentName: \"tr\",\n    \"align\": null\n  }, \"Intel Xeon Platinum 82\")), mdx(\"tr\", {\n    parentName: \"tbody\"\n  }, mdx(\"td\", {\n    parentName: \"tr\",\n    \"align\": null\n  }, \"Vcpus\"), mdx(\"td\", {\n    parentName: \"tr\",\n    \"align\": null\n  }, \"16\")), mdx(\"tr\", {\n    parentName: \"tbody\"\n  }, mdx(\"td\", {\n    parentName: \"tr\",\n    \"align\": null\n  }, \"Memory\"), mdx(\"td\", {\n    parentName: \"tr\",\n    \"align\": null\n  }, \"32 GiB\")), mdx(\"tr\", {\n    parentName: \"tbody\"\n  }, mdx(\"td\", {\n    parentName: \"tr\",\n    \"align\": null\n  }, \"Disk\"), mdx(\"td\", {\n    parentName: \"tr\",\n    \"align\": null\n  }, \"Premium SSD LRS - 30 GiB\")))), mdx(\"h2\", {\n    \"id\": \"software-specification\",\n    \"style\": {\n      \"position\": \"relative\"\n    }\n  }, mdx(\"a\", {\n    parentName: \"h2\",\n    \"href\": \"#software-specification\",\n    \"aria-label\": \"software specification permalink\",\n    \"className\": \"anchor before\"\n  }, mdx(\"svg\", {\n    parentName: \"a\",\n    \"aria-hidden\": \"true\",\n    \"focusable\": \"false\",\n    \"height\": \"16\",\n    \"version\": \"1.1\",\n    \"viewBox\": \"0 0 16 16\",\n    \"width\": \"16\"\n  }, mdx(\"path\", {\n    parentName: \"svg\",\n    \"fillRule\": \"evenodd\",\n    \"d\": \"M4 9h1v1H4c-1.5 0-3-1.69-3-3.5S2.55 3 4 3h4c1.45 0 3 1.69 3 3.5 0 1.41-.91 2.72-2 3.25V8.59c.58-.45 1-1.27 1-2.09C10 5.22 8.98 4 8 4H4c-.98 0-2 1.22-2 2.5S3 9 4 9zm9-3h-1v1h1c1 0 2 1.22 2 2.5S13.98 12 13 12H9c-.98 0-2-1.22-2-2.5 0-.83.42-1.64 1-2.09V6.25c-1.09.53-2 1.84-2 3.25C6 11.31 7.55 13 9 13h4c1.45 0 3-1.69 3-3.5S14.5 6 13 6z\"\n  }))), \"Software specification\"), mdx(Callout, {\n    mdxType: \"Callout\"\n  }, \"\\uD83D\\uDCA1 Please look at Postgres docs for installation correct version of Postgres on Ubuntu.\"), mdx(\"p\", null, \"The following is the software specification for the performed benchmarking.\"), mdx(\"table\", null, mdx(\"thead\", {\n    parentName: \"table\"\n  }, mdx(\"tr\", {\n    parentName: \"thead\"\n  }, mdx(\"th\", {\n    parentName: \"tr\",\n    \"align\": null\n  }, \"Software\"), mdx(\"th\", {\n    parentName: \"tr\",\n    \"align\": null\n  }, \"Configuration\"))), mdx(\"tbody\", {\n    parentName: \"table\"\n  }, mdx(\"tr\", {\n    parentName: \"tbody\"\n  }, mdx(\"td\", {\n    parentName: \"tr\",\n    \"align\": null\n  }, \"OS\"), mdx(\"td\", {\n    parentName: \"tr\",\n    \"align\": null\n  }, \"Ubuntu 20.04 LTS\")), mdx(\"tr\", {\n    parentName: \"tbody\"\n  }, mdx(\"td\", {\n    parentName: \"tr\",\n    \"align\": null\n  }, \"Kernel\"), mdx(\"td\", {\n    parentName: \"tr\",\n    \"align\": null\n  }, \"5.15.0-1050-azure\")), mdx(\"tr\", {\n    parentName: \"tbody\"\n  }, mdx(\"td\", {\n    parentName: \"tr\",\n    \"align\": null\n  }, \"Database\"), mdx(\"td\", {\n    parentName: \"tr\",\n    \"align\": null\n  }, \"Postgres 16\")), mdx(\"tr\", {\n    parentName: \"tbody\"\n  }, mdx(\"td\", {\n    parentName: \"tr\",\n    \"align\": null\n  }, \"TPC-H\"), mdx(\"td\", {\n    parentName: \"tr\",\n    \"align\": null\n  }, \"3.0.1\")), mdx(\"tr\", {\n    parentName: \"tbody\"\n  }, mdx(\"td\", {\n    parentName: \"tr\",\n    \"align\": null\n  }, \"DBT-3\"), mdx(\"td\", {\n    parentName: \"tr\",\n    \"align\": null\n  }, \"3.0.1\")))), mdx(\"h2\", {\n    \"id\": \"downloading-tpc-h-tools-file\",\n    \"style\": {\n      \"position\": \"relative\"\n    }\n  }, mdx(\"a\", {\n    parentName: \"h2\",\n    \"href\": \"#downloading-tpc-h-tools-file\",\n    \"aria-label\": \"downloading tpc h tools file permalink\",\n    \"className\": \"anchor before\"\n  }, mdx(\"svg\", {\n    parentName: \"a\",\n    \"aria-hidden\": \"true\",\n    \"focusable\": \"false\",\n    \"height\": \"16\",\n    \"version\": \"1.1\",\n    \"viewBox\": \"0 0 16 16\",\n    \"width\": \"16\"\n  }, mdx(\"path\", {\n    parentName: \"svg\",\n    \"fillRule\": \"evenodd\",\n    \"d\": \"M4 9h1v1H4c-1.5 0-3-1.69-3-3.5S2.55 3 4 3h4c1.45 0 3 1.69 3 3.5 0 1.41-.91 2.72-2 3.25V8.59c.58-.45 1-1.27 1-2.09C10 5.22 8.98 4 8 4H4c-.98 0-2 1.22-2 2.5S3 9 4 9zm9-3h-1v1h1c1 0 2 1.22 2 2.5S13.98 12 13 12H9c-.98 0-2-1.22-2-2.5 0-.83.42-1.64 1-2.09V6.25c-1.09.53-2 1.84-2 3.25C6 11.31 7.55 13 9 13h4c1.45 0 3-1.69 3-3.5S14.5 6 13 6z\"\n  }))), \"Downloading TPC-H tools file\"), mdx(\"p\", null, \"The TPC Tools are available free of charge, however all users must agree to the licensing terms and register prior to use.\\nYou'll need to fill out a form and agree to the licensing terms. You'll receive an email with the link to download the tools.\\nOn downloading the zip file, execute the following command.\"), mdx(\"div\", {\n    \"className\": \"gatsby-highlight\",\n    \"data-language\": \"bash\"\n  }, mdx(\"pre\", {\n    parentName: \"div\",\n    \"className\": \"language-bash\"\n  }, mdx(\"code\", {\n    parentName: \"pre\",\n    \"className\": \"language-bash\"\n  }, mdx(\"span\", {\n    parentName: \"code\",\n    \"className\": \"token function\"\n  }, \"unzip\"), \" *.zip      \", mdx(\"span\", {\n    parentName: \"code\",\n    \"className\": \"token comment\"\n  }, \"#replace with actual filename\")))), mdx(\"h2\", {\n    \"id\": \"installing-dbt-3\",\n    \"style\": {\n      \"position\": \"relative\"\n    }\n  }, mdx(\"a\", {\n    parentName: \"h2\",\n    \"href\": \"#installing-dbt-3\",\n    \"aria-label\": \"installing dbt 3 permalink\",\n    \"className\": \"anchor before\"\n  }, mdx(\"svg\", {\n    parentName: \"a\",\n    \"aria-hidden\": \"true\",\n    \"focusable\": \"false\",\n    \"height\": \"16\",\n    \"version\": \"1.1\",\n    \"viewBox\": \"0 0 16 16\",\n    \"width\": \"16\"\n  }, mdx(\"path\", {\n    parentName: \"svg\",\n    \"fillRule\": \"evenodd\",\n    \"d\": \"M4 9h1v1H4c-1.5 0-3-1.69-3-3.5S2.55 3 4 3h4c1.45 0 3 1.69 3 3.5 0 1.41-.91 2.72-2 3.25V8.59c.58-.45 1-1.27 1-2.09C10 5.22 8.98 4 8 4H4c-.98 0-2 1.22-2 2.5S3 9 4 9zm9-3h-1v1h1c1 0 2 1.22 2 2.5S13.98 12 13 12H9c-.98 0-2-1.22-2-2.5 0-.83.42-1.64 1-2.09V6.25c-1.09.53-2 1.84-2 3.25C6 11.31 7.55 13 9 13h4c1.45 0 3-1.69 3-3.5S14.5 6 13 6z\"\n  }))), \"Installing dbt-3\"), mdx(\"p\", null, \"Following are the prerequisites for installing dbt-3\"), mdx(\"ul\", null, mdx(\"li\", {\n    parentName: \"ul\"\n  }, \"C compiler\"), mdx(\"li\", {\n    parentName: \"ul\"\n  }, \"CMake\"), mdx(\"li\", {\n    parentName: \"ul\"\n  }, \"make\"), mdx(\"li\", {\n    parentName: \"ul\"\n  }, \"patch\"), mdx(\"li\", {\n    parentName: \"ul\"\n  }, \"bc\"), mdx(\"li\", {\n    parentName: \"ul\"\n  }, \"TPC-H tools\")), mdx(\"p\", null, \"First clone the dbt-3 repository and change the current working directory to the repository.\"), mdx(\"div\", {\n    \"className\": \"gatsby-highlight\",\n    \"data-language\": \"bash\"\n  }, mdx(\"pre\", {\n    parentName: \"div\",\n    \"className\": \"language-bash\"\n  }, mdx(\"code\", {\n    parentName: \"pre\",\n    \"className\": \"language-bash\"\n  }, mdx(\"span\", {\n    parentName: \"code\",\n    \"className\": \"token function\"\n  }, \"git\"), \" clone https://github.com/osdldbt/dbt3.git \", mdx(\"span\", {\n    parentName: \"code\",\n    \"className\": \"token operator\"\n  }, \"&&\"), \" \", mdx(\"span\", {\n    parentName: \"code\",\n    \"className\": \"token builtin class-name\"\n  }, \"cd\"), \" ./dbt3\"))), mdx(\"p\", null, \"Next create a valid build using the following command.\"), mdx(\"div\", {\n    \"className\": \"gatsby-highlight\",\n    \"data-language\": \"bash\"\n  }, mdx(\"pre\", {\n    parentName: \"div\",\n    \"className\": \"language-bash\"\n  }, mdx(\"code\", {\n    parentName: \"pre\",\n    \"className\": \"language-bash\"\n  }, mdx(\"span\", {\n    parentName: \"code\",\n    \"className\": \"token function\"\n  }, \"make\"), \" -f Makefile.cmake release\"))), mdx(\"p\", null, \"Now change the working directory to \", mdx(\"code\", {\n    parentName: \"p\",\n    \"className\": \"language-text\"\n  }, \"builds/release\"), \" and install using cmake.\"), mdx(\"div\", {\n    \"className\": \"gatsby-highlight\",\n    \"data-language\": \"bash\"\n  }, mdx(\"pre\", {\n    parentName: \"div\",\n    \"className\": \"language-bash\"\n  }, mdx(\"code\", {\n    parentName: \"pre\",\n    \"className\": \"language-bash\"\n  }, mdx(\"span\", {\n    parentName: \"code\",\n    \"className\": \"token builtin class-name\"\n  }, \"cd\"), \" builds/release\\ncmake --install \", mdx(\"span\", {\n    parentName: \"code\",\n    \"className\": \"token builtin class-name\"\n  }, \".\"), \" --prefix /usr/local\"))), mdx(\"h2\", {\n    \"id\": \"running-the-benchmark\",\n    \"style\": {\n      \"position\": \"relative\"\n    }\n  }, mdx(\"a\", {\n    parentName: \"h2\",\n    \"href\": \"#running-the-benchmark\",\n    \"aria-label\": \"running the benchmark permalink\",\n    \"className\": \"anchor before\"\n  }, mdx(\"svg\", {\n    parentName: \"a\",\n    \"aria-hidden\": \"true\",\n    \"focusable\": \"false\",\n    \"height\": \"16\",\n    \"version\": \"1.1\",\n    \"viewBox\": \"0 0 16 16\",\n    \"width\": \"16\"\n  }, mdx(\"path\", {\n    parentName: \"svg\",\n    \"fillRule\": \"evenodd\",\n    \"d\": \"M4 9h1v1H4c-1.5 0-3-1.69-3-3.5S2.55 3 4 3h4c1.45 0 3 1.69 3 3.5 0 1.41-.91 2.72-2 3.25V8.59c.58-.45 1-1.27 1-2.09C10 5.22 8.98 4 8 4H4c-.98 0-2 1.22-2 2.5S3 9 4 9zm9-3h-1v1h1c1 0 2 1.22 2 2.5S13.98 12 13 12H9c-.98 0-2-1.22-2-2.5 0-.83.42-1.64 1-2.09V6.25c-1.09.53-2 1.84-2 3.25C6 11.31 7.55 13 9 13h4c1.45 0 3-1.69 3-3.5S14.5 6 13 6z\"\n  }))), \"Running the benchmark\"), mdx(\"p\", null, \"Now that we have installed dbt3, we can proceed with running the benchmark.\\nSwitch the current working directory to the place where you unzipped the tpch tool.\"), mdx(\"p\", null, \"First, let's first create a database first.\"), mdx(\"div\", {\n    \"className\": \"gatsby-highlight\",\n    \"data-language\": \"bash\"\n  }, mdx(\"pre\", {\n    parentName: \"div\",\n    \"className\": \"language-bash\"\n  }, mdx(\"code\", {\n    parentName: \"pre\",\n    \"className\": \"language-bash\"\n  }, \"psql -c \", mdx(\"span\", {\n    parentName: \"code\",\n    \"className\": \"token string\"\n  }, \"'CREATE DATABASE dbt3;'\")))), mdx(Callout, {\n    mdxType: \"Callout\"\n  }, \"\\uD83D\\uDCA1 Make sure that the user logged in is also a valid postgres user. If not change the environment variable as specified by the dbt3 docs\"), mdx(\"p\", null, \"Now, we have to build the TPC-H tools for postgres. This is done by executing the following command.\"), mdx(\"div\", {\n    \"className\": \"gatsby-highlight\",\n    \"data-language\": \"bash\"\n  }, mdx(\"pre\", {\n    parentName: \"div\",\n    \"className\": \"language-bash\"\n  }, mdx(\"code\", {\n    parentName: \"pre\",\n    \"className\": \"language-bash\"\n  }, \"dbt3-build-dbgen --patch-dir\", mdx(\"span\", {\n    parentName: \"code\",\n    \"className\": \"token operator\"\n  }, \"=\"), mdx(\"span\", {\n    parentName: \"code\",\n    \"className\": \"token operator\"\n  }, \"<\"), \"path to dbt3 repo\", mdx(\"span\", {\n    parentName: \"code\",\n    \"className\": \"token operator\"\n  }, \">\"), \"/patches --query-dir\", mdx(\"span\", {\n    parentName: \"code\",\n    \"className\": \"token operator\"\n  }, \"=\"), mdx(\"span\", {\n    parentName: \"code\",\n    \"className\": \"token operator\"\n  }, \"<\"), \"path to dbt3 repo\", mdx(\"span\", {\n    parentName: \"code\",\n    \"className\": \"token operator\"\n  }, \">\"), \"/queries pgsql \", mdx(\"span\", {\n    parentName: \"code\",\n    \"className\": \"token string\"\n  }, \"\\\"TPC-H V3.0.1\\\"\"), \"/ \", mdx(\"span\", {\n    parentName: \"code\",\n    \"className\": \"token comment\"\n  }, \"# replace tpch version accordingly\")))), mdx(\"p\", null, \"Once the tool is built, a complete test can be run by the following command.\"), mdx(\"div\", {\n    \"className\": \"gatsby-highlight\",\n    \"data-language\": \"bash\"\n  }, mdx(\"pre\", {\n    parentName: \"div\",\n    \"className\": \"language-bash\"\n  }, mdx(\"code\", {\n    parentName: \"pre\",\n    \"className\": \"language-bash\"\n  }, \"dbt3-run --tpchtools\", mdx(\"span\", {\n    parentName: \"code\",\n    \"className\": \"token operator\"\n  }, \"=\"), mdx(\"span\", {\n    parentName: \"code\",\n    \"className\": \"token string\"\n  }, \"\\\"TPC-H V3.0.1\\\"\"), \" pgsql /tmp/results\"))), mdx(\"p\", null, \"This will run the generate the data files for a 1 GB scale factor database load, power and throughput test, with 2 streams, against PostgreSQL and save the results of the test in /tmp/results.\"), mdx(\"p\", null, \"The dbt3-run script can be used to run any combination of a load test, power test, and throughput test. A load tests must be run in order to create the database before a power or throughput tests can be run individually.\"), mdx(\"h2\", {\n    \"id\": \"results\",\n    \"style\": {\n      \"position\": \"relative\"\n    }\n  }, mdx(\"a\", {\n    parentName: \"h2\",\n    \"href\": \"#results\",\n    \"aria-label\": \"results permalink\",\n    \"className\": \"anchor before\"\n  }, mdx(\"svg\", {\n    parentName: \"a\",\n    \"aria-hidden\": \"true\",\n    \"focusable\": \"false\",\n    \"height\": \"16\",\n    \"version\": \"1.1\",\n    \"viewBox\": \"0 0 16 16\",\n    \"width\": \"16\"\n  }, mdx(\"path\", {\n    parentName: \"svg\",\n    \"fillRule\": \"evenodd\",\n    \"d\": \"M4 9h1v1H4c-1.5 0-3-1.69-3-3.5S2.55 3 4 3h4c1.45 0 3 1.69 3 3.5 0 1.41-.91 2.72-2 3.25V8.59c.58-.45 1-1.27 1-2.09C10 5.22 8.98 4 8 4H4c-.98 0-2 1.22-2 2.5S3 9 4 9zm9-3h-1v1h1c1 0 2 1.22 2 2.5S13.98 12 13 12H9c-.98 0-2-1.22-2-2.5 0-.83.42-1.64 1-2.09V6.25c-1.09.53-2 1.84-2 3.25C6 11.31 7.55 13 9 13h4c1.45 0 3-1.69 3-3.5S14.5 6 13 6z\"\n  }))), \"Results\"), mdx(\"h2\", {\n    \"id\": \"power-test\",\n    \"style\": {\n      \"position\": \"relative\"\n    }\n  }, mdx(\"a\", {\n    parentName: \"h2\",\n    \"href\": \"#power-test\",\n    \"aria-label\": \"power test permalink\",\n    \"className\": \"anchor before\"\n  }, mdx(\"svg\", {\n    parentName: \"a\",\n    \"aria-hidden\": \"true\",\n    \"focusable\": \"false\",\n    \"height\": \"16\",\n    \"version\": \"1.1\",\n    \"viewBox\": \"0 0 16 16\",\n    \"width\": \"16\"\n  }, mdx(\"path\", {\n    parentName: \"svg\",\n    \"fillRule\": \"evenodd\",\n    \"d\": \"M4 9h1v1H4c-1.5 0-3-1.69-3-3.5S2.55 3 4 3h4c1.45 0 3 1.69 3 3.5 0 1.41-.91 2.72-2 3.25V8.59c.58-.45 1-1.27 1-2.09C10 5.22 8.98 4 8 4H4c-.98 0-2 1.22-2 2.5S3 9 4 9zm9-3h-1v1h1c1 0 2 1.22 2 2.5S13.98 12 13 12H9c-.98 0-2-1.22-2-2.5 0-.83.42-1.64 1-2.09V6.25c-1.09.53-2 1.84-2 3.25C6 11.31 7.55 13 9 13h4c1.45 0 3-1.69 3-3.5S14.5 6 13 6z\"\n  }))), \"Power Test\"), mdx(\"ul\", null, mdx(\"li\", {\n    parentName: \"ul\"\n  }, \"Seed: 1125170539\")), mdx(\"table\", null, mdx(\"thead\", {\n    parentName: \"table\"\n  }, mdx(\"tr\", {\n    parentName: \"thead\"\n  }, mdx(\"th\", {\n    parentName: \"tr\",\n    \"align\": null\n  }, \"Duration (seconds)\"), mdx(\"th\", {\n    parentName: \"tr\",\n    \"align\": null\n  }, \"Query Start Time\"), mdx(\"th\", {\n    parentName: \"tr\",\n    \"align\": null\n  }, \"RF1 Start Time\"), mdx(\"th\", {\n    parentName: \"tr\",\n    \"align\": null\n  }, \"RF2 Start Time\"))), mdx(\"tbody\", {\n    parentName: \"table\"\n  }, mdx(\"tr\", {\n    parentName: \"tbody\"\n  }, mdx(\"td\", {\n    parentName: \"tr\",\n    \"align\": null\n  }), mdx(\"td\", {\n    parentName: \"tr\",\n    \"align\": null\n  }, mdx(\"b\", null, \"Query End Time\")), mdx(\"td\", {\n    parentName: \"tr\",\n    \"align\": null\n  }, mdx(\"b\", null, \"RF1 End Time\")), mdx(\"td\", {\n    parentName: \"tr\",\n    \"align\": null\n  }, mdx(\"b\", null, \"RF2 End Time\"))), mdx(\"tr\", {\n    parentName: \"tbody\"\n  }, mdx(\"td\", {\n    parentName: \"tr\",\n    \"align\": null\n  }, \"7573.62\"), mdx(\"td\", {\n    parentName: \"tr\",\n    \"align\": null\n  }, \"2023-11-25 17:05:46.01\"), mdx(\"td\", {\n    parentName: \"tr\",\n    \"align\": null\n  }, \"2023-11-25 17:05:41.15\"), mdx(\"td\", {\n    parentName: \"tr\",\n    \"align\": null\n  }, \"2023-11-25 19:11:54.60\")), mdx(\"tr\", {\n    parentName: \"tbody\"\n  }, mdx(\"td\", {\n    parentName: \"tr\",\n    \"align\": null\n  }), mdx(\"td\", {\n    parentName: \"tr\",\n    \"align\": null\n  }), mdx(\"td\", {\n    parentName: \"tr\",\n    \"align\": null\n  }), mdx(\"td\", {\n    parentName: \"tr\",\n    \"align\": null\n  })), mdx(\"tr\", {\n    parentName: \"tbody\"\n  }, mdx(\"td\", {\n    parentName: \"tr\",\n    \"align\": null\n  }), mdx(\"td\", {\n    parentName: \"tr\",\n    \"align\": null\n  }, \"2023-11-25 19:11:54.56\"), mdx(\"td\", {\n    parentName: \"tr\",\n    \"align\": null\n  }, \"2023-11-25 17:05:45.98\"), mdx(\"td\", {\n    parentName: \"tr\",\n    \"align\": null\n  }, \"2023-11-25 19:11:54.70\")))), mdx(\"table\", null, mdx(\"thead\", {\n    parentName: \"table\"\n  }, mdx(\"tr\", {\n    parentName: \"thead\"\n  }, mdx(\"th\", {\n    parentName: \"tr\",\n    \"align\": null\n  }, \"Query\"), mdx(\"th\", {\n    parentName: \"tr\",\n    \"align\": null\n  }, \"Response Time (seconds)\"))), mdx(\"tbody\", {\n    parentName: \"table\"\n  }, mdx(\"tr\", {\n    parentName: \"tbody\"\n  }, mdx(\"td\", {\n    parentName: \"tr\",\n    \"align\": null\n  }, \"1\"), mdx(\"td\", {\n    parentName: \"tr\",\n    \"align\": null\n  }, \"2.32\")), mdx(\"tr\", {\n    parentName: \"tbody\"\n  }, mdx(\"td\", {\n    parentName: \"tr\",\n    \"align\": null\n  }, \"2\"), mdx(\"td\", {\n    parentName: \"tr\",\n    \"align\": null\n  }, \"0.38\")), mdx(\"tr\", {\n    parentName: \"tbody\"\n  }, mdx(\"td\", {\n    parentName: \"tr\",\n    \"align\": null\n  }, \"3\"), mdx(\"td\", {\n    parentName: \"tr\",\n    \"align\": null\n  }, \"0.48\")), mdx(\"tr\", {\n    parentName: \"tbody\"\n  }, mdx(\"td\", {\n    parentName: \"tr\",\n    \"align\": null\n  }, \"4\"), mdx(\"td\", {\n    parentName: \"tr\",\n    \"align\": null\n  }, \"0.18\")), mdx(\"tr\", {\n    parentName: \"tbody\"\n  }, mdx(\"td\", {\n    parentName: \"tr\",\n    \"align\": null\n  }, \"5\"), mdx(\"td\", {\n    parentName: \"tr\",\n    \"align\": null\n  }, \"0.49\")), mdx(\"tr\", {\n    parentName: \"tbody\"\n  }, mdx(\"td\", {\n    parentName: \"tr\",\n    \"align\": null\n  }, \"6\"), mdx(\"td\", {\n    parentName: \"tr\",\n    \"align\": null\n  }, \"0.41\")), mdx(\"tr\", {\n    parentName: \"tbody\"\n  }, mdx(\"td\", {\n    parentName: \"tr\",\n    \"align\": null\n  }, \"7\"), mdx(\"td\", {\n    parentName: \"tr\",\n    \"align\": null\n  }, \"0.56\")), mdx(\"tr\", {\n    parentName: \"tbody\"\n  }, mdx(\"td\", {\n    parentName: \"tr\",\n    \"align\": null\n  }, \"8\"), mdx(\"td\", {\n    parentName: \"tr\",\n    \"align\": null\n  }, \"0.70\")), mdx(\"tr\", {\n    parentName: \"tbody\"\n  }, mdx(\"td\", {\n    parentName: \"tr\",\n    \"align\": null\n  }, \"9\"), mdx(\"td\", {\n    parentName: \"tr\",\n    \"align\": null\n  }, \"1.49\")), mdx(\"tr\", {\n    parentName: \"tbody\"\n  }, mdx(\"td\", {\n    parentName: \"tr\",\n    \"align\": null\n  }, \"10\"), mdx(\"td\", {\n    parentName: \"tr\",\n    \"align\": null\n  }, \"0.65\")), mdx(\"tr\", {\n    parentName: \"tbody\"\n  }, mdx(\"td\", {\n    parentName: \"tr\",\n    \"align\": null\n  }, \"11\"), mdx(\"td\", {\n    parentName: \"tr\",\n    \"align\": null\n  }, \"0.23\")), mdx(\"tr\", {\n    parentName: \"tbody\"\n  }, mdx(\"td\", {\n    parentName: \"tr\",\n    \"align\": null\n  }, \"12\"), mdx(\"td\", {\n    parentName: \"tr\",\n    \"align\": null\n  }, \"0.64\")), mdx(\"tr\", {\n    parentName: \"tbody\"\n  }, mdx(\"td\", {\n    parentName: \"tr\",\n    \"align\": null\n  }, \"13\"), mdx(\"td\", {\n    parentName: \"tr\",\n    \"align\": null\n  }, \"0.61\")), mdx(\"tr\", {\n    parentName: \"tbody\"\n  }, mdx(\"td\", {\n    parentName: \"tr\",\n    \"align\": null\n  }, \"14\"), mdx(\"td\", {\n    parentName: \"tr\",\n    \"align\": null\n  }, \"0.69\")), mdx(\"tr\", {\n    parentName: \"tbody\"\n  }, mdx(\"td\", {\n    parentName: \"tr\",\n    \"align\": null\n  }, \"15\"), mdx(\"td\", {\n    parentName: \"tr\",\n    \"align\": null\n  }, \"0.79\")), mdx(\"tr\", {\n    parentName: \"tbody\"\n  }, mdx(\"td\", {\n    parentName: \"tr\",\n    \"align\": null\n  }, \"16\"), mdx(\"td\", {\n    parentName: \"tr\",\n    \"align\": null\n  }, \"0.35\")), mdx(\"tr\", {\n    parentName: \"tbody\"\n  }, mdx(\"td\", {\n    parentName: \"tr\",\n    \"align\": null\n  }, \"17\"), mdx(\"td\", {\n    parentName: \"tr\",\n    \"align\": null\n  }, \"2497.60\")), mdx(\"tr\", {\n    parentName: \"tbody\"\n  }, mdx(\"td\", {\n    parentName: \"tr\",\n    \"align\": null\n  }, \"18\"), mdx(\"td\", {\n    parentName: \"tr\",\n    \"align\": null\n  }, \"3.40\")), mdx(\"tr\", {\n    parentName: \"tbody\"\n  }, mdx(\"td\", {\n    parentName: \"tr\",\n    \"align\": null\n  }, \"19\"), mdx(\"td\", {\n    parentName: \"tr\",\n    \"align\": null\n  }, \"0.59\")), mdx(\"tr\", {\n    parentName: \"tbody\"\n  }, mdx(\"td\", {\n    parentName: \"tr\",\n    \"align\": null\n  }, \"20\"), mdx(\"td\", {\n    parentName: \"tr\",\n    \"align\": null\n  }, \"5054.63\")), mdx(\"tr\", {\n    parentName: \"tbody\"\n  }, mdx(\"td\", {\n    parentName: \"tr\",\n    \"align\": null\n  }, \"21\"), mdx(\"td\", {\n    parentName: \"tr\",\n    \"align\": null\n  }, \"0.36\")), mdx(\"tr\", {\n    parentName: \"tbody\"\n  }, mdx(\"td\", {\n    parentName: \"tr\",\n    \"align\": null\n  }, \"22\"), mdx(\"td\", {\n    parentName: \"tr\",\n    \"align\": null\n  }, \"0.13\")), mdx(\"tr\", {\n    parentName: \"tbody\"\n  }, mdx(\"td\", {\n    parentName: \"tr\",\n    \"align\": null\n  }, \"RF1\"), mdx(\"td\", {\n    parentName: \"tr\",\n    \"align\": null\n  }, \"4.83\")), mdx(\"tr\", {\n    parentName: \"tbody\"\n  }, mdx(\"td\", {\n    parentName: \"tr\",\n    \"align\": null\n  }, \"RF2\"), mdx(\"td\", {\n    parentName: \"tr\",\n    \"align\": null\n  }, \"0.10\")))), mdx(\"h2\", {\n    \"id\": \"throughput-test\",\n    \"style\": {\n      \"position\": \"relative\"\n    }\n  }, mdx(\"a\", {\n    parentName: \"h2\",\n    \"href\": \"#throughput-test\",\n    \"aria-label\": \"throughput test permalink\",\n    \"className\": \"anchor before\"\n  }, mdx(\"svg\", {\n    parentName: \"a\",\n    \"aria-hidden\": \"true\",\n    \"focusable\": \"false\",\n    \"height\": \"16\",\n    \"version\": \"1.1\",\n    \"viewBox\": \"0 0 16 16\",\n    \"width\": \"16\"\n  }, mdx(\"path\", {\n    parentName: \"svg\",\n    \"fillRule\": \"evenodd\",\n    \"d\": \"M4 9h1v1H4c-1.5 0-3-1.69-3-3.5S2.55 3 4 3h4c1.45 0 3 1.69 3 3.5 0 1.41-.91 2.72-2 3.25V8.59c.58-.45 1-1.27 1-2.09C10 5.22 8.98 4 8 4H4c-.98 0-2 1.22-2 2.5S3 9 4 9zm9-3h-1v1h1c1 0 2 1.22 2 2.5S13.98 12 13 12H9c-.98 0-2-1.22-2-2.5 0-.83.42-1.64 1-2.09V6.25c-1.09.53-2 1.84-2 3.25C6 11.31 7.55 13 9 13h4c1.45 0 3-1.69 3-3.5S14.5 6 13 6z\"\n  }))), \"Throughput Test\"), mdx(\"h3\", {\n    \"id\": \"stream-execution-summary\",\n    \"style\": {\n      \"position\": \"relative\"\n    }\n  }, mdx(\"a\", {\n    parentName: \"h3\",\n    \"href\": \"#stream-execution-summary\",\n    \"aria-label\": \"stream execution summary permalink\",\n    \"className\": \"anchor before\"\n  }, mdx(\"svg\", {\n    parentName: \"a\",\n    \"aria-hidden\": \"true\",\n    \"focusable\": \"false\",\n    \"height\": \"16\",\n    \"version\": \"1.1\",\n    \"viewBox\": \"0 0 16 16\",\n    \"width\": \"16\"\n  }, mdx(\"path\", {\n    parentName: \"svg\",\n    \"fillRule\": \"evenodd\",\n    \"d\": \"M4 9h1v1H4c-1.5 0-3-1.69-3-3.5S2.55 3 4 3h4c1.45 0 3 1.69 3 3.5 0 1.41-.91 2.72-2 3.25V8.59c.58-.45 1-1.27 1-2.09C10 5.22 8.98 4 8 4H4c-.98 0-2 1.22-2 2.5S3 9 4 9zm9-3h-1v1h1c1 0 2 1.22 2 2.5S13.98 12 13 12H9c-.98 0-2-1.22-2-2.5 0-.83.42-1.64 1-2.09V6.25c-1.09.53-2 1.84-2 3.25C6 11.31 7.55 13 9 13h4c1.45 0 3-1.69 3-3.5S14.5 6 13 6z\"\n  }))), \"Stream execution summary:\"), mdx(\"table\", null, mdx(\"thead\", {\n    parentName: \"table\"\n  }, mdx(\"tr\", {\n    parentName: \"thead\"\n  }, mdx(\"th\", {\n    parentName: \"tr\",\n    \"align\": null\n  }, \"Stream\"), mdx(\"th\", {\n    parentName: \"tr\",\n    \"align\": null\n  }, \"Duration (seconds)\"), mdx(\"th\", {\n    parentName: \"tr\",\n    \"align\": null\n  }, \"Query Start Time\"), mdx(\"th\", {\n    parentName: \"tr\",\n    \"align\": null\n  }, \"RF1 Start Time\"), mdx(\"th\", {\n    parentName: \"tr\",\n    \"align\": null\n  }, \"RF2 Start Time\"))), mdx(\"tbody\", {\n    parentName: \"table\"\n  }, mdx(\"tr\", {\n    parentName: \"tbody\"\n  }, mdx(\"td\", {\n    parentName: \"tr\",\n    \"align\": null\n  }, mdx(\"b\", null, \"Seed\")), mdx(\"td\", {\n    parentName: \"tr\",\n    \"align\": null\n  }), mdx(\"td\", {\n    parentName: \"tr\",\n    \"align\": null\n  }, mdx(\"b\", null, \"Query End Time\")), mdx(\"td\", {\n    parentName: \"tr\",\n    \"align\": null\n  }, mdx(\"b\", null, \"RF1 End Time\")), mdx(\"td\", {\n    parentName: \"tr\",\n    \"align\": null\n  }, mdx(\"b\", null, \"RF2 End Time\"))), mdx(\"tr\", {\n    parentName: \"tbody\"\n  }, mdx(\"td\", {\n    parentName: \"tr\",\n    \"align\": null\n  }), mdx(\"td\", {\n    parentName: \"tr\",\n    \"align\": null\n  }), mdx(\"td\", {\n    parentName: \"tr\",\n    \"align\": null\n  }), mdx(\"td\", {\n    parentName: \"tr\",\n    \"align\": null\n  }), mdx(\"td\", {\n    parentName: \"tr\",\n    \"align\": null\n  })), mdx(\"tr\", {\n    parentName: \"tbody\"\n  }, mdx(\"td\", {\n    parentName: \"tr\",\n    \"align\": null\n  }, \"1\"), mdx(\"td\", {\n    parentName: \"tr\",\n    \"align\": null\n  }, \"8338.32\"), mdx(\"td\", {\n    parentName: \"tr\",\n    \"align\": null\n  }, \"2023-11-25 19:11:55.80\"), mdx(\"td\", {\n    parentName: \"tr\",\n    \"align\": null\n  }, \"2023-11-25 19:11:54.84\"), mdx(\"td\", {\n    parentName: \"tr\",\n    \"align\": null\n  }, \"2023-11-25 19:11:59.73\")), mdx(\"tr\", {\n    parentName: \"tbody\"\n  }, mdx(\"td\", {\n    parentName: \"tr\",\n    \"align\": null\n  }), mdx(\"td\", {\n    parentName: \"tr\",\n    \"align\": null\n  }), mdx(\"td\", {\n    parentName: \"tr\",\n    \"align\": null\n  }), mdx(\"td\", {\n    parentName: \"tr\",\n    \"align\": null\n  }), mdx(\"td\", {\n    parentName: \"tr\",\n    \"align\": null\n  })), mdx(\"tr\", {\n    parentName: \"tbody\"\n  }, mdx(\"td\", {\n    parentName: \"tr\",\n    \"align\": null\n  }, \"1125170540\"), mdx(\"td\", {\n    parentName: \"tr\",\n    \"align\": null\n  }), mdx(\"td\", {\n    parentName: \"tr\",\n    \"align\": null\n  }, \"2023-11-25 21:30:54.05\"), mdx(\"td\", {\n    parentName: \"tr\",\n    \"align\": null\n  }, \"2023-11-25 19:11:59.69\"), mdx(\"td\", {\n    parentName: \"tr\",\n    \"align\": null\n  }, \"2023-11-25 19:11:59.83\")), mdx(\"tr\", {\n    parentName: \"tbody\"\n  }, mdx(\"td\", {\n    parentName: \"tr\",\n    \"align\": null\n  }), mdx(\"td\", {\n    parentName: \"tr\",\n    \"align\": null\n  }), mdx(\"td\", {\n    parentName: \"tr\",\n    \"align\": null\n  }), mdx(\"td\", {\n    parentName: \"tr\",\n    \"align\": null\n  }), mdx(\"td\", {\n    parentName: \"tr\",\n    \"align\": null\n  })), mdx(\"tr\", {\n    parentName: \"tbody\"\n  }, mdx(\"td\", {\n    parentName: \"tr\",\n    \"align\": null\n  }, \"2\"), mdx(\"td\", {\n    parentName: \"tr\",\n    \"align\": null\n  }, \"8783.61\"), mdx(\"td\", {\n    parentName: \"tr\",\n    \"align\": null\n  }, \"2023-11-25 19:11:55.80\"), mdx(\"td\", {\n    parentName: \"tr\",\n    \"align\": null\n  }, \"2023-11-25 19:11:59.94\"), mdx(\"td\", {\n    parentName: \"tr\",\n    \"align\": null\n  }, \"2023-11-25 19:12:04.77\")), mdx(\"tr\", {\n    parentName: \"tbody\"\n  }, mdx(\"td\", {\n    parentName: \"tr\",\n    \"align\": null\n  }), mdx(\"td\", {\n    parentName: \"tr\",\n    \"align\": null\n  }), mdx(\"td\", {\n    parentName: \"tr\",\n    \"align\": null\n  }), mdx(\"td\", {\n    parentName: \"tr\",\n    \"align\": null\n  }), mdx(\"td\", {\n    parentName: \"tr\",\n    \"align\": null\n  })), mdx(\"tr\", {\n    parentName: \"tbody\"\n  }, mdx(\"td\", {\n    parentName: \"tr\",\n    \"align\": null\n  }, \"1125170541\"), mdx(\"td\", {\n    parentName: \"tr\",\n    \"align\": null\n  }), mdx(\"td\", {\n    parentName: \"tr\",\n    \"align\": null\n  }, \"2023-11-25 21:38:19.34\"), mdx(\"td\", {\n    parentName: \"tr\",\n    \"align\": null\n  }, \"2023-11-25 19:12:04.73\"), mdx(\"td\", {\n    parentName: \"tr\",\n    \"align\": null\n  }, \"2023-11-25 19:12:04.88\")))), mdx(\"h3\", {\n    \"id\": \"query-execution-duration-seconds\",\n    \"style\": {\n      \"position\": \"relative\"\n    }\n  }, mdx(\"a\", {\n    parentName: \"h3\",\n    \"href\": \"#query-execution-duration-seconds\",\n    \"aria-label\": \"query execution duration seconds permalink\",\n    \"className\": \"anchor before\"\n  }, mdx(\"svg\", {\n    parentName: \"a\",\n    \"aria-hidden\": \"true\",\n    \"focusable\": \"false\",\n    \"height\": \"16\",\n    \"version\": \"1.1\",\n    \"viewBox\": \"0 0 16 16\",\n    \"width\": \"16\"\n  }, mdx(\"path\", {\n    parentName: \"svg\",\n    \"fillRule\": \"evenodd\",\n    \"d\": \"M4 9h1v1H4c-1.5 0-3-1.69-3-3.5S2.55 3 4 3h4c1.45 0 3 1.69 3 3.5 0 1.41-.91 2.72-2 3.25V8.59c.58-.45 1-1.27 1-2.09C10 5.22 8.98 4 8 4H4c-.98 0-2 1.22-2 2.5S3 9 4 9zm9-3h-1v1h1c1 0 2 1.22 2 2.5S13.98 12 13 12H9c-.98 0-2-1.22-2-2.5 0-.83.42-1.64 1-2.09V6.25c-1.09.53-2 1.84-2 3.25C6 11.31 7.55 13 9 13h4c1.45 0 3-1.69 3-3.5S14.5 6 13 6z\"\n  }))), \"Query execution duration (seconds):\"), mdx(\"table\", null, mdx(\"thead\", {\n    parentName: \"table\"\n  }, mdx(\"tr\", {\n    parentName: \"thead\"\n  }, mdx(\"th\", {\n    parentName: \"tr\",\n    \"align\": null\n  }, \"Stream\"), mdx(\"th\", {\n    parentName: \"tr\",\n    \"align\": null\n  }, \"Q1\"), mdx(\"th\", {\n    parentName: \"tr\",\n    \"align\": null\n  }, \"Q2\"), mdx(\"th\", {\n    parentName: \"tr\",\n    \"align\": null\n  }, \"Q3\"), mdx(\"th\", {\n    parentName: \"tr\",\n    \"align\": null\n  }, \"Q4\"), mdx(\"th\", {\n    parentName: \"tr\",\n    \"align\": null\n  }, \"Q5\"), mdx(\"th\", {\n    parentName: \"tr\",\n    \"align\": null\n  }, \"Q6\"), mdx(\"th\", {\n    parentName: \"tr\",\n    \"align\": null\n  }, \"Q7\"))), mdx(\"tbody\", {\n    parentName: \"table\"\n  }, mdx(\"tr\", {\n    parentName: \"tbody\"\n  }, mdx(\"td\", {\n    parentName: \"tr\",\n    \"align\": null\n  }, \"1\"), mdx(\"td\", {\n    parentName: \"tr\",\n    \"align\": null\n  }, \"2.35\"), mdx(\"td\", {\n    parentName: \"tr\",\n    \"align\": null\n  }, \"0.35\"), mdx(\"td\", {\n    parentName: \"tr\",\n    \"align\": null\n  }, \"0.48\"), mdx(\"td\", {\n    parentName: \"tr\",\n    \"align\": null\n  }, \"0.18\"), mdx(\"td\", {\n    parentName: \"tr\",\n    \"align\": null\n  }, \"0.48\"), mdx(\"td\", {\n    parentName: \"tr\",\n    \"align\": null\n  }, \"0.41\"), mdx(\"td\", {\n    parentName: \"tr\",\n    \"align\": null\n  }, \"0.56\")), mdx(\"tr\", {\n    parentName: \"tbody\"\n  }, mdx(\"td\", {\n    parentName: \"tr\",\n    \"align\": null\n  }, \"2\"), mdx(\"td\", {\n    parentName: \"tr\",\n    \"align\": null\n  }, \"2.35\"), mdx(\"td\", {\n    parentName: \"tr\",\n    \"align\": null\n  }, \"0.35\"), mdx(\"td\", {\n    parentName: \"tr\",\n    \"align\": null\n  }, \"0.48\"), mdx(\"td\", {\n    parentName: \"tr\",\n    \"align\": null\n  }, \"0.18\"), mdx(\"td\", {\n    parentName: \"tr\",\n    \"align\": null\n  }, \"0.48\"), mdx(\"td\", {\n    parentName: \"tr\",\n    \"align\": null\n  }, \"0.41\"), mdx(\"td\", {\n    parentName: \"tr\",\n    \"align\": null\n  }, \"0.57\")), mdx(\"tr\", {\n    parentName: \"tbody\"\n  }, mdx(\"td\", {\n    parentName: \"tr\",\n    \"align\": null\n  }, \"Min\"), mdx(\"td\", {\n    parentName: \"tr\",\n    \"align\": null\n  }, \"2.35\"), mdx(\"td\", {\n    parentName: \"tr\",\n    \"align\": null\n  }, \"0.35\"), mdx(\"td\", {\n    parentName: \"tr\",\n    \"align\": null\n  }, \"0.48\"), mdx(\"td\", {\n    parentName: \"tr\",\n    \"align\": null\n  }, \"0.18\"), mdx(\"td\", {\n    parentName: \"tr\",\n    \"align\": null\n  }, \"0.48\"), mdx(\"td\", {\n    parentName: \"tr\",\n    \"align\": null\n  }, \"0.41\"), mdx(\"td\", {\n    parentName: \"tr\",\n    \"align\": null\n  }, \"0.57\")), mdx(\"tr\", {\n    parentName: \"tbody\"\n  }, mdx(\"td\", {\n    parentName: \"tr\",\n    \"align\": null\n  }, \"Max\"), mdx(\"td\", {\n    parentName: \"tr\",\n    \"align\": null\n  }, \"2.35\"), mdx(\"td\", {\n    parentName: \"tr\",\n    \"align\": null\n  }, \"0.35\"), mdx(\"td\", {\n    parentName: \"tr\",\n    \"align\": null\n  }, \"0.48\"), mdx(\"td\", {\n    parentName: \"tr\",\n    \"align\": null\n  }, \"0.18\"), mdx(\"td\", {\n    parentName: \"tr\",\n    \"align\": null\n  }, \"0.48\"), mdx(\"td\", {\n    parentName: \"tr\",\n    \"align\": null\n  }, \"0.41\"), mdx(\"td\", {\n    parentName: \"tr\",\n    \"align\": null\n  }, \"0.57\")), mdx(\"tr\", {\n    parentName: \"tbody\"\n  }, mdx(\"td\", {\n    parentName: \"tr\",\n    \"align\": null\n  }, \"Avg\"), mdx(\"td\", {\n    parentName: \"tr\",\n    \"align\": null\n  }, \"1.17\"), mdx(\"td\", {\n    parentName: \"tr\",\n    \"align\": null\n  }, \"0.17\"), mdx(\"td\", {\n    parentName: \"tr\",\n    \"align\": null\n  }, \"0.24\"), mdx(\"td\", {\n    parentName: \"tr\",\n    \"align\": null\n  }, \"0.09\"), mdx(\"td\", {\n    parentName: \"tr\",\n    \"align\": null\n  }, \"0.24\"), mdx(\"td\", {\n    parentName: \"tr\",\n    \"align\": null\n  }, \"0.20\"), mdx(\"td\", {\n    parentName: \"tr\",\n    \"align\": null\n  }, \"0.28\")))), mdx(\"table\", null, mdx(\"thead\", {\n    parentName: \"table\"\n  }, mdx(\"tr\", {\n    parentName: \"thead\"\n  }, mdx(\"th\", {\n    parentName: \"tr\",\n    \"align\": null\n  }, \"Stream\"), mdx(\"th\", {\n    parentName: \"tr\",\n    \"align\": null\n  }, \"Q8\"), mdx(\"th\", {\n    parentName: \"tr\",\n    \"align\": null\n  }, \"Q9\"), mdx(\"th\", {\n    parentName: \"tr\",\n    \"align\": null\n  }, \"Q10\"), mdx(\"th\", {\n    parentName: \"tr\",\n    \"align\": null\n  }, \"Q11\"), mdx(\"th\", {\n    parentName: \"tr\",\n    \"align\": null\n  }, \"Q12\"), mdx(\"th\", {\n    parentName: \"tr\",\n    \"align\": null\n  }, \"Q13\"), mdx(\"th\", {\n    parentName: \"tr\",\n    \"align\": null\n  }, \"Q14\"))), mdx(\"tbody\", {\n    parentName: \"table\"\n  }, mdx(\"tr\", {\n    parentName: \"tbody\"\n  }, mdx(\"td\", {\n    parentName: \"tr\",\n    \"align\": null\n  }, \"1\"), mdx(\"td\", {\n    parentName: \"tr\",\n    \"align\": null\n  }, \"0.70\"), mdx(\"td\", {\n    parentName: \"tr\",\n    \"align\": null\n  }, \"1.43\"), mdx(\"td\", {\n    parentName: \"tr\",\n    \"align\": null\n  }, \"0.65\"), mdx(\"td\", {\n    parentName: \"tr\",\n    \"align\": null\n  }, \"0.21\"), mdx(\"td\", {\n    parentName: \"tr\",\n    \"align\": null\n  }, \"0.64\"), mdx(\"td\", {\n    parentName: \"tr\",\n    \"align\": null\n  }, \"0.60\"), mdx(\"td\", {\n    parentName: \"tr\",\n    \"align\": null\n  }, \"0.42\")), mdx(\"tr\", {\n    parentName: \"tbody\"\n  }, mdx(\"td\", {\n    parentName: \"tr\",\n    \"align\": null\n  }, \"2\"), mdx(\"td\", {\n    parentName: \"tr\",\n    \"align\": null\n  }, \"0.69\"), mdx(\"td\", {\n    parentName: \"tr\",\n    \"align\": null\n  }, \"1.50\"), mdx(\"td\", {\n    parentName: \"tr\",\n    \"align\": null\n  }, \"0.65\"), mdx(\"td\", {\n    parentName: \"tr\",\n    \"align\": null\n  }, \"0.22\"), mdx(\"td\", {\n    parentName: \"tr\",\n    \"align\": null\n  }, \"0.64\"), mdx(\"td\", {\n    parentName: \"tr\",\n    \"align\": null\n  }, \"0.61\"), mdx(\"td\", {\n    parentName: \"tr\",\n    \"align\": null\n  }, \"0.41\")), mdx(\"tr\", {\n    parentName: \"tbody\"\n  }, mdx(\"td\", {\n    parentName: \"tr\",\n    \"align\": null\n  }, \"Min\"), mdx(\"td\", {\n    parentName: \"tr\",\n    \"align\": null\n  }, \"0.69\"), mdx(\"td\", {\n    parentName: \"tr\",\n    \"align\": null\n  }, \"1.50\"), mdx(\"td\", {\n    parentName: \"tr\",\n    \"align\": null\n  }, \"0.65\"), mdx(\"td\", {\n    parentName: \"tr\",\n    \"align\": null\n  }, \"0.22\"), mdx(\"td\", {\n    parentName: \"tr\",\n    \"align\": null\n  }, \"0.64\"), mdx(\"td\", {\n    parentName: \"tr\",\n    \"align\": null\n  }, \"0.61\"), mdx(\"td\", {\n    parentName: \"tr\",\n    \"align\": null\n  }, \"0.41\")), mdx(\"tr\", {\n    parentName: \"tbody\"\n  }, mdx(\"td\", {\n    parentName: \"tr\",\n    \"align\": null\n  }, \"Max\"), mdx(\"td\", {\n    parentName: \"tr\",\n    \"align\": null\n  }, \"0.69\"), mdx(\"td\", {\n    parentName: \"tr\",\n    \"align\": null\n  }, \"1.50\"), mdx(\"td\", {\n    parentName: \"tr\",\n    \"align\": null\n  }, \"0.65\"), mdx(\"td\", {\n    parentName: \"tr\",\n    \"align\": null\n  }, \"0.22\"), mdx(\"td\", {\n    parentName: \"tr\",\n    \"align\": null\n  }, \"0.64\"), mdx(\"td\", {\n    parentName: \"tr\",\n    \"align\": null\n  }, \"0.61\"), mdx(\"td\", {\n    parentName: \"tr\",\n    \"align\": null\n  }, \"0.41\")), mdx(\"tr\", {\n    parentName: \"tbody\"\n  }, mdx(\"td\", {\n    parentName: \"tr\",\n    \"align\": null\n  }, \"Avg\"), mdx(\"td\", {\n    parentName: \"tr\",\n    \"align\": null\n  }, \"0.34\"), mdx(\"td\", {\n    parentName: \"tr\",\n    \"align\": null\n  }, \"0.75\"), mdx(\"td\", {\n    parentName: \"tr\",\n    \"align\": null\n  }, \"0.33\"), mdx(\"td\", {\n    parentName: \"tr\",\n    \"align\": null\n  }, \"0.11\"), mdx(\"td\", {\n    parentName: \"tr\",\n    \"align\": null\n  }, \"0.32\"), mdx(\"td\", {\n    parentName: \"tr\",\n    \"align\": null\n  }, \"0.30\"), mdx(\"td\", {\n    parentName: \"tr\",\n    \"align\": null\n  }, \"0.21\")))), mdx(\"table\", null, mdx(\"thead\", {\n    parentName: \"table\"\n  }, mdx(\"tr\", {\n    parentName: \"thead\"\n  }, mdx(\"th\", {\n    parentName: \"tr\",\n    \"align\": null\n  }, \"Stream\"), mdx(\"th\", {\n    parentName: \"tr\",\n    \"align\": null\n  }, \"Q15\"), mdx(\"th\", {\n    parentName: \"tr\",\n    \"align\": null\n  }, \"Q16\"), mdx(\"th\", {\n    parentName: \"tr\",\n    \"align\": null\n  }, \"Q17\"), mdx(\"th\", {\n    parentName: \"tr\",\n    \"align\": null\n  }, \"Q18\"), mdx(\"th\", {\n    parentName: \"tr\",\n    \"align\": null\n  }, \"Q19\"), mdx(\"th\", {\n    parentName: \"tr\",\n    \"align\": null\n  }, \"Q20\"), mdx(\"th\", {\n    parentName: \"tr\",\n    \"align\": null\n  }, \"Q21\"))), mdx(\"tbody\", {\n    parentName: \"table\"\n  }, mdx(\"tr\", {\n    parentName: \"tbody\"\n  }, mdx(\"td\", {\n    parentName: \"tr\",\n    \"align\": null\n  }, \"1\"), mdx(\"td\", {\n    parentName: \"tr\",\n    \"align\": null\n  }, \"0.79\"), mdx(\"td\", {\n    parentName: \"tr\",\n    \"align\": null\n  }, \"0.35\"), mdx(\"td\", {\n    parentName: \"tr\",\n    \"align\": null\n  }, \"2364.51\"), mdx(\"td\", {\n    parentName: \"tr\",\n    \"align\": null\n  }, \"3.37\"), mdx(\"td\", {\n    parentName: \"tr\",\n    \"align\": null\n  }, \"0.59\"), mdx(\"td\", {\n    parentName: \"tr\",\n    \"align\": null\n  }, \"5957.87\"), mdx(\"td\", {\n    parentName: \"tr\",\n    \"align\": null\n  }, \"0.36\")), mdx(\"tr\", {\n    parentName: \"tbody\"\n  }, mdx(\"td\", {\n    parentName: \"tr\",\n    \"align\": null\n  }, \"2\"), mdx(\"td\", {\n    parentName: \"tr\",\n    \"align\": null\n  }, \"0.80\"), mdx(\"td\", {\n    parentName: \"tr\",\n    \"align\": null\n  }, \"0.35\"), mdx(\"td\", {\n    parentName: \"tr\",\n    \"align\": null\n  }, \"2738.75\"), mdx(\"td\", {\n    parentName: \"tr\",\n    \"align\": null\n  }, \"3.37\"), mdx(\"td\", {\n    parentName: \"tr\",\n    \"align\": null\n  }, \"0.59\"), mdx(\"td\", {\n    parentName: \"tr\",\n    \"align\": null\n  }, \"6028.83\"), mdx(\"td\", {\n    parentName: \"tr\",\n    \"align\": null\n  }, \"0.36\")), mdx(\"tr\", {\n    parentName: \"tbody\"\n  }, mdx(\"td\", {\n    parentName: \"tr\",\n    \"align\": null\n  }, \"Min\"), mdx(\"td\", {\n    parentName: \"tr\",\n    \"align\": null\n  }, \"0.80\"), mdx(\"td\", {\n    parentName: \"tr\",\n    \"align\": null\n  }, \"0.35\"), mdx(\"td\", {\n    parentName: \"tr\",\n    \"align\": null\n  }, \"2738.75\"), mdx(\"td\", {\n    parentName: \"tr\",\n    \"align\": null\n  }, \"3.37\"), mdx(\"td\", {\n    parentName: \"tr\",\n    \"align\": null\n  }, \"0.59\"), mdx(\"td\", {\n    parentName: \"tr\",\n    \"align\": null\n  }, \"6028.83\"), mdx(\"td\", {\n    parentName: \"tr\",\n    \"align\": null\n  }, \"0.36\")), mdx(\"tr\", {\n    parentName: \"tbody\"\n  }, mdx(\"td\", {\n    parentName: \"tr\",\n    \"align\": null\n  }, \"Max\"), mdx(\"td\", {\n    parentName: \"tr\",\n    \"align\": null\n  }, \"0.80\"), mdx(\"td\", {\n    parentName: \"tr\",\n    \"align\": null\n  }, \"0.35\"), mdx(\"td\", {\n    parentName: \"tr\",\n    \"align\": null\n  }, \"2738.75\"), mdx(\"td\", {\n    parentName: \"tr\",\n    \"align\": null\n  }, \"3.37\"), mdx(\"td\", {\n    parentName: \"tr\",\n    \"align\": null\n  }, \"0.59\"), mdx(\"td\", {\n    parentName: \"tr\",\n    \"align\": null\n  }, \"6028.83\"), mdx(\"td\", {\n    parentName: \"tr\",\n    \"align\": null\n  }, \"0.36\")), mdx(\"tr\", {\n    parentName: \"tbody\"\n  }, mdx(\"td\", {\n    parentName: \"tr\",\n    \"align\": null\n  }, \"Avg\"), mdx(\"td\", {\n    parentName: \"tr\",\n    \"align\": null\n  }, \"0.40\"), mdx(\"td\", {\n    parentName: \"tr\",\n    \"align\": null\n  }, \"0.18\"), mdx(\"td\", {\n    parentName: \"tr\",\n    \"align\": null\n  }, \"1369.37\"), mdx(\"td\", {\n    parentName: \"tr\",\n    \"align\": null\n  }, \"1.69\"), mdx(\"td\", {\n    parentName: \"tr\",\n    \"align\": null\n  }, \"0.30\"), mdx(\"td\", {\n    parentName: \"tr\",\n    \"align\": null\n  }, \"3014.42\"), mdx(\"td\", {\n    parentName: \"tr\",\n    \"align\": null\n  }, \"0.18\")))), mdx(\"table\", null, mdx(\"thead\", {\n    parentName: \"table\"\n  }, mdx(\"tr\", {\n    parentName: \"thead\"\n  }, mdx(\"th\", {\n    parentName: \"tr\",\n    \"align\": null\n  }, \"Stream\"), mdx(\"th\", {\n    parentName: \"tr\",\n    \"align\": null\n  }, \"Q22\"), mdx(\"th\", {\n    parentName: \"tr\",\n    \"align\": null\n  }, \"RF1\"), mdx(\"th\", {\n    parentName: \"tr\",\n    \"align\": null\n  }, \"RF2\"))), mdx(\"tbody\", {\n    parentName: \"table\"\n  }, mdx(\"tr\", {\n    parentName: \"tbody\"\n  }, mdx(\"td\", {\n    parentName: \"tr\",\n    \"align\": null\n  }, \"1\"), mdx(\"td\", {\n    parentName: \"tr\",\n    \"align\": null\n  }, \"0.13\"), mdx(\"td\", {\n    parentName: \"tr\",\n    \"align\": null\n  }, \"4.85\"), mdx(\"td\", {\n    parentName: \"tr\",\n    \"align\": null\n  }, \"0.10\")), mdx(\"tr\", {\n    parentName: \"tbody\"\n  }, mdx(\"td\", {\n    parentName: \"tr\",\n    \"align\": null\n  }, \"2\"), mdx(\"td\", {\n    parentName: \"tr\",\n    \"align\": null\n  }, \"0.13\"), mdx(\"td\", {\n    parentName: \"tr\",\n    \"align\": null\n  }, \"4.79\"), mdx(\"td\", {\n    parentName: \"tr\",\n    \"align\": null\n  }, \"0.11\")), mdx(\"tr\", {\n    parentName: \"tbody\"\n  }, mdx(\"td\", {\n    parentName: \"tr\",\n    \"align\": null\n  }, \"Min\"), mdx(\"td\", {\n    parentName: \"tr\",\n    \"align\": null\n  }, \"0.13\"), mdx(\"td\", {\n    parentName: \"tr\",\n    \"align\": null\n  }, \"4.79\"), mdx(\"td\", {\n    parentName: \"tr\",\n    \"align\": null\n  }, \"0.10\")), mdx(\"tr\", {\n    parentName: \"tbody\"\n  }, mdx(\"td\", {\n    parentName: \"tr\",\n    \"align\": null\n  }, \"Max\"), mdx(\"td\", {\n    parentName: \"tr\",\n    \"align\": null\n  }, \"0.13\"), mdx(\"td\", {\n    parentName: \"tr\",\n    \"align\": null\n  }, \"4.85\"), mdx(\"td\", {\n    parentName: \"tr\",\n    \"align\": null\n  }, \"0.11\")), mdx(\"tr\", {\n    parentName: \"tbody\"\n  }, mdx(\"td\", {\n    parentName: \"tr\",\n    \"align\": null\n  }, \"Avg\"), mdx(\"td\", {\n    parentName: \"tr\",\n    \"align\": null\n  }, \"0.07\"), mdx(\"td\", {\n    parentName: \"tr\",\n    \"align\": null\n  }, \"4.82\"), mdx(\"td\", {\n    parentName: \"tr\",\n    \"align\": null\n  }, \"0.11\")))), mdx(\"p\", null, \"How do I interpret the result? We can in general interpret why some queries, like Q17 and Q20 are taking a lot of time, looking at the query structure and how postgres processes these queries(or these type of queries in general). It can also be used to see if any major change we are making on the general Postgres architecture is causing a significant impact. Say if we implement the Yannakakis algorithm in Postgres. The comparison between those two variants could provide meaningful results as to the performance.\"));\n}\n;\nMDXContent.isMDXComponent = true;","frontmatter":{"title":"Performing TPC-H benchmark in Postgresql","date":"November 14th 2023","datetime":"2023-11-14T00:00:00.000Z","updated":"November 27th 2023","tags":["Database","dbt-3"],"updated_datetime":"2023-11-27T00:00:00.000Z","description":"Using TPC-H compliant dbt-3 to benchmark Postgresql.","toc":true},"excerpt":"TPC-H is a decision support benchmark, which consists of a set of business-oriented special query and concurrent data modification. The data…","tableOfContents":{"items":[{"url":"#hardware-specification","title":"Hardware specification"},{"url":"#software-specification","title":"Software specification"},{"url":"#downloading-tpc-h-tools-file","title":"Downloading TPC-H tools file"},{"url":"#installing-dbt-3","title":"Installing dbt-3"},{"url":"#running-the-benchmark","title":"Running the benchmark"},{"url":"#results","title":"Results"},{"url":"#power-test","title":"Power Test"},{"url":"#throughput-test","title":"Throughput Test","items":[{"url":"#stream-execution-summary","title":"Stream execution summary:"},{"url":"#query-execution-duration-seconds","title":"Query execution duration (seconds):"}]}]},"timeToRead":2},"ogImage":{"childImageSharp":{"fixed":{"src":"/static/bfcbeb7520d99c45de3c9104d01246de/e4d72/og-tpch-benchmark-postgres.png"}}}},"pageContext":{"id":"8a9830c3-46b6-5c95-8c39-c099ede55c86","ogImageSlug":"og-tpch-benchmark-postgres.png"}},"staticQueryHashes":["633160921"]}