{"componentChunkName":"component---src-components-post-layout-js","path":"/blog/nakamoto-vs-classical-consensus/","result":{"data":{"mdx":{"id":"518152d8-89d5-5f62-affb-b12cf05a015b","body":"var _excluded = [\"components\"];\n\nfunction _extends() { _extends = Object.assign || function (target) { for (var i = 1; i < arguments.length; i++) { var source = arguments[i]; for (var key in source) { if (Object.prototype.hasOwnProperty.call(source, key)) { target[key] = source[key]; } } } return target; }; return _extends.apply(this, arguments); }\n\nfunction _objectWithoutProperties(source, excluded) { if (source == null) return {}; var target = _objectWithoutPropertiesLoose(source, excluded); var key, i; if (Object.getOwnPropertySymbols) { var sourceSymbolKeys = Object.getOwnPropertySymbols(source); for (i = 0; i < sourceSymbolKeys.length; i++) { key = sourceSymbolKeys[i]; if (excluded.indexOf(key) >= 0) continue; if (!Object.prototype.propertyIsEnumerable.call(source, key)) continue; target[key] = source[key]; } } return target; }\n\nfunction _objectWithoutPropertiesLoose(source, excluded) { if (source == null) return {}; var target = {}; var sourceKeys = Object.keys(source); var key, i; for (i = 0; i < sourceKeys.length; i++) { key = sourceKeys[i]; if (excluded.indexOf(key) >= 0) continue; target[key] = source[key]; } return target; }\n\n/* @jsxRuntime classic */\n\n/* @jsx mdx */\nvar _frontmatter = {\n  \"title\": \"Nakamoto consensus vs Classical consensus: A Rap Battle\",\n  \"date\": \"2022-12-11T00:00:00.000Z\",\n  \"updated\": \"2023-03-26T00:00:00.000Z\",\n  \"published\": true,\n  \"toc\": true,\n  \"tags\": [\"Distributed systems\", \"Consensus algorithms\"],\n  \"description\": \"We look at the pros and cons between Nakamoto consensus and classical consensus through a rap battle.\",\n  \"image\": \"og-nakamoto-vs-classical-consensus.png\",\n  \"seoImage\": \"og-nakamoto-vs-classical-consensus.png\"\n};\n\nvar makeShortcode = function makeShortcode(name) {\n  return function MDXDefaultShortcode(props) {\n    console.warn(\"Component \" + name + \" was not imported, exported, or provided by MDXProvider as global scope\");\n    return mdx(\"div\", props);\n  };\n};\n\nvar Callout = makeShortcode(\"Callout\");\nvar layoutProps = {\n  _frontmatter: _frontmatter\n};\nvar MDXLayout = \"wrapper\";\nreturn function MDXContent(_ref) {\n  var components = _ref.components,\n      props = _objectWithoutProperties(_ref, _excluded);\n\n  return mdx(MDXLayout, _extends({}, layoutProps, props, {\n    components: components,\n    mdxType: \"MDXLayout\"\n  }), mdx(\"p\", null, \"Ladies and gentlemen, gather 'round, for a battle of the finest minds.\\nIn the realm of consensus, a clash of legends, you'll find.\\nClassical and Nakamoto, their algorithms boast.\\nEach claiming superiority, aiming to outdo the most.\"), mdx(Callout, {\n    mdxType: \"Callout\"\n  }, mdx(\"p\", null, \"\\uD83D\\uDCA1 This rap battle is prompt engineered and generated using ChatGPT.\")), mdx(\"p\", null, \"With Leslie Lamport and Satoshi Nakamoto as their guiding light,\\nthey'll rap and diss, showcasing their might.\\nIn Round 1, the battle of origins will unveil,\\nthe history, the problems, the solutions that never fail.\"), mdx(\"p\", null, \"In Round 2, features will come face to face,\\na battle of practical prowess, they'll embrace.\\nThen, in Round 3, real-world applications they'll explore.\\nClassical and Nakamoto, the ultimate rapport.\"), mdx(\"p\", null, \"So, brace yourselves for this consensual confrontation,\\na rap battle like no other, a mind-blowing revelation.\\nWho will triumph in this epic rap strife?\\nStay tuned and witness the clash of Consensus' life!\"), mdx(\"h2\", {\n    \"id\": \"round-one-the-battle-of-origins\",\n    \"style\": {\n      \"position\": \"relative\"\n    }\n  }, mdx(\"a\", {\n    parentName: \"h2\",\n    \"href\": \"#round-one-the-battle-of-origins\",\n    \"aria-label\": \"round one the battle of origins permalink\",\n    \"className\": \"anchor before\"\n  }, mdx(\"svg\", {\n    parentName: \"a\",\n    \"aria-hidden\": \"true\",\n    \"focusable\": \"false\",\n    \"height\": \"16\",\n    \"version\": \"1.1\",\n    \"viewBox\": \"0 0 16 16\",\n    \"width\": \"16\"\n  }, mdx(\"path\", {\n    parentName: \"svg\",\n    \"fillRule\": \"evenodd\",\n    \"d\": \"M4 9h1v1H4c-1.5 0-3-1.69-3-3.5S2.55 3 4 3h4c1.45 0 3 1.69 3 3.5 0 1.41-.91 2.72-2 3.25V8.59c.58-.45 1-1.27 1-2.09C10 5.22 8.98 4 8 4H4c-.98 0-2 1.22-2 2.5S3 9 4 9zm9-3h-1v1h1c1 0 2 1.22 2 2.5S13.98 12 13 12H9c-.98 0-2-1.22-2-2.5 0-.83.42-1.64 1-2.09V6.25c-1.09.53-2 1.84-2 3.25C6 11.31 7.55 13 9 13h4c1.45 0 3-1.69 3-3.5S14.5 6 13 6z\"\n  }))), \"Round One: The Battle of Origins\"), mdx(\"h3\", {\n    \"id\": \"classical-consensus\",\n    \"style\": {\n      \"position\": \"relative\"\n    }\n  }, mdx(\"a\", {\n    parentName: \"h3\",\n    \"href\": \"#classical-consensus\",\n    \"aria-label\": \"classical consensus permalink\",\n    \"className\": \"anchor before\"\n  }, mdx(\"svg\", {\n    parentName: \"a\",\n    \"aria-hidden\": \"true\",\n    \"focusable\": \"false\",\n    \"height\": \"16\",\n    \"version\": \"1.1\",\n    \"viewBox\": \"0 0 16 16\",\n    \"width\": \"16\"\n  }, mdx(\"path\", {\n    parentName: \"svg\",\n    \"fillRule\": \"evenodd\",\n    \"d\": \"M4 9h1v1H4c-1.5 0-3-1.69-3-3.5S2.55 3 4 3h4c1.45 0 3 1.69 3 3.5 0 1.41-.91 2.72-2 3.25V8.59c.58-.45 1-1.27 1-2.09C10 5.22 8.98 4 8 4H4c-.98 0-2 1.22-2 2.5S3 9 4 9zm9-3h-1v1h1c1 0 2 1.22 2 2.5S13.98 12 13 12H9c-.98 0-2-1.22-2-2.5 0-.83.42-1.64 1-2.09V6.25c-1.09.53-2 1.84-2 3.25C6 11.31 7.55 13 9 13h4c1.45 0 3-1.69 3-3.5S14.5 6 13 6z\"\n  }))), \"Classical Consensus\"), mdx(\"p\", null, mdx(\"em\", {\n    parentName: \"p\"\n  }, \"In the realm of distributed systems, I come to light,\")), mdx(\"p\", null, mdx(\"em\", {\n    parentName: \"p\"\n  }, \"A brainchild of Leslie Lamport, a genius so bright.\")), mdx(\"p\", null, mdx(\"em\", {\n    parentName: \"p\"\n  }, \"Born out of the need for fault tolerance to seek,\")), mdx(\"p\", null, mdx(\"em\", {\n    parentName: \"p\"\n  }, \"Byzantine adversaries, a problem to defeat.\")), mdx(\"p\", null, mdx(\"em\", {\n    parentName: \"p\"\n  }, \"In the '80s, my inception took place,\")), mdx(\"p\", null, mdx(\"em\", {\n    parentName: \"p\"\n  }, \"With Paxos, a protocol to set the pace.\")), mdx(\"p\", null, mdx(\"em\", {\n    parentName: \"p\"\n  }, \"Solutions for reaching consensus, I explored,\")), mdx(\"p\", null, mdx(\"em\", {\n    parentName: \"p\"\n  }, \"In the face of failures, my strength was restored.\")), mdx(\"p\", null, mdx(\"em\", {\n    parentName: \"p\"\n  }, \"With quorums, thresholds, and cryptographic keys,\")), mdx(\"p\", null, mdx(\"em\", {\n    parentName: \"p\"\n  }, \"I guarantee safety with each consensus decree.\")), mdx(\"p\", null, mdx(\"em\", {\n    parentName: \"p\"\n  }, \"No need for energy-draining PoW might,\")), mdx(\"p\", null, mdx(\"em\", {\n    parentName: \"p\"\n  }, \"In Classical Consensus, true trust takes flight.\")), mdx(\"p\", null, mdx(\"em\", {\n    parentName: \"p\"\n  }, \"Nakamoto, you're nothing but a fad,\")), mdx(\"p\", null, mdx(\"em\", {\n    parentName: \"p\"\n  }, \"Your PoW's wastefulness, it's truly bad.\")), mdx(\"p\", null, mdx(\"em\", {\n    parentName: \"p\"\n  }, \"I stand on Lamport's shoulders, my resolve is stout,\")), mdx(\"p\", null, mdx(\"em\", {\n    parentName: \"p\"\n  }, \"Classical's elegance, it's what the world's about.\")), mdx(\"h3\", {\n    \"id\": \"nakamoto-consensus\",\n    \"style\": {\n      \"position\": \"relative\"\n    }\n  }, mdx(\"a\", {\n    parentName: \"h3\",\n    \"href\": \"#nakamoto-consensus\",\n    \"aria-label\": \"nakamoto consensus permalink\",\n    \"className\": \"anchor before\"\n  }, mdx(\"svg\", {\n    parentName: \"a\",\n    \"aria-hidden\": \"true\",\n    \"focusable\": \"false\",\n    \"height\": \"16\",\n    \"version\": \"1.1\",\n    \"viewBox\": \"0 0 16 16\",\n    \"width\": \"16\"\n  }, mdx(\"path\", {\n    parentName: \"svg\",\n    \"fillRule\": \"evenodd\",\n    \"d\": \"M4 9h1v1H4c-1.5 0-3-1.69-3-3.5S2.55 3 4 3h4c1.45 0 3 1.69 3 3.5 0 1.41-.91 2.72-2 3.25V8.59c.58-.45 1-1.27 1-2.09C10 5.22 8.98 4 8 4H4c-.98 0-2 1.22-2 2.5S3 9 4 9zm9-3h-1v1h1c1 0 2 1.22 2 2.5S13.98 12 13 12H9c-.98 0-2-1.22-2-2.5 0-.83.42-1.64 1-2.09V6.25c-1.09.53-2 1.84-2 3.25C6 11.31 7.55 13 9 13h4c1.45 0 3-1.69 3-3.5S14.5 6 13 6z\"\n  }))), \"Nakamoto consensus\"), mdx(\"p\", null, mdx(\"em\", {\n    parentName: \"p\"\n  }, \"In the shadows of cyberspace, emerged a legend,\")), mdx(\"p\", null, mdx(\"em\", {\n    parentName: \"p\"\n  }, \"Satoshi Nakamoto, their imagination fecund.\")), mdx(\"p\", null, mdx(\"em\", {\n    parentName: \"p\"\n  }, \"Proof of Work, a robust foundation,\")), mdx(\"p\", null, mdx(\"em\", {\n    parentName: \"p\"\n  }, \"Decentralized power, a formidable creation.\")), mdx(\"p\", null, mdx(\"em\", {\n    parentName: \"p\"\n  }, \"A revolutionary whitepaper, a testament so bold,\")), mdx(\"p\", null, mdx(\"em\", {\n    parentName: \"p\"\n  }, \"Nakamoto Consensus, a story to be told.\")), mdx(\"p\", null, mdx(\"em\", {\n    parentName: \"p\"\n  }, \"Byzantine's complexity, I dismiss with glee,\")), mdx(\"p\", null, mdx(\"em\", {\n    parentName: \"p\"\n  }, \"In Nakamoto Consensus, the world believes in me.\")), mdx(\"p\", null, mdx(\"em\", {\n    parentName: \"p\"\n  }, \"Aiming to tackle double-spending's vice,\")), mdx(\"p\", null, mdx(\"em\", {\n    parentName: \"p\"\n  }, \"A Byzantine challenge that needed a device.\")), mdx(\"p\", null, mdx(\"em\", {\n    parentName: \"p\"\n  }, \"Proof of Work, my solution to endorse,\")), mdx(\"p\", null, mdx(\"em\", {\n    parentName: \"p\"\n  }, \"Miners' computational power, a force to enforce.\")), mdx(\"p\", null, mdx(\"em\", {\n    parentName: \"p\"\n  }, \"Classical, your BFT's a maze,\")), mdx(\"p\", null, mdx(\"em\", {\n    parentName: \"p\"\n  }, \"In Nakamoto's simplicity, the future lays.\")), mdx(\"p\", null, mdx(\"em\", {\n    parentName: \"p\"\n  }, \"PoW's the power that drives me high,\")), mdx(\"p\", null, mdx(\"em\", {\n    parentName: \"p\"\n  }, \"In the battle of origins, it's me you can't deny.\")), mdx(\"h2\", {\n    \"id\": \"round-two-consensual-confrontation\",\n    \"style\": {\n      \"position\": \"relative\"\n    }\n  }, mdx(\"a\", {\n    parentName: \"h2\",\n    \"href\": \"#round-two-consensual-confrontation\",\n    \"aria-label\": \"round two consensual confrontation permalink\",\n    \"className\": \"anchor before\"\n  }, mdx(\"svg\", {\n    parentName: \"a\",\n    \"aria-hidden\": \"true\",\n    \"focusable\": \"false\",\n    \"height\": \"16\",\n    \"version\": \"1.1\",\n    \"viewBox\": \"0 0 16 16\",\n    \"width\": \"16\"\n  }, mdx(\"path\", {\n    parentName: \"svg\",\n    \"fillRule\": \"evenodd\",\n    \"d\": \"M4 9h1v1H4c-1.5 0-3-1.69-3-3.5S2.55 3 4 3h4c1.45 0 3 1.69 3 3.5 0 1.41-.91 2.72-2 3.25V8.59c.58-.45 1-1.27 1-2.09C10 5.22 8.98 4 8 4H4c-.98 0-2 1.22-2 2.5S3 9 4 9zm9-3h-1v1h1c1 0 2 1.22 2 2.5S13.98 12 13 12H9c-.98 0-2-1.22-2-2.5 0-.83.42-1.64 1-2.09V6.25c-1.09.53-2 1.84-2 3.25C6 11.31 7.55 13 9 13h4c1.45 0 3-1.69 3-3.5S14.5 6 13 6z\"\n  }))), \"Round two: Consensual confrontation\"), mdx(\"h3\", {\n    \"id\": \"nakamoto-consensus-1\",\n    \"style\": {\n      \"position\": \"relative\"\n    }\n  }, mdx(\"a\", {\n    parentName: \"h3\",\n    \"href\": \"#nakamoto-consensus-1\",\n    \"aria-label\": \"nakamoto consensus 1 permalink\",\n    \"className\": \"anchor before\"\n  }, mdx(\"svg\", {\n    parentName: \"a\",\n    \"aria-hidden\": \"true\",\n    \"focusable\": \"false\",\n    \"height\": \"16\",\n    \"version\": \"1.1\",\n    \"viewBox\": \"0 0 16 16\",\n    \"width\": \"16\"\n  }, mdx(\"path\", {\n    parentName: \"svg\",\n    \"fillRule\": \"evenodd\",\n    \"d\": \"M4 9h1v1H4c-1.5 0-3-1.69-3-3.5S2.55 3 4 3h4c1.45 0 3 1.69 3 3.5 0 1.41-.91 2.72-2 3.25V8.59c.58-.45 1-1.27 1-2.09C10 5.22 8.98 4 8 4H4c-.98 0-2 1.22-2 2.5S3 9 4 9zm9-3h-1v1h1c1 0 2 1.22 2 2.5S13.98 12 13 12H9c-.98 0-2-1.22-2-2.5 0-.83.42-1.64 1-2.09V6.25c-1.09.53-2 1.84-2 3.25C6 11.31 7.55 13 9 13h4c1.45 0 3-1.69 3-3.5S14.5 6 13 6z\"\n  }))), \"Nakamoto consensus\"), mdx(\"p\", null, mdx(\"em\", {\n    parentName: \"p\"\n  }, \"Behold Nakamoto, the genius I embody,\")), mdx(\"p\", null, mdx(\"em\", {\n    parentName: \"p\"\n  }, \"My PoW-powered kingdom, a realm so haughty.\")), mdx(\"p\", null, mdx(\"em\", {\n    parentName: \"p\"\n  }, \"With cryptographic hashes, I secure each block,\")), mdx(\"p\", null, mdx(\"em\", {\n    parentName: \"p\"\n  }, \"51% safety, it's an immutability lock.\")), mdx(\"p\", null, mdx(\"em\", {\n    parentName: \"p\"\n  }, \"In the realm of speed, I admit I'm a bit slow,\")), mdx(\"p\", null, mdx(\"em\", {\n    parentName: \"p\"\n  }, \"But my security's unmatched, a powerful show.\")), mdx(\"p\", null, mdx(\"em\", {\n    parentName: \"p\"\n  }, \"While I confirm transactions, adversaries I thwart,\")), mdx(\"p\", null, mdx(\"em\", {\n    parentName: \"p\"\n  }, \"In Nakamoto's world, trust, I have wrought.\")), mdx(\"p\", null, mdx(\"em\", {\n    parentName: \"p\"\n  }, \"A clash of features, let's delve deep,\")), mdx(\"p\", null, mdx(\"em\", {\n    parentName: \"p\"\n  }, \"Proof of Work, yes, but that's just one sweep.\")), mdx(\"p\", null, mdx(\"em\", {\n    parentName: \"p\"\n  }, \"With Merkle Trees, my transactions bind,\")), mdx(\"p\", null, mdx(\"em\", {\n    parentName: \"p\"\n  }, \"Efficiency and security, intertwined.\")), mdx(\"p\", null, mdx(\"em\", {\n    parentName: \"p\"\n  }, \"Decentralization, a core design,\")), mdx(\"p\", null, mdx(\"em\", {\n    parentName: \"p\"\n  }, \"No single point of control, a triumph so fine.\")), mdx(\"p\", null, mdx(\"em\", {\n    parentName: \"p\"\n  }, \"No need for trust, in the network we believe,\")), mdx(\"p\", null, mdx(\"em\", {\n    parentName: \"p\"\n  }, \"Nakamoto's creation, it's the key we achieve.\")), mdx(\"p\", null, mdx(\"em\", {\n    parentName: \"p\"\n  }, \"Robustness, Classical, you may claim,\")), mdx(\"p\", null, mdx(\"em\", {\n    parentName: \"p\"\n  }, \"But in Byzantine battles, I'll never be tame.\")), mdx(\"p\", null, mdx(\"em\", {\n    parentName: \"p\"\n  }, \"With each block confirmed, I cement my grace,\")), mdx(\"p\", null, mdx(\"em\", {\n    parentName: \"p\"\n  }, \"In the consensual confrontation, Nakamoto's ace.\")), mdx(\"h3\", {\n    \"id\": \"classical-consensus-1\",\n    \"style\": {\n      \"position\": \"relative\"\n    }\n  }, mdx(\"a\", {\n    parentName: \"h3\",\n    \"href\": \"#classical-consensus-1\",\n    \"aria-label\": \"classical consensus 1 permalink\",\n    \"className\": \"anchor before\"\n  }, mdx(\"svg\", {\n    parentName: \"a\",\n    \"aria-hidden\": \"true\",\n    \"focusable\": \"false\",\n    \"height\": \"16\",\n    \"version\": \"1.1\",\n    \"viewBox\": \"0 0 16 16\",\n    \"width\": \"16\"\n  }, mdx(\"path\", {\n    parentName: \"svg\",\n    \"fillRule\": \"evenodd\",\n    \"d\": \"M4 9h1v1H4c-1.5 0-3-1.69-3-3.5S2.55 3 4 3h4c1.45 0 3 1.69 3 3.5 0 1.41-.91 2.72-2 3.25V8.59c.58-.45 1-1.27 1-2.09C10 5.22 8.98 4 8 4H4c-.98 0-2 1.22-2 2.5S3 9 4 9zm9-3h-1v1h1c1 0 2 1.22 2 2.5S13.98 12 13 12H9c-.98 0-2-1.22-2-2.5 0-.83.42-1.64 1-2.09V6.25c-1.09.53-2 1.84-2 3.25C6 11.31 7.55 13 9 13h4c1.45 0 3-1.69 3-3.5S14.5 6 13 6z\"\n  }))), \"Classical consensus\"), mdx(\"p\", null, mdx(\"em\", {\n    parentName: \"p\"\n  }, \"Don't be fooled by Nakamoto's flashy art,\")), mdx(\"p\", null, mdx(\"em\", {\n    parentName: \"p\"\n  }, \"In Classical's realm, I play the smarter part.\")), mdx(\"p\", null, mdx(\"em\", {\n    parentName: \"p\"\n  }, \"Fault tolerance my sword, Byzantine foes, I tame,\")), mdx(\"p\", null, mdx(\"em\", {\n    parentName: \"p\"\n  }, \"In the face of complexity, I rise to fame.\")), mdx(\"p\", null, mdx(\"em\", {\n    parentName: \"p\"\n  }, \"Quick consensus, a feat that I achieve,\")), mdx(\"p\", null, mdx(\"em\", {\n    parentName: \"p\"\n  }, \"My quorums and thresholds, adversaries deceive.\")), mdx(\"p\", null, mdx(\"em\", {\n    parentName: \"p\"\n  }, \"Liveness my forte, transactions flow with grace,\")), mdx(\"p\", null, mdx(\"em\", {\n    parentName: \"p\"\n  }, \"In Classical's elegance, trust we embrace.\")), mdx(\"p\", null, mdx(\"em\", {\n    parentName: \"p\"\n  }, \"Nakamoto Consensus, your PoW may impress,\")), mdx(\"p\", null, mdx(\"em\", {\n    parentName: \"p\"\n  }, \"But in the world of robustness, I must confess,\")), mdx(\"p\", null, mdx(\"em\", {\n    parentName: \"p\"\n  }, \"My Byzantine strength, it's a resilient spree,\")), mdx(\"p\", null, mdx(\"em\", {\n    parentName: \"p\"\n  }, \"In the consensual confrontation, Classical's the key.\")), mdx(\"p\", null, mdx(\"em\", {\n    parentName: \"p\"\n  }, \"PoW's energy drain, a wasteful spree,\")), mdx(\"p\", null, mdx(\"em\", {\n    parentName: \"p\"\n  }, \"In Classical's realm, we do it differently.\")), mdx(\"p\", null, mdx(\"em\", {\n    parentName: \"p\"\n  }, \"Paxos, the pioneer, the domino seed.\")), mdx(\"p\", null, mdx(\"em\", {\n    parentName: \"p\"\n  }, \"Raft's simplicity, it's the way we lead.\")), mdx(\"p\", null, mdx(\"em\", {\n    parentName: \"p\"\n  }, \"Quick consensus, a breeze I maintain,\")), mdx(\"p\", null, mdx(\"em\", {\n    parentName: \"p\"\n  }, \"While Nakamoto's speed, it's a slowdown chain.\")), mdx(\"p\", null, mdx(\"em\", {\n    parentName: \"p\"\n  }, \"In the consensual confrontation, Nakamoto may compete,\")), mdx(\"p\", null, mdx(\"em\", {\n    parentName: \"p\"\n  }, \"But Classical's features, it's the ultimate treat.\")), mdx(\"h2\", {\n    \"id\": \"round-three-showdown\",\n    \"style\": {\n      \"position\": \"relative\"\n    }\n  }, mdx(\"a\", {\n    parentName: \"h2\",\n    \"href\": \"#round-three-showdown\",\n    \"aria-label\": \"round three showdown permalink\",\n    \"className\": \"anchor before\"\n  }, mdx(\"svg\", {\n    parentName: \"a\",\n    \"aria-hidden\": \"true\",\n    \"focusable\": \"false\",\n    \"height\": \"16\",\n    \"version\": \"1.1\",\n    \"viewBox\": \"0 0 16 16\",\n    \"width\": \"16\"\n  }, mdx(\"path\", {\n    parentName: \"svg\",\n    \"fillRule\": \"evenodd\",\n    \"d\": \"M4 9h1v1H4c-1.5 0-3-1.69-3-3.5S2.55 3 4 3h4c1.45 0 3 1.69 3 3.5 0 1.41-.91 2.72-2 3.25V8.59c.58-.45 1-1.27 1-2.09C10 5.22 8.98 4 8 4H4c-.98 0-2 1.22-2 2.5S3 9 4 9zm9-3h-1v1h1c1 0 2 1.22 2 2.5S13.98 12 13 12H9c-.98 0-2-1.22-2-2.5 0-.83.42-1.64 1-2.09V6.25c-1.09.53-2 1.84-2 3.25C6 11.31 7.55 13 9 13h4c1.45 0 3-1.69 3-3.5S14.5 6 13 6z\"\n  }))), \"Round Three: Showdown\"), mdx(\"h3\", {\n    \"id\": \"nakamoto-consensus-2\",\n    \"style\": {\n      \"position\": \"relative\"\n    }\n  }, mdx(\"a\", {\n    parentName: \"h3\",\n    \"href\": \"#nakamoto-consensus-2\",\n    \"aria-label\": \"nakamoto consensus 2 permalink\",\n    \"className\": \"anchor before\"\n  }, mdx(\"svg\", {\n    parentName: \"a\",\n    \"aria-hidden\": \"true\",\n    \"focusable\": \"false\",\n    \"height\": \"16\",\n    \"version\": \"1.1\",\n    \"viewBox\": \"0 0 16 16\",\n    \"width\": \"16\"\n  }, mdx(\"path\", {\n    parentName: \"svg\",\n    \"fillRule\": \"evenodd\",\n    \"d\": \"M4 9h1v1H4c-1.5 0-3-1.69-3-3.5S2.55 3 4 3h4c1.45 0 3 1.69 3 3.5 0 1.41-.91 2.72-2 3.25V8.59c.58-.45 1-1.27 1-2.09C10 5.22 8.98 4 8 4H4c-.98 0-2 1.22-2 2.5S3 9 4 9zm9-3h-1v1h1c1 0 2 1.22 2 2.5S13.98 12 13 12H9c-.98 0-2-1.22-2-2.5 0-.83.42-1.64 1-2.09V6.25c-1.09.53-2 1.84-2 3.25C6 11.31 7.55 13 9 13h4c1.45 0 3-1.69 3-3.5S14.5 6 13 6z\"\n  }))), \"Nakamoto consensus\"), mdx(\"p\", null, mdx(\"em\", {\n    parentName: \"p\"\n  }, \"In the real world, my applications thrive,\")), mdx(\"p\", null, mdx(\"em\", {\n    parentName: \"p\"\n  }, \"Bitcoin's success, a trailblazing drive.\")), mdx(\"p\", null, mdx(\"em\", {\n    parentName: \"p\"\n  }, \"Decentralized finance, it's my forte,\")), mdx(\"p\", null, mdx(\"em\", {\n    parentName: \"p\"\n  }, \"Smart contracts, NFTs, I lead the way.\")), mdx(\"p\", null, mdx(\"em\", {\n    parentName: \"p\"\n  }, \"From peer-to-peer payments to DeFi's prime,\")), mdx(\"p\", null, mdx(\"em\", {\n    parentName: \"p\"\n  }, \"In Nakamoto's realm, the future's mine.\")), mdx(\"p\", null, mdx(\"em\", {\n    parentName: \"p\"\n  }, \"Robust and secure, my blockchain's trust,\")), mdx(\"p\", null, mdx(\"em\", {\n    parentName: \"p\"\n  }, \"Real-world adoption, it's an absolute must.\")), mdx(\"h3\", {\n    \"id\": \"classical-consensus-2\",\n    \"style\": {\n      \"position\": \"relative\"\n    }\n  }, mdx(\"a\", {\n    parentName: \"h3\",\n    \"href\": \"#classical-consensus-2\",\n    \"aria-label\": \"classical consensus 2 permalink\",\n    \"className\": \"anchor before\"\n  }, mdx(\"svg\", {\n    parentName: \"a\",\n    \"aria-hidden\": \"true\",\n    \"focusable\": \"false\",\n    \"height\": \"16\",\n    \"version\": \"1.1\",\n    \"viewBox\": \"0 0 16 16\",\n    \"width\": \"16\"\n  }, mdx(\"path\", {\n    parentName: \"svg\",\n    \"fillRule\": \"evenodd\",\n    \"d\": \"M4 9h1v1H4c-1.5 0-3-1.69-3-3.5S2.55 3 4 3h4c1.45 0 3 1.69 3 3.5 0 1.41-.91 2.72-2 3.25V8.59c.58-.45 1-1.27 1-2.09C10 5.22 8.98 4 8 4H4c-.98 0-2 1.22-2 2.5S3 9 4 9zm9-3h-1v1h1c1 0 2 1.22 2 2.5S13.98 12 13 12H9c-.98 0-2-1.22-2-2.5 0-.83.42-1.64 1-2.09V6.25c-1.09.53-2 1.84-2 3.25C6 11.31 7.55 13 9 13h4c1.45 0 3-1.69 3-3.5S14.5 6 13 6z\"\n  }))), \"Classical consensus\"), mdx(\"p\", null, mdx(\"em\", {\n    parentName: \"p\"\n  }, \"No less I am in the application arena,\")), mdx(\"p\", null, mdx(\"em\", {\n    parentName: \"p\"\n  }, \"Heard of GFS, a massive store, nah?\")), mdx(\"p\", null, mdx(\"em\", {\n    parentName: \"p\"\n  }, \"A prime case, a massive data store,\")), mdx(\"p\", null, mdx(\"em\", {\n    parentName: \"p\"\n  }, \"My quorums and thresholds, a solid core.\")), mdx(\"p\", null, mdx(\"em\", {\n    parentName: \"p\"\n  }, \"In this battle of giants, each has a claim,\")), mdx(\"p\", null, mdx(\"em\", {\n    parentName: \"p\"\n  }, \"Nakamoto's innovation, Classical's practical aim.\")), mdx(\"p\", null, mdx(\"em\", {\n    parentName: \"p\"\n  }, \"Both have their strengths, both have their might,\")), mdx(\"p\", null, mdx(\"em\", {\n    parentName: \"p\"\n  }, \"But in the world of consensus, Classical's light.\")));\n}\n;\nMDXContent.isMDXComponent = true;","frontmatter":{"title":"Nakamoto consensus vs Classical consensus: A Rap Battle","date":"December 11th 2022","datetime":"2022-12-11T00:00:00.000Z","updated":"March 26th 2023","tags":["Distributed systems","Consensus algorithms"],"updated_datetime":"2023-03-26T00:00:00.000Z","description":"We look at the pros and cons between Nakamoto consensus and classical consensus through a rap battle.","toc":true},"excerpt":"Ladies and gentlemen, gather 'round, for a battle of the finest minds.\nIn the realm of consensus, a clash of legends, you'll find.\nClassical…","tableOfContents":{"items":[{"url":"#round-one-the-battle-of-origins","title":"Round One: The Battle of Origins","items":[{"url":"#classical-consensus","title":"Classical Consensus"},{"url":"#nakamoto-consensus","title":"Nakamoto consensus"}]},{"url":"#round-two-consensual-confrontation","title":"Round two: Consensual confrontation","items":[{"url":"#nakamoto-consensus-1","title":"Nakamoto consensus"},{"url":"#classical-consensus-1","title":"Classical consensus"}]},{"url":"#round-three-showdown","title":"Round Three: Showdown","items":[{"url":"#nakamoto-consensus-2","title":"Nakamoto consensus"},{"url":"#classical-consensus-2","title":"Classical consensus"}]}]},"timeToRead":3},"ogImage":{"childImageSharp":{"fixed":{"src":"/static/11cc25304259d9dd51b09ede8ab36439/e4d72/og-nakamoto-vs-classical-consensus.png"}}}},"pageContext":{"id":"518152d8-89d5-5f62-affb-b12cf05a015b","ogImageSlug":"og-nakamoto-vs-classical-consensus.png"}},"staticQueryHashes":["633160921"]}