{"componentChunkName":"component---src-components-post-layout-js","path":"/blog/audit-log-gorm/","result":{"data":{"mdx":{"id":"afbd3cd5-37a5-5a02-871e-cca5ca3c6e61","body":"var _excluded = [\"components\"];\n\nfunction _extends() { _extends = Object.assign || function (target) { for (var i = 1; i < arguments.length; i++) { var source = arguments[i]; for (var key in source) { if (Object.prototype.hasOwnProperty.call(source, key)) { target[key] = source[key]; } } } return target; }; return _extends.apply(this, arguments); }\n\nfunction _objectWithoutProperties(source, excluded) { if (source == null) return {}; var target = _objectWithoutPropertiesLoose(source, excluded); var key, i; if (Object.getOwnPropertySymbols) { var sourceSymbolKeys = Object.getOwnPropertySymbols(source); for (i = 0; i < sourceSymbolKeys.length; i++) { key = sourceSymbolKeys[i]; if (excluded.indexOf(key) >= 0) continue; if (!Object.prototype.propertyIsEnumerable.call(source, key)) continue; target[key] = source[key]; } } return target; }\n\nfunction _objectWithoutPropertiesLoose(source, excluded) { if (source == null) return {}; var target = {}; var sourceKeys = Object.keys(source); var key, i; for (i = 0; i < sourceKeys.length; i++) { key = sourceKeys[i]; if (excluded.indexOf(key) >= 0) continue; target[key] = source[key]; } return target; }\n\n/* @jsxRuntime classic */\n\n/* @jsx mdx */\nvar _frontmatter = {\n  \"title\": \"Implementing Audit Log using GORM in Go\",\n  \"date\": \"2023-07-14T00:00:00.000Z\",\n  \"published\": true,\n  \"tags\": [\"Go\", \"gORM\"],\n  \"description\": \"This is a tutorial for creating audit log in gorm using callbacks.\",\n  \"toc\": true,\n  \"seoImage\": \"og-audit-log-gorm.png\"\n};\nvar layoutProps = {\n  _frontmatter: _frontmatter\n};\nvar MDXLayout = \"wrapper\";\nreturn function MDXContent(_ref) {\n  var components = _ref.components,\n      props = _objectWithoutProperties(_ref, _excluded);\n\n  return mdx(MDXLayout, _extends({}, layoutProps, props, {\n    components: components,\n    mdxType: \"MDXLayout\"\n  }), mdx(\"p\", null, \"In many applications, it's essential to keep track of changes made to data in the database for auditing and debugging purposes. One common approach is to implement an audit log, which records information about the operations performed on the data. In this blog post, we will explore how to implement an audit log using GORM, a popular ORM library for Go.\"), mdx(Callout, {\n    mdxType: \"Callout\"\n  }, \"\\uD83D\\uDCA1 This tutorial assumes basic understanding of Golang and gORM.\"), mdx(\"h2\", {\n    \"id\": \"prerequisites\",\n    \"style\": {\n      \"position\": \"relative\"\n    }\n  }, mdx(\"a\", {\n    parentName: \"h2\",\n    \"href\": \"#prerequisites\",\n    \"aria-label\": \"prerequisites permalink\",\n    \"className\": \"anchor before\"\n  }, mdx(\"svg\", {\n    parentName: \"a\",\n    \"aria-hidden\": \"true\",\n    \"focusable\": \"false\",\n    \"height\": \"16\",\n    \"version\": \"1.1\",\n    \"viewBox\": \"0 0 16 16\",\n    \"width\": \"16\"\n  }, mdx(\"path\", {\n    parentName: \"svg\",\n    \"fillRule\": \"evenodd\",\n    \"d\": \"M4 9h1v1H4c-1.5 0-3-1.69-3-3.5S2.55 3 4 3h4c1.45 0 3 1.69 3 3.5 0 1.41-.91 2.72-2 3.25V8.59c.58-.45 1-1.27 1-2.09C10 5.22 8.98 4 8 4H4c-.98 0-2 1.22-2 2.5S3 9 4 9zm9-3h-1v1h1c1 0 2 1.22 2 2.5S13.98 12 13 12H9c-.98 0-2-1.22-2-2.5 0-.83.42-1.64 1-2.09V6.25c-1.09.53-2 1.84-2 3.25C6 11.31 7.55 13 9 13h4c1.45 0 3-1.69 3-3.5S14.5 6 13 6z\"\n  }))), \"Prerequisites\"), mdx(\"p\", null, \"Before we dive into the implementation, make sure you have the following prerequisites in place:\"), mdx(\"ul\", null, mdx(\"li\", {\n    parentName: \"ul\"\n  }, \"Go installed on your machine\"), mdx(\"li\", {\n    parentName: \"ul\"\n  }, \"GORM library installed (\", mdx(\"code\", {\n    parentName: \"li\",\n    \"className\": \"language-text\"\n  }, \"go get -u gorm.io/gorm\"), \")\"), mdx(\"li\", {\n    parentName: \"ul\"\n  }, \"SQLite database installed (\", mdx(\"code\", {\n    parentName: \"li\",\n    \"className\": \"language-text\"\n  }, \"go get -u gorm.io/driver/sqlite\"), \")\")), mdx(\"h2\", {\n    \"id\": \"initial-setup\",\n    \"style\": {\n      \"position\": \"relative\"\n    }\n  }, mdx(\"a\", {\n    parentName: \"h2\",\n    \"href\": \"#initial-setup\",\n    \"aria-label\": \"initial setup permalink\",\n    \"className\": \"anchor before\"\n  }, mdx(\"svg\", {\n    parentName: \"a\",\n    \"aria-hidden\": \"true\",\n    \"focusable\": \"false\",\n    \"height\": \"16\",\n    \"version\": \"1.1\",\n    \"viewBox\": \"0 0 16 16\",\n    \"width\": \"16\"\n  }, mdx(\"path\", {\n    parentName: \"svg\",\n    \"fillRule\": \"evenodd\",\n    \"d\": \"M4 9h1v1H4c-1.5 0-3-1.69-3-3.5S2.55 3 4 3h4c1.45 0 3 1.69 3 3.5 0 1.41-.91 2.72-2 3.25V8.59c.58-.45 1-1.27 1-2.09C10 5.22 8.98 4 8 4H4c-.98 0-2 1.22-2 2.5S3 9 4 9zm9-3h-1v1h1c1 0 2 1.22 2 2.5S13.98 12 13 12H9c-.98 0-2-1.22-2-2.5 0-.83.42-1.64 1-2.09V6.25c-1.09.53-2 1.84-2 3.25C6 11.31 7.55 13 9 13h4c1.45 0 3-1.69 3-3.5S14.5 6 13 6z\"\n  }))), \"Initial setup\"), mdx(\"p\", null, \"To get started, we need to set up a SQLite database and define the required models. In this example, we'll create a sample table called \", mdx(\"strong\", {\n    parentName: \"p\"\n  }, \"YourTable\"), \" to demonstrate the \", mdx(\"strong\", {\n    parentName: \"p\"\n  }, \"CREATE\"), \", \", mdx(\"strong\", {\n    parentName: \"p\"\n  }, \"UPDATE\"), \", and \", mdx(\"strong\", {\n    parentName: \"p\"\n  }, \"DELETE\"), \" operations.\"), mdx(\"p\", null, \"To set up the SQLite database and define the models, follow these steps:\"), mdx(\"ul\", null, mdx(\"li\", {\n    parentName: \"ul\"\n  }, mdx(\"p\", {\n    parentName: \"li\"\n  }, \"Connect to the SQLite database using GORM. Ensure that you import the necessary packages (\", mdx(\"code\", {\n    parentName: \"p\",\n    \"className\": \"language-text\"\n  }, \"gorm.io/gorm\"), \" and \", mdx(\"code\", {\n    parentName: \"p\",\n    \"className\": \"language-text\"\n  }, \"gorm.io/driver/sqlite\"), \").\")), mdx(\"li\", {\n    parentName: \"ul\"\n  }, mdx(\"p\", {\n    parentName: \"li\"\n  }, \"A \", mdx(\"strong\", {\n    parentName: \"p\"\n  }, \"YourTable\"), \" model struct is defined, which represents your application data. Sample fields are included such as \", mdx(\"code\", {\n    parentName: \"p\",\n    \"className\": \"language-text\"\n  }, \"Id\"), \", \", mdx(\"code\", {\n    parentName: \"p\",\n    \"className\": \"language-text\"\n  }, \"Name\"), \", \", mdx(\"code\", {\n    parentName: \"p\",\n    \"className\": \"language-text\"\n  }, \"Description\"), \", and \", mdx(\"code\", {\n    parentName: \"p\",\n    \"className\": \"language-text\"\n  }, \"CreatedAt\"), \".\")), mdx(\"li\", {\n    parentName: \"ul\"\n  }, mdx(\"p\", {\n    parentName: \"li\"\n  }, \"Use \", mdx(\"code\", {\n    parentName: \"p\",\n    \"className\": \"language-text\"\n  }, \"db.AutoMigrate(&YourTable{})\"), \" to automatically create or migrate the \", mdx(\"code\", {\n    parentName: \"p\",\n    \"className\": \"language-text\"\n  }, \"your_tables\"), \" table based on the defined model.\"))), mdx(\"p\", null, \"Here's an example of the sample audit log code:\"), mdx(\"div\", {\n    \"className\": \"gatsby-highlight\",\n    \"data-language\": \"go\"\n  }, mdx(\"pre\", {\n    parentName: \"div\",\n    \"className\": \"language-go\"\n  }, mdx(\"code\", {\n    parentName: \"pre\",\n    \"className\": \"language-go\"\n  }, mdx(\"span\", {\n    parentName: \"code\",\n    \"className\": \"token keyword\"\n  }, \"package\"), \" main\\n\\n\", mdx(\"span\", {\n    parentName: \"code\",\n    \"className\": \"token keyword\"\n  }, \"import\"), \" \", mdx(\"span\", {\n    parentName: \"code\",\n    \"className\": \"token punctuation\"\n  }, \"(\"), \"\\n\\t\", mdx(\"span\", {\n    parentName: \"code\",\n    \"className\": \"token string\"\n  }, \"\\\"encoding/json\\\"\"), \"\\n\\t\", mdx(\"span\", {\n    parentName: \"code\",\n    \"className\": \"token string\"\n  }, \"\\\"fmt\\\"\"), \"\\n\\t\", mdx(\"span\", {\n    parentName: \"code\",\n    \"className\": \"token string\"\n  }, \"\\\"reflect\\\"\"), \"\\n\\t\", mdx(\"span\", {\n    parentName: \"code\",\n    \"className\": \"token string\"\n  }, \"\\\"time\\\"\"), \"\\n\\n\\t\", mdx(\"span\", {\n    parentName: \"code\",\n    \"className\": \"token string\"\n  }, \"\\\"github.com/oklog/ulid/v2\\\"\"), \"\\n\\t\", mdx(\"span\", {\n    parentName: \"code\",\n    \"className\": \"token string\"\n  }, \"\\\"github.com/sirupsen/logrus\\\"\"), \"\\n\\t\", mdx(\"span\", {\n    parentName: \"code\",\n    \"className\": \"token string\"\n  }, \"\\\"gorm.io/datatypes\\\"\"), \"\\n\\t\", mdx(\"span\", {\n    parentName: \"code\",\n    \"className\": \"token string\"\n  }, \"\\\"gorm.io/driver/sqlite\\\"\"), \"\\n\\t\", mdx(\"span\", {\n    parentName: \"code\",\n    \"className\": \"token string\"\n  }, \"\\\"gorm.io/gorm\\\"\"), \"\\n\", mdx(\"span\", {\n    parentName: \"code\",\n    \"className\": \"token punctuation\"\n  }, \")\"), \"\\n\\n\", mdx(\"span\", {\n    parentName: \"code\",\n    \"className\": \"token comment\"\n  }, \"// YourTable represents sample table\"), \"\\n\", mdx(\"span\", {\n    parentName: \"code\",\n    \"className\": \"token keyword\"\n  }, \"type\"), \" YourTable \", mdx(\"span\", {\n    parentName: \"code\",\n    \"className\": \"token keyword\"\n  }, \"struct\"), \" \", mdx(\"span\", {\n    parentName: \"code\",\n    \"className\": \"token punctuation\"\n  }, \"{\"), \"\\n\\tId          \", mdx(\"span\", {\n    parentName: \"code\",\n    \"className\": \"token builtin\"\n  }, \"string\"), \"         \", mdx(\"span\", {\n    parentName: \"code\",\n    \"className\": \"token string\"\n  }, \"`json:\\\"id\\\" gorm:\\\"primaryKey\\\"`\"), \"\\n\\tName        \", mdx(\"span\", {\n    parentName: \"code\",\n    \"className\": \"token builtin\"\n  }, \"string\"), \"         \", mdx(\"span\", {\n    parentName: \"code\",\n    \"className\": \"token string\"\n  }, \"`json:\\\"name\\\"`\"), \"\\n\\tDescription \", mdx(\"span\", {\n    parentName: \"code\",\n    \"className\": \"token builtin\"\n  }, \"string\"), \"         \", mdx(\"span\", {\n    parentName: \"code\",\n    \"className\": \"token string\"\n  }, \"`json:\\\"description\\\"`\"), \"\\n\\tCreatedAt   time\", mdx(\"span\", {\n    parentName: \"code\",\n    \"className\": \"token punctuation\"\n  }, \".\"), \"Time      \", mdx(\"span\", {\n    parentName: \"code\",\n    \"className\": \"token string\"\n  }, \"`json:\\\"created_at\\\"`\"), \"\\n\\tUpdatedAt   time\", mdx(\"span\", {\n    parentName: \"code\",\n    \"className\": \"token punctuation\"\n  }, \".\"), \"Time      \", mdx(\"span\", {\n    parentName: \"code\",\n    \"className\": \"token string\"\n  }, \"`json:\\\"updated_at\\\"`\"), \"\\n\\tDeletedAt   gorm\", mdx(\"span\", {\n    parentName: \"code\",\n    \"className\": \"token punctuation\"\n  }, \".\"), \"DeletedAt \", mdx(\"span\", {\n    parentName: \"code\",\n    \"className\": \"token string\"\n  }, \"`json:\\\"deleted_at\\\"`\"), \"\\n\", mdx(\"span\", {\n    parentName: \"code\",\n    \"className\": \"token punctuation\"\n  }, \"}\"), \"\\n\\n\", mdx(\"span\", {\n    parentName: \"code\",\n    \"className\": \"token comment\"\n  }, \"// AuditLog represents the audit log model\"), \"\\n\", mdx(\"span\", {\n    parentName: \"code\",\n    \"className\": \"token keyword\"\n  }, \"type\"), \" AuditLog \", mdx(\"span\", {\n    parentName: \"code\",\n    \"className\": \"token keyword\"\n  }, \"struct\"), \" \", mdx(\"span\", {\n    parentName: \"code\",\n    \"className\": \"token punctuation\"\n  }, \"{\"), \"\\n\\tId            \", mdx(\"span\", {\n    parentName: \"code\",\n    \"className\": \"token builtin\"\n  }, \"string\"), \"         \", mdx(\"span\", {\n    parentName: \"code\",\n    \"className\": \"token string\"\n  }, \"`json:\\\"id\\\" gorm:\\\"primaryKey\\\"`\"), \"\\n\\tTableName     \", mdx(\"span\", {\n    parentName: \"code\",\n    \"className\": \"token builtin\"\n  }, \"string\"), \"         \", mdx(\"span\", {\n    parentName: \"code\",\n    \"className\": \"token string\"\n  }, \"`json:\\\"table_name\\\"`\"), \"\\n\\tOperationType \", mdx(\"span\", {\n    parentName: \"code\",\n    \"className\": \"token builtin\"\n  }, \"string\"), \"         \", mdx(\"span\", {\n    parentName: \"code\",\n    \"className\": \"token string\"\n  }, \"`json:\\\"operation_type\\\"`\"), \"\\n\\tObjectId      \", mdx(\"span\", {\n    parentName: \"code\",\n    \"className\": \"token builtin\"\n  }, \"string\"), \"         \", mdx(\"span\", {\n    parentName: \"code\",\n    \"className\": \"token string\"\n  }, \"`json:\\\"object_id\\\"`\"), \"\\n\\tData          datatypes\", mdx(\"span\", {\n    parentName: \"code\",\n    \"className\": \"token punctuation\"\n  }, \".\"), \"JSON \", mdx(\"span\", {\n    parentName: \"code\",\n    \"className\": \"token string\"\n  }, \"`json:\\\"data\\\"`\"), \"\\n\\tUserId        \", mdx(\"span\", {\n    parentName: \"code\",\n    \"className\": \"token builtin\"\n  }, \"string\"), \"         \", mdx(\"span\", {\n    parentName: \"code\",\n    \"className\": \"token string\"\n  }, \"`json:\\\"user_id\\\"`\"), \"\\n\\tCreatedAt     time\", mdx(\"span\", {\n    parentName: \"code\",\n    \"className\": \"token punctuation\"\n  }, \".\"), \"Time      \", mdx(\"span\", {\n    parentName: \"code\",\n    \"className\": \"token string\"\n  }, \"`json:\\\"created_at\\\"`\"), \"\\n\", mdx(\"span\", {\n    parentName: \"code\",\n    \"className\": \"token punctuation\"\n  }, \"}\"), \"\\n\\n\", mdx(\"span\", {\n    parentName: \"code\",\n    \"className\": \"token comment\"\n  }, \"// Sample method to retrieve user currently using the system\"), \"\\n\", mdx(\"span\", {\n    parentName: \"code\",\n    \"className\": \"token keyword\"\n  }, \"func\"), \" \", mdx(\"span\", {\n    parentName: \"code\",\n    \"className\": \"token function\"\n  }, \"getCurrentUser\"), mdx(\"span\", {\n    parentName: \"code\",\n    \"className\": \"token punctuation\"\n  }, \"(\"), mdx(\"span\", {\n    parentName: \"code\",\n    \"className\": \"token punctuation\"\n  }, \")\"), \" \", mdx(\"span\", {\n    parentName: \"code\",\n    \"className\": \"token builtin\"\n  }, \"string\"), \" \", mdx(\"span\", {\n    parentName: \"code\",\n    \"className\": \"token punctuation\"\n  }, \"{\"), \"\\n\\t\", mdx(\"span\", {\n    parentName: \"code\",\n    \"className\": \"token keyword\"\n  }, \"return\"), \" \", mdx(\"span\", {\n    parentName: \"code\",\n    \"className\": \"token string\"\n  }, \"\\\"admin\\\"\"), \"\\n\", mdx(\"span\", {\n    parentName: \"code\",\n    \"className\": \"token punctuation\"\n  }, \"}\"), \"\\n\\n\", mdx(\"span\", {\n    parentName: \"code\",\n    \"className\": \"token keyword\"\n  }, \"func\"), \" \", mdx(\"span\", {\n    parentName: \"code\",\n    \"className\": \"token function\"\n  }, \"main\"), mdx(\"span\", {\n    parentName: \"code\",\n    \"className\": \"token punctuation\"\n  }, \"(\"), mdx(\"span\", {\n    parentName: \"code\",\n    \"className\": \"token punctuation\"\n  }, \")\"), \" \", mdx(\"span\", {\n    parentName: \"code\",\n    \"className\": \"token punctuation\"\n  }, \"{\"), \"\\n\\t\", mdx(\"span\", {\n    parentName: \"code\",\n    \"className\": \"token comment\"\n  }, \"// Connect to the SQLite database\"), \"\\n\\tdb\", mdx(\"span\", {\n    parentName: \"code\",\n    \"className\": \"token punctuation\"\n  }, \",\"), \" err \", mdx(\"span\", {\n    parentName: \"code\",\n    \"className\": \"token operator\"\n  }, \":=\"), \" gorm\", mdx(\"span\", {\n    parentName: \"code\",\n    \"className\": \"token punctuation\"\n  }, \".\"), mdx(\"span\", {\n    parentName: \"code\",\n    \"className\": \"token function\"\n  }, \"Open\"), mdx(\"span\", {\n    parentName: \"code\",\n    \"className\": \"token punctuation\"\n  }, \"(\"), \"sqlite\", mdx(\"span\", {\n    parentName: \"code\",\n    \"className\": \"token punctuation\"\n  }, \".\"), mdx(\"span\", {\n    parentName: \"code\",\n    \"className\": \"token function\"\n  }, \"Open\"), mdx(\"span\", {\n    parentName: \"code\",\n    \"className\": \"token punctuation\"\n  }, \"(\"), mdx(\"span\", {\n    parentName: \"code\",\n    \"className\": \"token string\"\n  }, \"\\\"your_database.db\\\"\"), mdx(\"span\", {\n    parentName: \"code\",\n    \"className\": \"token punctuation\"\n  }, \")\"), mdx(\"span\", {\n    parentName: \"code\",\n    \"className\": \"token punctuation\"\n  }, \",\"), \" \", mdx(\"span\", {\n    parentName: \"code\",\n    \"className\": \"token operator\"\n  }, \"&\"), \"gorm\", mdx(\"span\", {\n    parentName: \"code\",\n    \"className\": \"token punctuation\"\n  }, \".\"), \"Config\", mdx(\"span\", {\n    parentName: \"code\",\n    \"className\": \"token punctuation\"\n  }, \"{\"), mdx(\"span\", {\n    parentName: \"code\",\n    \"className\": \"token punctuation\"\n  }, \"}\"), mdx(\"span\", {\n    parentName: \"code\",\n    \"className\": \"token punctuation\"\n  }, \")\"), \"\\n\\t\", mdx(\"span\", {\n    parentName: \"code\",\n    \"className\": \"token keyword\"\n  }, \"if\"), \" err \", mdx(\"span\", {\n    parentName: \"code\",\n    \"className\": \"token operator\"\n  }, \"!=\"), \" \", mdx(\"span\", {\n    parentName: \"code\",\n    \"className\": \"token boolean\"\n  }, \"nil\"), \" \", mdx(\"span\", {\n    parentName: \"code\",\n    \"className\": \"token punctuation\"\n  }, \"{\"), \"\\n\\t\\t\", mdx(\"span\", {\n    parentName: \"code\",\n    \"className\": \"token function\"\n  }, \"panic\"), mdx(\"span\", {\n    parentName: \"code\",\n    \"className\": \"token punctuation\"\n  }, \"(\"), mdx(\"span\", {\n    parentName: \"code\",\n    \"className\": \"token string\"\n  }, \"\\\"failed to connect to database\\\"\"), mdx(\"span\", {\n    parentName: \"code\",\n    \"className\": \"token punctuation\"\n  }, \")\"), \"\\n\\t\", mdx(\"span\", {\n    parentName: \"code\",\n    \"className\": \"token punctuation\"\n  }, \"}\"), \"\\n\\n\\tdb\", mdx(\"span\", {\n    parentName: \"code\",\n    \"className\": \"token punctuation\"\n  }, \".\"), mdx(\"span\", {\n    parentName: \"code\",\n    \"className\": \"token function\"\n  }, \"AutoMigrate\"), mdx(\"span\", {\n    parentName: \"code\",\n    \"className\": \"token punctuation\"\n  }, \"(\"), \"\\n\\t\\t\", mdx(\"span\", {\n    parentName: \"code\",\n    \"className\": \"token operator\"\n  }, \"&\"), \"YourTable\", mdx(\"span\", {\n    parentName: \"code\",\n    \"className\": \"token punctuation\"\n  }, \"{\"), mdx(\"span\", {\n    parentName: \"code\",\n    \"className\": \"token punctuation\"\n  }, \"}\"), mdx(\"span\", {\n    parentName: \"code\",\n    \"className\": \"token punctuation\"\n  }, \",\"), \"\\n\\t\\t\", mdx(\"span\", {\n    parentName: \"code\",\n    \"className\": \"token operator\"\n  }, \"&\"), \"AuditLog\", mdx(\"span\", {\n    parentName: \"code\",\n    \"className\": \"token punctuation\"\n  }, \"{\"), mdx(\"span\", {\n    parentName: \"code\",\n    \"className\": \"token punctuation\"\n  }, \"}\"), mdx(\"span\", {\n    parentName: \"code\",\n    \"className\": \"token punctuation\"\n  }, \",\"), \"\\n\\t\", mdx(\"span\", {\n    parentName: \"code\",\n    \"className\": \"token punctuation\"\n  }, \")\"), \"\\n\\n\\t\", mdx(\"span\", {\n    parentName: \"code\",\n    \"className\": \"token comment\"\n  }, \"// Register the audit log callbacks and perform migrations\"), \"\\n\\terr \", mdx(\"span\", {\n    parentName: \"code\",\n    \"className\": \"token operator\"\n  }, \"=\"), \" \", mdx(\"span\", {\n    parentName: \"code\",\n    \"className\": \"token function\"\n  }, \"RegisterCallbacks\"), mdx(\"span\", {\n    parentName: \"code\",\n    \"className\": \"token punctuation\"\n  }, \"(\"), \"db\", mdx(\"span\", {\n    parentName: \"code\",\n    \"className\": \"token punctuation\"\n  }, \")\"), \"\\n\\t\", mdx(\"span\", {\n    parentName: \"code\",\n    \"className\": \"token keyword\"\n  }, \"if\"), \" err \", mdx(\"span\", {\n    parentName: \"code\",\n    \"className\": \"token operator\"\n  }, \"!=\"), \" \", mdx(\"span\", {\n    parentName: \"code\",\n    \"className\": \"token boolean\"\n  }, \"nil\"), \" \", mdx(\"span\", {\n    parentName: \"code\",\n    \"className\": \"token punctuation\"\n  }, \"{\"), \"\\n\\t\\t\", mdx(\"span\", {\n    parentName: \"code\",\n    \"className\": \"token function\"\n  }, \"panic\"), mdx(\"span\", {\n    parentName: \"code\",\n    \"className\": \"token punctuation\"\n  }, \"(\"), mdx(\"span\", {\n    parentName: \"code\",\n    \"className\": \"token string\"\n  }, \"\\\"failed to register audit log callbacks\\\"\"), mdx(\"span\", {\n    parentName: \"code\",\n    \"className\": \"token punctuation\"\n  }, \")\"), \"\\n\\t\", mdx(\"span\", {\n    parentName: \"code\",\n    \"className\": \"token punctuation\"\n  }, \"}\"), \"\\n\\n\\tsampleTable \", mdx(\"span\", {\n    parentName: \"code\",\n    \"className\": \"token operator\"\n  }, \":=\"), \" \", mdx(\"span\", {\n    parentName: \"code\",\n    \"className\": \"token operator\"\n  }, \"&\"), \"YourTable\", mdx(\"span\", {\n    parentName: \"code\",\n    \"className\": \"token punctuation\"\n  }, \"{\"), \"\\n\\t\\tId\", mdx(\"span\", {\n    parentName: \"code\",\n    \"className\": \"token punctuation\"\n  }, \":\"), \"          ulid\", mdx(\"span\", {\n    parentName: \"code\",\n    \"className\": \"token punctuation\"\n  }, \".\"), mdx(\"span\", {\n    parentName: \"code\",\n    \"className\": \"token function\"\n  }, \"Make\"), mdx(\"span\", {\n    parentName: \"code\",\n    \"className\": \"token punctuation\"\n  }, \"(\"), mdx(\"span\", {\n    parentName: \"code\",\n    \"className\": \"token punctuation\"\n  }, \")\"), mdx(\"span\", {\n    parentName: \"code\",\n    \"className\": \"token punctuation\"\n  }, \".\"), mdx(\"span\", {\n    parentName: \"code\",\n    \"className\": \"token function\"\n  }, \"String\"), mdx(\"span\", {\n    parentName: \"code\",\n    \"className\": \"token punctuation\"\n  }, \"(\"), mdx(\"span\", {\n    parentName: \"code\",\n    \"className\": \"token punctuation\"\n  }, \")\"), mdx(\"span\", {\n    parentName: \"code\",\n    \"className\": \"token punctuation\"\n  }, \",\"), \"\\n\\t\\tName\", mdx(\"span\", {\n    parentName: \"code\",\n    \"className\": \"token punctuation\"\n  }, \":\"), \"        \", mdx(\"span\", {\n    parentName: \"code\",\n    \"className\": \"token string\"\n  }, \"\\\"John Doe\\\"\"), mdx(\"span\", {\n    parentName: \"code\",\n    \"className\": \"token punctuation\"\n  }, \",\"), \"\\n\\t\\tDescription\", mdx(\"span\", {\n    parentName: \"code\",\n    \"className\": \"token punctuation\"\n  }, \":\"), \" \", mdx(\"span\", {\n    parentName: \"code\",\n    \"className\": \"token string\"\n  }, \"\\\"This is a sample text\\\"\"), mdx(\"span\", {\n    parentName: \"code\",\n    \"className\": \"token punctuation\"\n  }, \",\"), \"\\n\\t\\tCreatedAt\", mdx(\"span\", {\n    parentName: \"code\",\n    \"className\": \"token punctuation\"\n  }, \":\"), \"   time\", mdx(\"span\", {\n    parentName: \"code\",\n    \"className\": \"token punctuation\"\n  }, \".\"), mdx(\"span\", {\n    parentName: \"code\",\n    \"className\": \"token function\"\n  }, \"Now\"), mdx(\"span\", {\n    parentName: \"code\",\n    \"className\": \"token punctuation\"\n  }, \"(\"), mdx(\"span\", {\n    parentName: \"code\",\n    \"className\": \"token punctuation\"\n  }, \")\"), mdx(\"span\", {\n    parentName: \"code\",\n    \"className\": \"token punctuation\"\n  }, \",\"), \"\\n\\t\", mdx(\"span\", {\n    parentName: \"code\",\n    \"className\": \"token punctuation\"\n  }, \"}\"), \"\\n\\n\\t\", mdx(\"span\", {\n    parentName: \"code\",\n    \"className\": \"token keyword\"\n  }, \"if\"), \" err \", mdx(\"span\", {\n    parentName: \"code\",\n    \"className\": \"token operator\"\n  }, \":=\"), \" db\", mdx(\"span\", {\n    parentName: \"code\",\n    \"className\": \"token punctuation\"\n  }, \".\"), mdx(\"span\", {\n    parentName: \"code\",\n    \"className\": \"token function\"\n  }, \"Create\"), mdx(\"span\", {\n    parentName: \"code\",\n    \"className\": \"token punctuation\"\n  }, \"(\"), mdx(\"span\", {\n    parentName: \"code\",\n    \"className\": \"token operator\"\n  }, \"&\"), \"sampleTable\", mdx(\"span\", {\n    parentName: \"code\",\n    \"className\": \"token punctuation\"\n  }, \")\"), mdx(\"span\", {\n    parentName: \"code\",\n    \"className\": \"token punctuation\"\n  }, \".\"), \"Error\", mdx(\"span\", {\n    parentName: \"code\",\n    \"className\": \"token punctuation\"\n  }, \";\"), \" err \", mdx(\"span\", {\n    parentName: \"code\",\n    \"className\": \"token operator\"\n  }, \"!=\"), \" \", mdx(\"span\", {\n    parentName: \"code\",\n    \"className\": \"token boolean\"\n  }, \"nil\"), \" \", mdx(\"span\", {\n    parentName: \"code\",\n    \"className\": \"token punctuation\"\n  }, \"{\"), \"\\n\\t\\t\", mdx(\"span\", {\n    parentName: \"code\",\n    \"className\": \"token function\"\n  }, \"panic\"), mdx(\"span\", {\n    parentName: \"code\",\n    \"className\": \"token punctuation\"\n  }, \"(\"), \"err\", mdx(\"span\", {\n    parentName: \"code\",\n    \"className\": \"token punctuation\"\n  }, \")\"), \"\\n\\t\", mdx(\"span\", {\n    parentName: \"code\",\n    \"className\": \"token punctuation\"\n  }, \"}\"), \"\\n\\n\\tsampleTable\", mdx(\"span\", {\n    parentName: \"code\",\n    \"className\": \"token punctuation\"\n  }, \".\"), \"Description \", mdx(\"span\", {\n    parentName: \"code\",\n    \"className\": \"token operator\"\n  }, \"=\"), \" \", mdx(\"span\", {\n    parentName: \"code\",\n    \"className\": \"token string\"\n  }, \"\\\"Changed description\\\"\"), \"\\n\\n\\t\", mdx(\"span\", {\n    parentName: \"code\",\n    \"className\": \"token keyword\"\n  }, \"if\"), \" err \", mdx(\"span\", {\n    parentName: \"code\",\n    \"className\": \"token operator\"\n  }, \":=\"), \" db\", mdx(\"span\", {\n    parentName: \"code\",\n    \"className\": \"token punctuation\"\n  }, \".\"), mdx(\"span\", {\n    parentName: \"code\",\n    \"className\": \"token function\"\n  }, \"Save\"), mdx(\"span\", {\n    parentName: \"code\",\n    \"className\": \"token punctuation\"\n  }, \"(\"), mdx(\"span\", {\n    parentName: \"code\",\n    \"className\": \"token operator\"\n  }, \"&\"), \"sampleTable\", mdx(\"span\", {\n    parentName: \"code\",\n    \"className\": \"token punctuation\"\n  }, \")\"), mdx(\"span\", {\n    parentName: \"code\",\n    \"className\": \"token punctuation\"\n  }, \".\"), \"Error\", mdx(\"span\", {\n    parentName: \"code\",\n    \"className\": \"token punctuation\"\n  }, \";\"), \" err \", mdx(\"span\", {\n    parentName: \"code\",\n    \"className\": \"token operator\"\n  }, \"!=\"), \" \", mdx(\"span\", {\n    parentName: \"code\",\n    \"className\": \"token boolean\"\n  }, \"nil\"), \" \", mdx(\"span\", {\n    parentName: \"code\",\n    \"className\": \"token punctuation\"\n  }, \"{\"), \"\\n\\t\\t\", mdx(\"span\", {\n    parentName: \"code\",\n    \"className\": \"token function\"\n  }, \"panic\"), mdx(\"span\", {\n    parentName: \"code\",\n    \"className\": \"token punctuation\"\n  }, \"(\"), \"err\", mdx(\"span\", {\n    parentName: \"code\",\n    \"className\": \"token punctuation\"\n  }, \")\"), \"\\n\\t\", mdx(\"span\", {\n    parentName: \"code\",\n    \"className\": \"token punctuation\"\n  }, \"}\"), \"\\n\\n\\t\", mdx(\"span\", {\n    parentName: \"code\",\n    \"className\": \"token keyword\"\n  }, \"if\"), \" err \", mdx(\"span\", {\n    parentName: \"code\",\n    \"className\": \"token operator\"\n  }, \":=\"), \" db\", mdx(\"span\", {\n    parentName: \"code\",\n    \"className\": \"token punctuation\"\n  }, \".\"), mdx(\"span\", {\n    parentName: \"code\",\n    \"className\": \"token function\"\n  }, \"Delete\"), mdx(\"span\", {\n    parentName: \"code\",\n    \"className\": \"token punctuation\"\n  }, \"(\"), mdx(\"span\", {\n    parentName: \"code\",\n    \"className\": \"token operator\"\n  }, \"&\"), \"sampleTable\", mdx(\"span\", {\n    parentName: \"code\",\n    \"className\": \"token punctuation\"\n  }, \")\"), mdx(\"span\", {\n    parentName: \"code\",\n    \"className\": \"token punctuation\"\n  }, \".\"), \"Error\", mdx(\"span\", {\n    parentName: \"code\",\n    \"className\": \"token punctuation\"\n  }, \";\"), \" err \", mdx(\"span\", {\n    parentName: \"code\",\n    \"className\": \"token operator\"\n  }, \"!=\"), \" \", mdx(\"span\", {\n    parentName: \"code\",\n    \"className\": \"token boolean\"\n  }, \"nil\"), \" \", mdx(\"span\", {\n    parentName: \"code\",\n    \"className\": \"token punctuation\"\n  }, \"{\"), \"\\n\\t\\t\", mdx(\"span\", {\n    parentName: \"code\",\n    \"className\": \"token function\"\n  }, \"panic\"), mdx(\"span\", {\n    parentName: \"code\",\n    \"className\": \"token punctuation\"\n  }, \"(\"), \"err\", mdx(\"span\", {\n    parentName: \"code\",\n    \"className\": \"token punctuation\"\n  }, \")\"), \"\\n\\t\", mdx(\"span\", {\n    parentName: \"code\",\n    \"className\": \"token punctuation\"\n  }, \"}\"), \"\\n\\n\\tauditLogs \", mdx(\"span\", {\n    parentName: \"code\",\n    \"className\": \"token operator\"\n  }, \":=\"), \" \", mdx(\"span\", {\n    parentName: \"code\",\n    \"className\": \"token punctuation\"\n  }, \"[\"), mdx(\"span\", {\n    parentName: \"code\",\n    \"className\": \"token punctuation\"\n  }, \"]\"), mdx(\"span\", {\n    parentName: \"code\",\n    \"className\": \"token operator\"\n  }, \"*\"), \"AuditLog\", mdx(\"span\", {\n    parentName: \"code\",\n    \"className\": \"token punctuation\"\n  }, \"{\"), mdx(\"span\", {\n    parentName: \"code\",\n    \"className\": \"token punctuation\"\n  }, \"}\"), \"\\n\\n\\t\", mdx(\"span\", {\n    parentName: \"code\",\n    \"className\": \"token keyword\"\n  }, \"if\"), \" err \", mdx(\"span\", {\n    parentName: \"code\",\n    \"className\": \"token operator\"\n  }, \":=\"), \" db\", mdx(\"span\", {\n    parentName: \"code\",\n    \"className\": \"token punctuation\"\n  }, \".\"), mdx(\"span\", {\n    parentName: \"code\",\n    \"className\": \"token function\"\n  }, \"Find\"), mdx(\"span\", {\n    parentName: \"code\",\n    \"className\": \"token punctuation\"\n  }, \"(\"), mdx(\"span\", {\n    parentName: \"code\",\n    \"className\": \"token operator\"\n  }, \"&\"), \"auditLogs\", mdx(\"span\", {\n    parentName: \"code\",\n    \"className\": \"token punctuation\"\n  }, \")\"), mdx(\"span\", {\n    parentName: \"code\",\n    \"className\": \"token punctuation\"\n  }, \".\"), \"Error\", mdx(\"span\", {\n    parentName: \"code\",\n    \"className\": \"token punctuation\"\n  }, \";\"), \" err \", mdx(\"span\", {\n    parentName: \"code\",\n    \"className\": \"token operator\"\n  }, \"!=\"), \" \", mdx(\"span\", {\n    parentName: \"code\",\n    \"className\": \"token boolean\"\n  }, \"nil\"), \" \", mdx(\"span\", {\n    parentName: \"code\",\n    \"className\": \"token punctuation\"\n  }, \"{\"), \"\\n\\t\\t\", mdx(\"span\", {\n    parentName: \"code\",\n    \"className\": \"token function\"\n  }, \"panic\"), mdx(\"span\", {\n    parentName: \"code\",\n    \"className\": \"token punctuation\"\n  }, \"(\"), \"err\", mdx(\"span\", {\n    parentName: \"code\",\n    \"className\": \"token punctuation\"\n  }, \")\"), \"\\n\\t\", mdx(\"span\", {\n    parentName: \"code\",\n    \"className\": \"token punctuation\"\n  }, \"}\"), \"\\n\\n    \", mdx(\"span\", {\n    parentName: \"code\",\n    \"className\": \"token comment\"\n  }, \"// Print the audit logs to view them. You should see a CREATE, UPDATE and DELETE log.\"), \"\\n\\n\", mdx(\"span\", {\n    parentName: \"code\",\n    \"className\": \"token punctuation\"\n  }, \"}\"), \"\\n\\n\", mdx(\"span\", {\n    parentName: \"code\",\n    \"className\": \"token keyword\"\n  }, \"func\"), \" \", mdx(\"span\", {\n    parentName: \"code\",\n    \"className\": \"token function\"\n  }, \"getKeyFromData\"), mdx(\"span\", {\n    parentName: \"code\",\n    \"className\": \"token punctuation\"\n  }, \"(\"), \"key \", mdx(\"span\", {\n    parentName: \"code\",\n    \"className\": \"token builtin\"\n  }, \"string\"), mdx(\"span\", {\n    parentName: \"code\",\n    \"className\": \"token punctuation\"\n  }, \",\"), \" data \", mdx(\"span\", {\n    parentName: \"code\",\n    \"className\": \"token keyword\"\n  }, \"map\"), mdx(\"span\", {\n    parentName: \"code\",\n    \"className\": \"token punctuation\"\n  }, \"[\"), mdx(\"span\", {\n    parentName: \"code\",\n    \"className\": \"token builtin\"\n  }, \"string\"), mdx(\"span\", {\n    parentName: \"code\",\n    \"className\": \"token punctuation\"\n  }, \"]\"), mdx(\"span\", {\n    parentName: \"code\",\n    \"className\": \"token keyword\"\n  }, \"interface\"), mdx(\"span\", {\n    parentName: \"code\",\n    \"className\": \"token punctuation\"\n  }, \"{\"), mdx(\"span\", {\n    parentName: \"code\",\n    \"className\": \"token punctuation\"\n  }, \"}\"), mdx(\"span\", {\n    parentName: \"code\",\n    \"className\": \"token punctuation\"\n  }, \")\"), \" \", mdx(\"span\", {\n    parentName: \"code\",\n    \"className\": \"token builtin\"\n  }, \"string\"), \" \", mdx(\"span\", {\n    parentName: \"code\",\n    \"className\": \"token punctuation\"\n  }, \"{\"), \"\\n\\tobjId\", mdx(\"span\", {\n    parentName: \"code\",\n    \"className\": \"token punctuation\"\n  }, \",\"), \" ok \", mdx(\"span\", {\n    parentName: \"code\",\n    \"className\": \"token operator\"\n  }, \":=\"), \" data\", mdx(\"span\", {\n    parentName: \"code\",\n    \"className\": \"token punctuation\"\n  }, \"[\"), \"key\", mdx(\"span\", {\n    parentName: \"code\",\n    \"className\": \"token punctuation\"\n  }, \"]\"), \"\\n\\t\", mdx(\"span\", {\n    parentName: \"code\",\n    \"className\": \"token keyword\"\n  }, \"if\"), \" \", mdx(\"span\", {\n    parentName: \"code\",\n    \"className\": \"token operator\"\n  }, \"!\"), \"ok \", mdx(\"span\", {\n    parentName: \"code\",\n    \"className\": \"token punctuation\"\n  }, \"{\"), \"\\n\\t\\t\", mdx(\"span\", {\n    parentName: \"code\",\n    \"className\": \"token keyword\"\n  }, \"return\"), \" \", mdx(\"span\", {\n    parentName: \"code\",\n    \"className\": \"token string\"\n  }, \"\\\"\\\"\"), \"\\n\\t\", mdx(\"span\", {\n    parentName: \"code\",\n    \"className\": \"token punctuation\"\n  }, \"}\"), \"\\n\\t\", mdx(\"span\", {\n    parentName: \"code\",\n    \"className\": \"token keyword\"\n  }, \"return\"), \" objId\", mdx(\"span\", {\n    parentName: \"code\",\n    \"className\": \"token punctuation\"\n  }, \".\"), mdx(\"span\", {\n    parentName: \"code\",\n    \"className\": \"token punctuation\"\n  }, \"(\"), mdx(\"span\", {\n    parentName: \"code\",\n    \"className\": \"token builtin\"\n  }, \"string\"), mdx(\"span\", {\n    parentName: \"code\",\n    \"className\": \"token punctuation\"\n  }, \")\"), \"\\n\", mdx(\"span\", {\n    parentName: \"code\",\n    \"className\": \"token punctuation\"\n  }, \"}\"), \"\\n\\n\", mdx(\"span\", {\n    parentName: \"code\",\n    \"className\": \"token keyword\"\n  }, \"func\"), \" \", mdx(\"span\", {\n    parentName: \"code\",\n    \"className\": \"token function\"\n  }, \"prepareData\"), mdx(\"span\", {\n    parentName: \"code\",\n    \"className\": \"token punctuation\"\n  }, \"(\"), \"data \", mdx(\"span\", {\n    parentName: \"code\",\n    \"className\": \"token keyword\"\n  }, \"map\"), mdx(\"span\", {\n    parentName: \"code\",\n    \"className\": \"token punctuation\"\n  }, \"[\"), mdx(\"span\", {\n    parentName: \"code\",\n    \"className\": \"token builtin\"\n  }, \"string\"), mdx(\"span\", {\n    parentName: \"code\",\n    \"className\": \"token punctuation\"\n  }, \"]\"), mdx(\"span\", {\n    parentName: \"code\",\n    \"className\": \"token keyword\"\n  }, \"interface\"), mdx(\"span\", {\n    parentName: \"code\",\n    \"className\": \"token punctuation\"\n  }, \"{\"), mdx(\"span\", {\n    parentName: \"code\",\n    \"className\": \"token punctuation\"\n  }, \"}\"), mdx(\"span\", {\n    parentName: \"code\",\n    \"className\": \"token punctuation\"\n  }, \")\"), \" datatypes\", mdx(\"span\", {\n    parentName: \"code\",\n    \"className\": \"token punctuation\"\n  }, \".\"), \"JSON \", mdx(\"span\", {\n    parentName: \"code\",\n    \"className\": \"token punctuation\"\n  }, \"{\"), \"\\n\\tdataByte\", mdx(\"span\", {\n    parentName: \"code\",\n    \"className\": \"token punctuation\"\n  }, \",\"), \" \", mdx(\"span\", {\n    parentName: \"code\",\n    \"className\": \"token boolean\"\n  }, \"_\"), \" \", mdx(\"span\", {\n    parentName: \"code\",\n    \"className\": \"token operator\"\n  }, \":=\"), \" json\", mdx(\"span\", {\n    parentName: \"code\",\n    \"className\": \"token punctuation\"\n  }, \".\"), mdx(\"span\", {\n    parentName: \"code\",\n    \"className\": \"token function\"\n  }, \"Marshal\"), mdx(\"span\", {\n    parentName: \"code\",\n    \"className\": \"token punctuation\"\n  }, \"(\"), mdx(\"span\", {\n    parentName: \"code\",\n    \"className\": \"token operator\"\n  }, \"&\"), \"data\", mdx(\"span\", {\n    parentName: \"code\",\n    \"className\": \"token punctuation\"\n  }, \")\"), \"\\n\\t\", mdx(\"span\", {\n    parentName: \"code\",\n    \"className\": \"token keyword\"\n  }, \"return\"), \" dataByte\\n\", mdx(\"span\", {\n    parentName: \"code\",\n    \"className\": \"token punctuation\"\n  }, \"}\"), \"\\n\\n\", mdx(\"span\", {\n    parentName: \"code\",\n    \"className\": \"token keyword\"\n  }, \"func\"), \" \", mdx(\"span\", {\n    parentName: \"code\",\n    \"className\": \"token function\"\n  }, \"createAuditLog\"), mdx(\"span\", {\n    parentName: \"code\",\n    \"className\": \"token punctuation\"\n  }, \"(\"), \"db \", mdx(\"span\", {\n    parentName: \"code\",\n    \"className\": \"token operator\"\n  }, \"*\"), \"gorm\", mdx(\"span\", {\n    parentName: \"code\",\n    \"className\": \"token punctuation\"\n  }, \".\"), \"DB\", mdx(\"span\", {\n    parentName: \"code\",\n    \"className\": \"token punctuation\"\n  }, \")\"), \" \", mdx(\"span\", {\n    parentName: \"code\",\n    \"className\": \"token punctuation\"\n  }, \"{\"), \"\\n\\t\", mdx(\"span\", {\n    parentName: \"code\",\n    \"className\": \"token keyword\"\n  }, \"if\"), \" db\", mdx(\"span\", {\n    parentName: \"code\",\n    \"className\": \"token punctuation\"\n  }, \".\"), \"Statement\", mdx(\"span\", {\n    parentName: \"code\",\n    \"className\": \"token punctuation\"\n  }, \".\"), \"Schema \", mdx(\"span\", {\n    parentName: \"code\",\n    \"className\": \"token operator\"\n  }, \"!=\"), \" \", mdx(\"span\", {\n    parentName: \"code\",\n    \"className\": \"token boolean\"\n  }, \"nil\"), \" \", mdx(\"span\", {\n    parentName: \"code\",\n    \"className\": \"token operator\"\n  }, \"&&\"), \" db\", mdx(\"span\", {\n    parentName: \"code\",\n    \"className\": \"token punctuation\"\n  }, \".\"), \"Statement\", mdx(\"span\", {\n    parentName: \"code\",\n    \"className\": \"token punctuation\"\n  }, \".\"), \"Schema\", mdx(\"span\", {\n    parentName: \"code\",\n    \"className\": \"token punctuation\"\n  }, \".\"), \"Table \", mdx(\"span\", {\n    parentName: \"code\",\n    \"className\": \"token operator\"\n  }, \"==\"), \" \", mdx(\"span\", {\n    parentName: \"code\",\n    \"className\": \"token string\"\n  }, \"\\\"audit_logs\\\"\"), \" \", mdx(\"span\", {\n    parentName: \"code\",\n    \"className\": \"token operator\"\n  }, \"||\"), \" db\", mdx(\"span\", {\n    parentName: \"code\",\n    \"className\": \"token punctuation\"\n  }, \".\"), \"Error \", mdx(\"span\", {\n    parentName: \"code\",\n    \"className\": \"token operator\"\n  }, \"!=\"), \" \", mdx(\"span\", {\n    parentName: \"code\",\n    \"className\": \"token boolean\"\n  }, \"nil\"), \" \", mdx(\"span\", {\n    parentName: \"code\",\n    \"className\": \"token punctuation\"\n  }, \"{\"), \"\\n\\t\\t\", mdx(\"span\", {\n    parentName: \"code\",\n    \"className\": \"token keyword\"\n  }, \"return\"), \"\\n\\t\", mdx(\"span\", {\n    parentName: \"code\",\n    \"className\": \"token punctuation\"\n  }, \"}\"), \"\\n\\n\\trecordMap\", mdx(\"span\", {\n    parentName: \"code\",\n    \"className\": \"token punctuation\"\n  }, \",\"), \" err \", mdx(\"span\", {\n    parentName: \"code\",\n    \"className\": \"token operator\"\n  }, \":=\"), \" \", mdx(\"span\", {\n    parentName: \"code\",\n    \"className\": \"token function\"\n  }, \"getDataBeforeOperation\"), mdx(\"span\", {\n    parentName: \"code\",\n    \"className\": \"token punctuation\"\n  }, \"(\"), \"db\", mdx(\"span\", {\n    parentName: \"code\",\n    \"className\": \"token punctuation\"\n  }, \")\"), \"\\n\\t\", mdx(\"span\", {\n    parentName: \"code\",\n    \"className\": \"token keyword\"\n  }, \"if\"), \" err \", mdx(\"span\", {\n    parentName: \"code\",\n    \"className\": \"token operator\"\n  }, \"!=\"), \" \", mdx(\"span\", {\n    parentName: \"code\",\n    \"className\": \"token boolean\"\n  }, \"nil\"), \" \", mdx(\"span\", {\n    parentName: \"code\",\n    \"className\": \"token punctuation\"\n  }, \"{\"), \"\\n\\t\\t\", mdx(\"span\", {\n    parentName: \"code\",\n    \"className\": \"token keyword\"\n  }, \"return\"), \"\\n\\t\", mdx(\"span\", {\n    parentName: \"code\",\n    \"className\": \"token punctuation\"\n  }, \"}\"), \"\\n\\tobjId \", mdx(\"span\", {\n    parentName: \"code\",\n    \"className\": \"token operator\"\n  }, \":=\"), \" \", mdx(\"span\", {\n    parentName: \"code\",\n    \"className\": \"token function\"\n  }, \"getKeyFromData\"), mdx(\"span\", {\n    parentName: \"code\",\n    \"className\": \"token punctuation\"\n  }, \"(\"), mdx(\"span\", {\n    parentName: \"code\",\n    \"className\": \"token string\"\n  }, \"\\\"id\\\"\"), mdx(\"span\", {\n    parentName: \"code\",\n    \"className\": \"token punctuation\"\n  }, \",\"), \" recordMap\", mdx(\"span\", {\n    parentName: \"code\",\n    \"className\": \"token punctuation\"\n  }, \")\"), \"\\n\\tauditLog \", mdx(\"span\", {\n    parentName: \"code\",\n    \"className\": \"token operator\"\n  }, \":=\"), \" \", mdx(\"span\", {\n    parentName: \"code\",\n    \"className\": \"token operator\"\n  }, \"&\"), \"AuditLog\", mdx(\"span\", {\n    parentName: \"code\",\n    \"className\": \"token punctuation\"\n  }, \"{\"), \"\\n\\t\\tId\", mdx(\"span\", {\n    parentName: \"code\",\n    \"className\": \"token punctuation\"\n  }, \":\"), \"            ulid\", mdx(\"span\", {\n    parentName: \"code\",\n    \"className\": \"token punctuation\"\n  }, \".\"), mdx(\"span\", {\n    parentName: \"code\",\n    \"className\": \"token function\"\n  }, \"Make\"), mdx(\"span\", {\n    parentName: \"code\",\n    \"className\": \"token punctuation\"\n  }, \"(\"), mdx(\"span\", {\n    parentName: \"code\",\n    \"className\": \"token punctuation\"\n  }, \")\"), mdx(\"span\", {\n    parentName: \"code\",\n    \"className\": \"token punctuation\"\n  }, \".\"), mdx(\"span\", {\n    parentName: \"code\",\n    \"className\": \"token function\"\n  }, \"String\"), mdx(\"span\", {\n    parentName: \"code\",\n    \"className\": \"token punctuation\"\n  }, \"(\"), mdx(\"span\", {\n    parentName: \"code\",\n    \"className\": \"token punctuation\"\n  }, \")\"), mdx(\"span\", {\n    parentName: \"code\",\n    \"className\": \"token punctuation\"\n  }, \",\"), \"\\n\\t\\tTableName\", mdx(\"span\", {\n    parentName: \"code\",\n    \"className\": \"token punctuation\"\n  }, \":\"), \"     db\", mdx(\"span\", {\n    parentName: \"code\",\n    \"className\": \"token punctuation\"\n  }, \".\"), \"Statement\", mdx(\"span\", {\n    parentName: \"code\",\n    \"className\": \"token punctuation\"\n  }, \".\"), \"Schema\", mdx(\"span\", {\n    parentName: \"code\",\n    \"className\": \"token punctuation\"\n  }, \".\"), \"Table\", mdx(\"span\", {\n    parentName: \"code\",\n    \"className\": \"token punctuation\"\n  }, \",\"), \"\\n\\t\\tOperationType\", mdx(\"span\", {\n    parentName: \"code\",\n    \"className\": \"token punctuation\"\n  }, \":\"), \" \", mdx(\"span\", {\n    parentName: \"code\",\n    \"className\": \"token string\"\n  }, \"\\\"CREATE\\\"\"), mdx(\"span\", {\n    parentName: \"code\",\n    \"className\": \"token punctuation\"\n  }, \",\"), \"\\n\\t\\tObjectId\", mdx(\"span\", {\n    parentName: \"code\",\n    \"className\": \"token punctuation\"\n  }, \":\"), \"      objId\", mdx(\"span\", {\n    parentName: \"code\",\n    \"className\": \"token punctuation\"\n  }, \",\"), \"\\n\\t\\tData\", mdx(\"span\", {\n    parentName: \"code\",\n    \"className\": \"token punctuation\"\n  }, \":\"), \"          \", mdx(\"span\", {\n    parentName: \"code\",\n    \"className\": \"token function\"\n  }, \"prepareData\"), mdx(\"span\", {\n    parentName: \"code\",\n    \"className\": \"token punctuation\"\n  }, \"(\"), \"recordMap\", mdx(\"span\", {\n    parentName: \"code\",\n    \"className\": \"token punctuation\"\n  }, \")\"), mdx(\"span\", {\n    parentName: \"code\",\n    \"className\": \"token punctuation\"\n  }, \",\"), \"\\n\\t\\tUserId\", mdx(\"span\", {\n    parentName: \"code\",\n    \"className\": \"token punctuation\"\n  }, \":\"), \"        \", mdx(\"span\", {\n    parentName: \"code\",\n    \"className\": \"token function\"\n  }, \"getCurrentUser\"), mdx(\"span\", {\n    parentName: \"code\",\n    \"className\": \"token punctuation\"\n  }, \"(\"), mdx(\"span\", {\n    parentName: \"code\",\n    \"className\": \"token punctuation\"\n  }, \")\"), mdx(\"span\", {\n    parentName: \"code\",\n    \"className\": \"token punctuation\"\n  }, \",\"), \"\\n\\t\", mdx(\"span\", {\n    parentName: \"code\",\n    \"className\": \"token punctuation\"\n  }, \"}\"), \"\\n\\t\", mdx(\"span\", {\n    parentName: \"code\",\n    \"className\": \"token keyword\"\n  }, \"if\"), \" err \", mdx(\"span\", {\n    parentName: \"code\",\n    \"className\": \"token operator\"\n  }, \":=\"), \" db\", mdx(\"span\", {\n    parentName: \"code\",\n    \"className\": \"token punctuation\"\n  }, \".\"), mdx(\"span\", {\n    parentName: \"code\",\n    \"className\": \"token function\"\n  }, \"Session\"), mdx(\"span\", {\n    parentName: \"code\",\n    \"className\": \"token punctuation\"\n  }, \"(\"), mdx(\"span\", {\n    parentName: \"code\",\n    \"className\": \"token operator\"\n  }, \"&\"), \"gorm\", mdx(\"span\", {\n    parentName: \"code\",\n    \"className\": \"token punctuation\"\n  }, \".\"), \"Session\", mdx(\"span\", {\n    parentName: \"code\",\n    \"className\": \"token punctuation\"\n  }, \"{\"), \"SkipHooks\", mdx(\"span\", {\n    parentName: \"code\",\n    \"className\": \"token punctuation\"\n  }, \":\"), \" \", mdx(\"span\", {\n    parentName: \"code\",\n    \"className\": \"token boolean\"\n  }, \"true\"), mdx(\"span\", {\n    parentName: \"code\",\n    \"className\": \"token punctuation\"\n  }, \",\"), \" NewDB\", mdx(\"span\", {\n    parentName: \"code\",\n    \"className\": \"token punctuation\"\n  }, \":\"), \" \", mdx(\"span\", {\n    parentName: \"code\",\n    \"className\": \"token boolean\"\n  }, \"true\"), mdx(\"span\", {\n    parentName: \"code\",\n    \"className\": \"token punctuation\"\n  }, \"}\"), mdx(\"span\", {\n    parentName: \"code\",\n    \"className\": \"token punctuation\"\n  }, \")\"), mdx(\"span\", {\n    parentName: \"code\",\n    \"className\": \"token punctuation\"\n  }, \".\"), mdx(\"span\", {\n    parentName: \"code\",\n    \"className\": \"token function\"\n  }, \"Table\"), mdx(\"span\", {\n    parentName: \"code\",\n    \"className\": \"token punctuation\"\n  }, \"(\"), mdx(\"span\", {\n    parentName: \"code\",\n    \"className\": \"token string\"\n  }, \"\\\"audit_logs\\\"\"), mdx(\"span\", {\n    parentName: \"code\",\n    \"className\": \"token punctuation\"\n  }, \")\"), mdx(\"span\", {\n    parentName: \"code\",\n    \"className\": \"token punctuation\"\n  }, \".\"), mdx(\"span\", {\n    parentName: \"code\",\n    \"className\": \"token function\"\n  }, \"Create\"), mdx(\"span\", {\n    parentName: \"code\",\n    \"className\": \"token punctuation\"\n  }, \"(\"), \"auditLog\", mdx(\"span\", {\n    parentName: \"code\",\n    \"className\": \"token punctuation\"\n  }, \")\"), mdx(\"span\", {\n    parentName: \"code\",\n    \"className\": \"token punctuation\"\n  }, \".\"), \"Error\", mdx(\"span\", {\n    parentName: \"code\",\n    \"className\": \"token punctuation\"\n  }, \";\"), \" err \", mdx(\"span\", {\n    parentName: \"code\",\n    \"className\": \"token operator\"\n  }, \"!=\"), \" \", mdx(\"span\", {\n    parentName: \"code\",\n    \"className\": \"token boolean\"\n  }, \"nil\"), \" \", mdx(\"span\", {\n    parentName: \"code\",\n    \"className\": \"token punctuation\"\n  }, \"{\"), \"\\n\\t\\tlogrus\", mdx(\"span\", {\n    parentName: \"code\",\n    \"className\": \"token punctuation\"\n  }, \".\"), mdx(\"span\", {\n    parentName: \"code\",\n    \"className\": \"token function\"\n  }, \"Error\"), mdx(\"span\", {\n    parentName: \"code\",\n    \"className\": \"token punctuation\"\n  }, \"(\"), \"fmt\", mdx(\"span\", {\n    parentName: \"code\",\n    \"className\": \"token punctuation\"\n  }, \".\"), mdx(\"span\", {\n    parentName: \"code\",\n    \"className\": \"token function\"\n  }, \"Errorf\"), mdx(\"span\", {\n    parentName: \"code\",\n    \"className\": \"token punctuation\"\n  }, \"(\"), mdx(\"span\", {\n    parentName: \"code\",\n    \"className\": \"token string\"\n  }, \"\\\"error in audit log creation: %s\\\"\"), mdx(\"span\", {\n    parentName: \"code\",\n    \"className\": \"token punctuation\"\n  }, \",\"), \" err\", mdx(\"span\", {\n    parentName: \"code\",\n    \"className\": \"token punctuation\"\n  }, \".\"), mdx(\"span\", {\n    parentName: \"code\",\n    \"className\": \"token function\"\n  }, \"Error\"), mdx(\"span\", {\n    parentName: \"code\",\n    \"className\": \"token punctuation\"\n  }, \"(\"), mdx(\"span\", {\n    parentName: \"code\",\n    \"className\": \"token punctuation\"\n  }, \")\"), mdx(\"span\", {\n    parentName: \"code\",\n    \"className\": \"token punctuation\"\n  }, \")\"), mdx(\"span\", {\n    parentName: \"code\",\n    \"className\": \"token punctuation\"\n  }, \")\"), \"\\n\\t\\t\", mdx(\"span\", {\n    parentName: \"code\",\n    \"className\": \"token keyword\"\n  }, \"return\"), \"\\n\\t\", mdx(\"span\", {\n    parentName: \"code\",\n    \"className\": \"token punctuation\"\n  }, \"}\"), \"\\n\", mdx(\"span\", {\n    parentName: \"code\",\n    \"className\": \"token punctuation\"\n  }, \"}\"), \"\\n\\n\", mdx(\"span\", {\n    parentName: \"code\",\n    \"className\": \"token keyword\"\n  }, \"func\"), \" \", mdx(\"span\", {\n    parentName: \"code\",\n    \"className\": \"token function\"\n  }, \"updateAuditLog\"), mdx(\"span\", {\n    parentName: \"code\",\n    \"className\": \"token punctuation\"\n  }, \"(\"), \"db \", mdx(\"span\", {\n    parentName: \"code\",\n    \"className\": \"token operator\"\n  }, \"*\"), \"gorm\", mdx(\"span\", {\n    parentName: \"code\",\n    \"className\": \"token punctuation\"\n  }, \".\"), \"DB\", mdx(\"span\", {\n    parentName: \"code\",\n    \"className\": \"token punctuation\"\n  }, \")\"), \" \", mdx(\"span\", {\n    parentName: \"code\",\n    \"className\": \"token punctuation\"\n  }, \"{\"), \"\\n\\t\", mdx(\"span\", {\n    parentName: \"code\",\n    \"className\": \"token keyword\"\n  }, \"if\"), \" db\", mdx(\"span\", {\n    parentName: \"code\",\n    \"className\": \"token punctuation\"\n  }, \".\"), \"Statement\", mdx(\"span\", {\n    parentName: \"code\",\n    \"className\": \"token punctuation\"\n  }, \".\"), \"Schema \", mdx(\"span\", {\n    parentName: \"code\",\n    \"className\": \"token operator\"\n  }, \"!=\"), \" \", mdx(\"span\", {\n    parentName: \"code\",\n    \"className\": \"token boolean\"\n  }, \"nil\"), \" \", mdx(\"span\", {\n    parentName: \"code\",\n    \"className\": \"token operator\"\n  }, \"&&\"), \" db\", mdx(\"span\", {\n    parentName: \"code\",\n    \"className\": \"token punctuation\"\n  }, \".\"), \"Statement\", mdx(\"span\", {\n    parentName: \"code\",\n    \"className\": \"token punctuation\"\n  }, \".\"), \"Schema\", mdx(\"span\", {\n    parentName: \"code\",\n    \"className\": \"token punctuation\"\n  }, \".\"), \"Table \", mdx(\"span\", {\n    parentName: \"code\",\n    \"className\": \"token operator\"\n  }, \"==\"), \" \", mdx(\"span\", {\n    parentName: \"code\",\n    \"className\": \"token string\"\n  }, \"\\\"audit_logs\\\"\"), \" \", mdx(\"span\", {\n    parentName: \"code\",\n    \"className\": \"token operator\"\n  }, \"||\"), \" db\", mdx(\"span\", {\n    parentName: \"code\",\n    \"className\": \"token punctuation\"\n  }, \".\"), \"Error \", mdx(\"span\", {\n    parentName: \"code\",\n    \"className\": \"token operator\"\n  }, \"!=\"), \" \", mdx(\"span\", {\n    parentName: \"code\",\n    \"className\": \"token boolean\"\n  }, \"nil\"), \" \", mdx(\"span\", {\n    parentName: \"code\",\n    \"className\": \"token punctuation\"\n  }, \"{\"), \"\\n\\t\\t\", mdx(\"span\", {\n    parentName: \"code\",\n    \"className\": \"token keyword\"\n  }, \"return\"), \"\\n\\t\", mdx(\"span\", {\n    parentName: \"code\",\n    \"className\": \"token punctuation\"\n  }, \"}\"), \"\\n\\n\\trecordMap\", mdx(\"span\", {\n    parentName: \"code\",\n    \"className\": \"token punctuation\"\n  }, \",\"), \" err \", mdx(\"span\", {\n    parentName: \"code\",\n    \"className\": \"token operator\"\n  }, \":=\"), \" \", mdx(\"span\", {\n    parentName: \"code\",\n    \"className\": \"token function\"\n  }, \"getDataBeforeOperation\"), mdx(\"span\", {\n    parentName: \"code\",\n    \"className\": \"token punctuation\"\n  }, \"(\"), \"db\", mdx(\"span\", {\n    parentName: \"code\",\n    \"className\": \"token punctuation\"\n  }, \")\"), \"\\n\\t\", mdx(\"span\", {\n    parentName: \"code\",\n    \"className\": \"token keyword\"\n  }, \"if\"), \" err \", mdx(\"span\", {\n    parentName: \"code\",\n    \"className\": \"token operator\"\n  }, \"!=\"), \" \", mdx(\"span\", {\n    parentName: \"code\",\n    \"className\": \"token boolean\"\n  }, \"nil\"), \" \", mdx(\"span\", {\n    parentName: \"code\",\n    \"className\": \"token punctuation\"\n  }, \"{\"), \"\\n\\t\\t\", mdx(\"span\", {\n    parentName: \"code\",\n    \"className\": \"token keyword\"\n  }, \"return\"), \"\\n\\t\", mdx(\"span\", {\n    parentName: \"code\",\n    \"className\": \"token punctuation\"\n  }, \"}\"), \"\\n\\tobjId \", mdx(\"span\", {\n    parentName: \"code\",\n    \"className\": \"token operator\"\n  }, \":=\"), \" \", mdx(\"span\", {\n    parentName: \"code\",\n    \"className\": \"token function\"\n  }, \"getKeyFromData\"), mdx(\"span\", {\n    parentName: \"code\",\n    \"className\": \"token punctuation\"\n  }, \"(\"), mdx(\"span\", {\n    parentName: \"code\",\n    \"className\": \"token string\"\n  }, \"\\\"id\\\"\"), mdx(\"span\", {\n    parentName: \"code\",\n    \"className\": \"token punctuation\"\n  }, \",\"), \" recordMap\", mdx(\"span\", {\n    parentName: \"code\",\n    \"className\": \"token punctuation\"\n  }, \")\"), \"\\n\\tauditLog \", mdx(\"span\", {\n    parentName: \"code\",\n    \"className\": \"token operator\"\n  }, \":=\"), \" \", mdx(\"span\", {\n    parentName: \"code\",\n    \"className\": \"token operator\"\n  }, \"&\"), \"AuditLog\", mdx(\"span\", {\n    parentName: \"code\",\n    \"className\": \"token punctuation\"\n  }, \"{\"), \"\\n\\t\\tId\", mdx(\"span\", {\n    parentName: \"code\",\n    \"className\": \"token punctuation\"\n  }, \":\"), \"            ulid\", mdx(\"span\", {\n    parentName: \"code\",\n    \"className\": \"token punctuation\"\n  }, \".\"), mdx(\"span\", {\n    parentName: \"code\",\n    \"className\": \"token function\"\n  }, \"Make\"), mdx(\"span\", {\n    parentName: \"code\",\n    \"className\": \"token punctuation\"\n  }, \"(\"), mdx(\"span\", {\n    parentName: \"code\",\n    \"className\": \"token punctuation\"\n  }, \")\"), mdx(\"span\", {\n    parentName: \"code\",\n    \"className\": \"token punctuation\"\n  }, \".\"), mdx(\"span\", {\n    parentName: \"code\",\n    \"className\": \"token function\"\n  }, \"String\"), mdx(\"span\", {\n    parentName: \"code\",\n    \"className\": \"token punctuation\"\n  }, \"(\"), mdx(\"span\", {\n    parentName: \"code\",\n    \"className\": \"token punctuation\"\n  }, \")\"), mdx(\"span\", {\n    parentName: \"code\",\n    \"className\": \"token punctuation\"\n  }, \",\"), \"\\n\\t\\tTableName\", mdx(\"span\", {\n    parentName: \"code\",\n    \"className\": \"token punctuation\"\n  }, \":\"), \"     db\", mdx(\"span\", {\n    parentName: \"code\",\n    \"className\": \"token punctuation\"\n  }, \".\"), \"Statement\", mdx(\"span\", {\n    parentName: \"code\",\n    \"className\": \"token punctuation\"\n  }, \".\"), \"Schema\", mdx(\"span\", {\n    parentName: \"code\",\n    \"className\": \"token punctuation\"\n  }, \".\"), \"Table\", mdx(\"span\", {\n    parentName: \"code\",\n    \"className\": \"token punctuation\"\n  }, \",\"), \"\\n\\t\\tOperationType\", mdx(\"span\", {\n    parentName: \"code\",\n    \"className\": \"token punctuation\"\n  }, \":\"), \" \", mdx(\"span\", {\n    parentName: \"code\",\n    \"className\": \"token string\"\n  }, \"\\\"UPDATE\\\"\"), mdx(\"span\", {\n    parentName: \"code\",\n    \"className\": \"token punctuation\"\n  }, \",\"), \"\\n\\t\\tObjectId\", mdx(\"span\", {\n    parentName: \"code\",\n    \"className\": \"token punctuation\"\n  }, \":\"), \"      objId\", mdx(\"span\", {\n    parentName: \"code\",\n    \"className\": \"token punctuation\"\n  }, \",\"), \"\\n\\t\\tData\", mdx(\"span\", {\n    parentName: \"code\",\n    \"className\": \"token punctuation\"\n  }, \":\"), \"          \", mdx(\"span\", {\n    parentName: \"code\",\n    \"className\": \"token function\"\n  }, \"prepareData\"), mdx(\"span\", {\n    parentName: \"code\",\n    \"className\": \"token punctuation\"\n  }, \"(\"), \"recordMap\", mdx(\"span\", {\n    parentName: \"code\",\n    \"className\": \"token punctuation\"\n  }, \")\"), mdx(\"span\", {\n    parentName: \"code\",\n    \"className\": \"token punctuation\"\n  }, \",\"), \"\\n\\t\\tUserId\", mdx(\"span\", {\n    parentName: \"code\",\n    \"className\": \"token punctuation\"\n  }, \":\"), \"        \", mdx(\"span\", {\n    parentName: \"code\",\n    \"className\": \"token function\"\n  }, \"getCurrentUser\"), mdx(\"span\", {\n    parentName: \"code\",\n    \"className\": \"token punctuation\"\n  }, \"(\"), mdx(\"span\", {\n    parentName: \"code\",\n    \"className\": \"token punctuation\"\n  }, \")\"), mdx(\"span\", {\n    parentName: \"code\",\n    \"className\": \"token punctuation\"\n  }, \",\"), \"\\n\\t\", mdx(\"span\", {\n    parentName: \"code\",\n    \"className\": \"token punctuation\"\n  }, \"}\"), \"\\n\\t\", mdx(\"span\", {\n    parentName: \"code\",\n    \"className\": \"token keyword\"\n  }, \"if\"), \" err \", mdx(\"span\", {\n    parentName: \"code\",\n    \"className\": \"token operator\"\n  }, \":=\"), \" db\", mdx(\"span\", {\n    parentName: \"code\",\n    \"className\": \"token punctuation\"\n  }, \".\"), mdx(\"span\", {\n    parentName: \"code\",\n    \"className\": \"token function\"\n  }, \"Session\"), mdx(\"span\", {\n    parentName: \"code\",\n    \"className\": \"token punctuation\"\n  }, \"(\"), mdx(\"span\", {\n    parentName: \"code\",\n    \"className\": \"token operator\"\n  }, \"&\"), \"gorm\", mdx(\"span\", {\n    parentName: \"code\",\n    \"className\": \"token punctuation\"\n  }, \".\"), \"Session\", mdx(\"span\", {\n    parentName: \"code\",\n    \"className\": \"token punctuation\"\n  }, \"{\"), \"SkipHooks\", mdx(\"span\", {\n    parentName: \"code\",\n    \"className\": \"token punctuation\"\n  }, \":\"), \" \", mdx(\"span\", {\n    parentName: \"code\",\n    \"className\": \"token boolean\"\n  }, \"true\"), mdx(\"span\", {\n    parentName: \"code\",\n    \"className\": \"token punctuation\"\n  }, \",\"), \" NewDB\", mdx(\"span\", {\n    parentName: \"code\",\n    \"className\": \"token punctuation\"\n  }, \":\"), \" \", mdx(\"span\", {\n    parentName: \"code\",\n    \"className\": \"token boolean\"\n  }, \"true\"), mdx(\"span\", {\n    parentName: \"code\",\n    \"className\": \"token punctuation\"\n  }, \"}\"), mdx(\"span\", {\n    parentName: \"code\",\n    \"className\": \"token punctuation\"\n  }, \")\"), mdx(\"span\", {\n    parentName: \"code\",\n    \"className\": \"token punctuation\"\n  }, \".\"), mdx(\"span\", {\n    parentName: \"code\",\n    \"className\": \"token function\"\n  }, \"Table\"), mdx(\"span\", {\n    parentName: \"code\",\n    \"className\": \"token punctuation\"\n  }, \"(\"), mdx(\"span\", {\n    parentName: \"code\",\n    \"className\": \"token string\"\n  }, \"\\\"audit_logs\\\"\"), mdx(\"span\", {\n    parentName: \"code\",\n    \"className\": \"token punctuation\"\n  }, \")\"), mdx(\"span\", {\n    parentName: \"code\",\n    \"className\": \"token punctuation\"\n  }, \".\"), mdx(\"span\", {\n    parentName: \"code\",\n    \"className\": \"token function\"\n  }, \"Create\"), mdx(\"span\", {\n    parentName: \"code\",\n    \"className\": \"token punctuation\"\n  }, \"(\"), \"auditLog\", mdx(\"span\", {\n    parentName: \"code\",\n    \"className\": \"token punctuation\"\n  }, \")\"), mdx(\"span\", {\n    parentName: \"code\",\n    \"className\": \"token punctuation\"\n  }, \".\"), \"Error\", mdx(\"span\", {\n    parentName: \"code\",\n    \"className\": \"token punctuation\"\n  }, \";\"), \" err \", mdx(\"span\", {\n    parentName: \"code\",\n    \"className\": \"token operator\"\n  }, \"!=\"), \" \", mdx(\"span\", {\n    parentName: \"code\",\n    \"className\": \"token boolean\"\n  }, \"nil\"), \" \", mdx(\"span\", {\n    parentName: \"code\",\n    \"className\": \"token punctuation\"\n  }, \"{\"), \"\\n\\t\\tlogrus\", mdx(\"span\", {\n    parentName: \"code\",\n    \"className\": \"token punctuation\"\n  }, \".\"), mdx(\"span\", {\n    parentName: \"code\",\n    \"className\": \"token function\"\n  }, \"Error\"), mdx(\"span\", {\n    parentName: \"code\",\n    \"className\": \"token punctuation\"\n  }, \"(\"), \"fmt\", mdx(\"span\", {\n    parentName: \"code\",\n    \"className\": \"token punctuation\"\n  }, \".\"), mdx(\"span\", {\n    parentName: \"code\",\n    \"className\": \"token function\"\n  }, \"Errorf\"), mdx(\"span\", {\n    parentName: \"code\",\n    \"className\": \"token punctuation\"\n  }, \"(\"), mdx(\"span\", {\n    parentName: \"code\",\n    \"className\": \"token string\"\n  }, \"\\\"error in audit log creation: %s\\\"\"), mdx(\"span\", {\n    parentName: \"code\",\n    \"className\": \"token punctuation\"\n  }, \",\"), \" err\", mdx(\"span\", {\n    parentName: \"code\",\n    \"className\": \"token punctuation\"\n  }, \".\"), mdx(\"span\", {\n    parentName: \"code\",\n    \"className\": \"token function\"\n  }, \"Error\"), mdx(\"span\", {\n    parentName: \"code\",\n    \"className\": \"token punctuation\"\n  }, \"(\"), mdx(\"span\", {\n    parentName: \"code\",\n    \"className\": \"token punctuation\"\n  }, \")\"), mdx(\"span\", {\n    parentName: \"code\",\n    \"className\": \"token punctuation\"\n  }, \")\"), mdx(\"span\", {\n    parentName: \"code\",\n    \"className\": \"token punctuation\"\n  }, \")\"), \"\\n\\t\\t\", mdx(\"span\", {\n    parentName: \"code\",\n    \"className\": \"token keyword\"\n  }, \"return\"), \"\\n\\t\", mdx(\"span\", {\n    parentName: \"code\",\n    \"className\": \"token punctuation\"\n  }, \"}\"), \"\\n\", mdx(\"span\", {\n    parentName: \"code\",\n    \"className\": \"token punctuation\"\n  }, \"}\"), \"\\n\\n\", mdx(\"span\", {\n    parentName: \"code\",\n    \"className\": \"token keyword\"\n  }, \"func\"), \" \", mdx(\"span\", {\n    parentName: \"code\",\n    \"className\": \"token function\"\n  }, \"deleteAuditLog\"), mdx(\"span\", {\n    parentName: \"code\",\n    \"className\": \"token punctuation\"\n  }, \"(\"), \"db \", mdx(\"span\", {\n    parentName: \"code\",\n    \"className\": \"token operator\"\n  }, \"*\"), \"gorm\", mdx(\"span\", {\n    parentName: \"code\",\n    \"className\": \"token punctuation\"\n  }, \".\"), \"DB\", mdx(\"span\", {\n    parentName: \"code\",\n    \"className\": \"token punctuation\"\n  }, \")\"), \" \", mdx(\"span\", {\n    parentName: \"code\",\n    \"className\": \"token punctuation\"\n  }, \"{\"), \"\\n\\t\", mdx(\"span\", {\n    parentName: \"code\",\n    \"className\": \"token keyword\"\n  }, \"if\"), \" db\", mdx(\"span\", {\n    parentName: \"code\",\n    \"className\": \"token punctuation\"\n  }, \".\"), \"Statement\", mdx(\"span\", {\n    parentName: \"code\",\n    \"className\": \"token punctuation\"\n  }, \".\"), \"Schema \", mdx(\"span\", {\n    parentName: \"code\",\n    \"className\": \"token operator\"\n  }, \"!=\"), \" \", mdx(\"span\", {\n    parentName: \"code\",\n    \"className\": \"token boolean\"\n  }, \"nil\"), \" \", mdx(\"span\", {\n    parentName: \"code\",\n    \"className\": \"token operator\"\n  }, \"&&\"), \" db\", mdx(\"span\", {\n    parentName: \"code\",\n    \"className\": \"token punctuation\"\n  }, \".\"), \"Statement\", mdx(\"span\", {\n    parentName: \"code\",\n    \"className\": \"token punctuation\"\n  }, \".\"), \"Schema\", mdx(\"span\", {\n    parentName: \"code\",\n    \"className\": \"token punctuation\"\n  }, \".\"), \"Table \", mdx(\"span\", {\n    parentName: \"code\",\n    \"className\": \"token operator\"\n  }, \"==\"), \" \", mdx(\"span\", {\n    parentName: \"code\",\n    \"className\": \"token string\"\n  }, \"\\\"audit_logs\\\"\"), \" \", mdx(\"span\", {\n    parentName: \"code\",\n    \"className\": \"token operator\"\n  }, \"||\"), \" db\", mdx(\"span\", {\n    parentName: \"code\",\n    \"className\": \"token punctuation\"\n  }, \".\"), \"Error \", mdx(\"span\", {\n    parentName: \"code\",\n    \"className\": \"token operator\"\n  }, \"!=\"), \" \", mdx(\"span\", {\n    parentName: \"code\",\n    \"className\": \"token boolean\"\n  }, \"nil\"), \" \", mdx(\"span\", {\n    parentName: \"code\",\n    \"className\": \"token punctuation\"\n  }, \"{\"), \"\\n\\t\\t\", mdx(\"span\", {\n    parentName: \"code\",\n    \"className\": \"token keyword\"\n  }, \"return\"), \"\\n\\t\", mdx(\"span\", {\n    parentName: \"code\",\n    \"className\": \"token punctuation\"\n  }, \"}\"), \"\\n\\n\\trecordMap\", mdx(\"span\", {\n    parentName: \"code\",\n    \"className\": \"token punctuation\"\n  }, \",\"), \" err \", mdx(\"span\", {\n    parentName: \"code\",\n    \"className\": \"token operator\"\n  }, \":=\"), \" \", mdx(\"span\", {\n    parentName: \"code\",\n    \"className\": \"token function\"\n  }, \"getDataBeforeOperation\"), mdx(\"span\", {\n    parentName: \"code\",\n    \"className\": \"token punctuation\"\n  }, \"(\"), \"db\", mdx(\"span\", {\n    parentName: \"code\",\n    \"className\": \"token punctuation\"\n  }, \")\"), \"\\n\\t\", mdx(\"span\", {\n    parentName: \"code\",\n    \"className\": \"token keyword\"\n  }, \"if\"), \" err \", mdx(\"span\", {\n    parentName: \"code\",\n    \"className\": \"token operator\"\n  }, \"!=\"), \" \", mdx(\"span\", {\n    parentName: \"code\",\n    \"className\": \"token boolean\"\n  }, \"nil\"), \" \", mdx(\"span\", {\n    parentName: \"code\",\n    \"className\": \"token punctuation\"\n  }, \"{\"), \"\\n\\t\\t\", mdx(\"span\", {\n    parentName: \"code\",\n    \"className\": \"token keyword\"\n  }, \"return\"), \"\\n\\t\", mdx(\"span\", {\n    parentName: \"code\",\n    \"className\": \"token punctuation\"\n  }, \"}\"), \"\\n\\tobjId \", mdx(\"span\", {\n    parentName: \"code\",\n    \"className\": \"token operator\"\n  }, \":=\"), \" \", mdx(\"span\", {\n    parentName: \"code\",\n    \"className\": \"token function\"\n  }, \"getKeyFromData\"), mdx(\"span\", {\n    parentName: \"code\",\n    \"className\": \"token punctuation\"\n  }, \"(\"), mdx(\"span\", {\n    parentName: \"code\",\n    \"className\": \"token string\"\n  }, \"\\\"id\\\"\"), mdx(\"span\", {\n    parentName: \"code\",\n    \"className\": \"token punctuation\"\n  }, \",\"), \" recordMap\", mdx(\"span\", {\n    parentName: \"code\",\n    \"className\": \"token punctuation\"\n  }, \")\"), \"\\n\\tauditLog \", mdx(\"span\", {\n    parentName: \"code\",\n    \"className\": \"token operator\"\n  }, \":=\"), \" \", mdx(\"span\", {\n    parentName: \"code\",\n    \"className\": \"token operator\"\n  }, \"&\"), \"AuditLog\", mdx(\"span\", {\n    parentName: \"code\",\n    \"className\": \"token punctuation\"\n  }, \"{\"), \"\\n\\t\\tId\", mdx(\"span\", {\n    parentName: \"code\",\n    \"className\": \"token punctuation\"\n  }, \":\"), \"            ulid\", mdx(\"span\", {\n    parentName: \"code\",\n    \"className\": \"token punctuation\"\n  }, \".\"), mdx(\"span\", {\n    parentName: \"code\",\n    \"className\": \"token function\"\n  }, \"Make\"), mdx(\"span\", {\n    parentName: \"code\",\n    \"className\": \"token punctuation\"\n  }, \"(\"), mdx(\"span\", {\n    parentName: \"code\",\n    \"className\": \"token punctuation\"\n  }, \")\"), mdx(\"span\", {\n    parentName: \"code\",\n    \"className\": \"token punctuation\"\n  }, \".\"), mdx(\"span\", {\n    parentName: \"code\",\n    \"className\": \"token function\"\n  }, \"String\"), mdx(\"span\", {\n    parentName: \"code\",\n    \"className\": \"token punctuation\"\n  }, \"(\"), mdx(\"span\", {\n    parentName: \"code\",\n    \"className\": \"token punctuation\"\n  }, \")\"), mdx(\"span\", {\n    parentName: \"code\",\n    \"className\": \"token punctuation\"\n  }, \",\"), \"\\n\\t\\tTableName\", mdx(\"span\", {\n    parentName: \"code\",\n    \"className\": \"token punctuation\"\n  }, \":\"), \"     db\", mdx(\"span\", {\n    parentName: \"code\",\n    \"className\": \"token punctuation\"\n  }, \".\"), \"Statement\", mdx(\"span\", {\n    parentName: \"code\",\n    \"className\": \"token punctuation\"\n  }, \".\"), \"Schema\", mdx(\"span\", {\n    parentName: \"code\",\n    \"className\": \"token punctuation\"\n  }, \".\"), \"Table\", mdx(\"span\", {\n    parentName: \"code\",\n    \"className\": \"token punctuation\"\n  }, \",\"), \"\\n\\t\\tOperationType\", mdx(\"span\", {\n    parentName: \"code\",\n    \"className\": \"token punctuation\"\n  }, \":\"), \" \", mdx(\"span\", {\n    parentName: \"code\",\n    \"className\": \"token string\"\n  }, \"\\\"DELETE\\\"\"), mdx(\"span\", {\n    parentName: \"code\",\n    \"className\": \"token punctuation\"\n  }, \",\"), \"\\n\\t\\tObjectId\", mdx(\"span\", {\n    parentName: \"code\",\n    \"className\": \"token punctuation\"\n  }, \":\"), \"      objId\", mdx(\"span\", {\n    parentName: \"code\",\n    \"className\": \"token punctuation\"\n  }, \",\"), \"\\n\\t\\tData\", mdx(\"span\", {\n    parentName: \"code\",\n    \"className\": \"token punctuation\"\n  }, \":\"), \"          \", mdx(\"span\", {\n    parentName: \"code\",\n    \"className\": \"token function\"\n  }, \"prepareData\"), mdx(\"span\", {\n    parentName: \"code\",\n    \"className\": \"token punctuation\"\n  }, \"(\"), \"recordMap\", mdx(\"span\", {\n    parentName: \"code\",\n    \"className\": \"token punctuation\"\n  }, \")\"), mdx(\"span\", {\n    parentName: \"code\",\n    \"className\": \"token punctuation\"\n  }, \",\"), \"\\n\\t\\tUserId\", mdx(\"span\", {\n    parentName: \"code\",\n    \"className\": \"token punctuation\"\n  }, \":\"), \"        \", mdx(\"span\", {\n    parentName: \"code\",\n    \"className\": \"token function\"\n  }, \"getCurrentUser\"), mdx(\"span\", {\n    parentName: \"code\",\n    \"className\": \"token punctuation\"\n  }, \"(\"), mdx(\"span\", {\n    parentName: \"code\",\n    \"className\": \"token punctuation\"\n  }, \")\"), mdx(\"span\", {\n    parentName: \"code\",\n    \"className\": \"token punctuation\"\n  }, \",\"), \"\\n\\t\", mdx(\"span\", {\n    parentName: \"code\",\n    \"className\": \"token punctuation\"\n  }, \"}\"), \"\\n\\t\", mdx(\"span\", {\n    parentName: \"code\",\n    \"className\": \"token keyword\"\n  }, \"if\"), \" err \", mdx(\"span\", {\n    parentName: \"code\",\n    \"className\": \"token operator\"\n  }, \":=\"), \" db\", mdx(\"span\", {\n    parentName: \"code\",\n    \"className\": \"token punctuation\"\n  }, \".\"), mdx(\"span\", {\n    parentName: \"code\",\n    \"className\": \"token function\"\n  }, \"Session\"), mdx(\"span\", {\n    parentName: \"code\",\n    \"className\": \"token punctuation\"\n  }, \"(\"), mdx(\"span\", {\n    parentName: \"code\",\n    \"className\": \"token operator\"\n  }, \"&\"), \"gorm\", mdx(\"span\", {\n    parentName: \"code\",\n    \"className\": \"token punctuation\"\n  }, \".\"), \"Session\", mdx(\"span\", {\n    parentName: \"code\",\n    \"className\": \"token punctuation\"\n  }, \"{\"), \"SkipHooks\", mdx(\"span\", {\n    parentName: \"code\",\n    \"className\": \"token punctuation\"\n  }, \":\"), \" \", mdx(\"span\", {\n    parentName: \"code\",\n    \"className\": \"token boolean\"\n  }, \"true\"), mdx(\"span\", {\n    parentName: \"code\",\n    \"className\": \"token punctuation\"\n  }, \",\"), \" NewDB\", mdx(\"span\", {\n    parentName: \"code\",\n    \"className\": \"token punctuation\"\n  }, \":\"), \" \", mdx(\"span\", {\n    parentName: \"code\",\n    \"className\": \"token boolean\"\n  }, \"true\"), mdx(\"span\", {\n    parentName: \"code\",\n    \"className\": \"token punctuation\"\n  }, \"}\"), mdx(\"span\", {\n    parentName: \"code\",\n    \"className\": \"token punctuation\"\n  }, \")\"), mdx(\"span\", {\n    parentName: \"code\",\n    \"className\": \"token punctuation\"\n  }, \".\"), mdx(\"span\", {\n    parentName: \"code\",\n    \"className\": \"token function\"\n  }, \"Table\"), mdx(\"span\", {\n    parentName: \"code\",\n    \"className\": \"token punctuation\"\n  }, \"(\"), mdx(\"span\", {\n    parentName: \"code\",\n    \"className\": \"token string\"\n  }, \"\\\"audit_logs\\\"\"), mdx(\"span\", {\n    parentName: \"code\",\n    \"className\": \"token punctuation\"\n  }, \")\"), mdx(\"span\", {\n    parentName: \"code\",\n    \"className\": \"token punctuation\"\n  }, \".\"), mdx(\"span\", {\n    parentName: \"code\",\n    \"className\": \"token function\"\n  }, \"Create\"), mdx(\"span\", {\n    parentName: \"code\",\n    \"className\": \"token punctuation\"\n  }, \"(\"), \"auditLog\", mdx(\"span\", {\n    parentName: \"code\",\n    \"className\": \"token punctuation\"\n  }, \")\"), mdx(\"span\", {\n    parentName: \"code\",\n    \"className\": \"token punctuation\"\n  }, \".\"), \"Error\", mdx(\"span\", {\n    parentName: \"code\",\n    \"className\": \"token punctuation\"\n  }, \";\"), \" err \", mdx(\"span\", {\n    parentName: \"code\",\n    \"className\": \"token operator\"\n  }, \"!=\"), \" \", mdx(\"span\", {\n    parentName: \"code\",\n    \"className\": \"token boolean\"\n  }, \"nil\"), \" \", mdx(\"span\", {\n    parentName: \"code\",\n    \"className\": \"token punctuation\"\n  }, \"{\"), \"\\n\\t\\tlogrus\", mdx(\"span\", {\n    parentName: \"code\",\n    \"className\": \"token punctuation\"\n  }, \".\"), mdx(\"span\", {\n    parentName: \"code\",\n    \"className\": \"token function\"\n  }, \"Error\"), mdx(\"span\", {\n    parentName: \"code\",\n    \"className\": \"token punctuation\"\n  }, \"(\"), \"fmt\", mdx(\"span\", {\n    parentName: \"code\",\n    \"className\": \"token punctuation\"\n  }, \".\"), mdx(\"span\", {\n    parentName: \"code\",\n    \"className\": \"token function\"\n  }, \"Errorf\"), mdx(\"span\", {\n    parentName: \"code\",\n    \"className\": \"token punctuation\"\n  }, \"(\"), mdx(\"span\", {\n    parentName: \"code\",\n    \"className\": \"token string\"\n  }, \"\\\"error in audit log creation: %s\\\"\"), mdx(\"span\", {\n    parentName: \"code\",\n    \"className\": \"token punctuation\"\n  }, \",\"), \" err\", mdx(\"span\", {\n    parentName: \"code\",\n    \"className\": \"token punctuation\"\n  }, \".\"), mdx(\"span\", {\n    parentName: \"code\",\n    \"className\": \"token function\"\n  }, \"Error\"), mdx(\"span\", {\n    parentName: \"code\",\n    \"className\": \"token punctuation\"\n  }, \"(\"), mdx(\"span\", {\n    parentName: \"code\",\n    \"className\": \"token punctuation\"\n  }, \")\"), mdx(\"span\", {\n    parentName: \"code\",\n    \"className\": \"token punctuation\"\n  }, \")\"), mdx(\"span\", {\n    parentName: \"code\",\n    \"className\": \"token punctuation\"\n  }, \")\"), \"\\n\\t\\t\", mdx(\"span\", {\n    parentName: \"code\",\n    \"className\": \"token keyword\"\n  }, \"return\"), \"\\n\\t\", mdx(\"span\", {\n    parentName: \"code\",\n    \"className\": \"token punctuation\"\n  }, \"}\"), \"\\n\", mdx(\"span\", {\n    parentName: \"code\",\n    \"className\": \"token punctuation\"\n  }, \"}\"), \"\\n\\n\", mdx(\"span\", {\n    parentName: \"code\",\n    \"className\": \"token keyword\"\n  }, \"func\"), \" \", mdx(\"span\", {\n    parentName: \"code\",\n    \"className\": \"token function\"\n  }, \"getDataBeforeOperation\"), mdx(\"span\", {\n    parentName: \"code\",\n    \"className\": \"token punctuation\"\n  }, \"(\"), \"db \", mdx(\"span\", {\n    parentName: \"code\",\n    \"className\": \"token operator\"\n  }, \"*\"), \"gorm\", mdx(\"span\", {\n    parentName: \"code\",\n    \"className\": \"token punctuation\"\n  }, \".\"), \"DB\", mdx(\"span\", {\n    parentName: \"code\",\n    \"className\": \"token punctuation\"\n  }, \")\"), \" \", mdx(\"span\", {\n    parentName: \"code\",\n    \"className\": \"token punctuation\"\n  }, \"(\"), mdx(\"span\", {\n    parentName: \"code\",\n    \"className\": \"token keyword\"\n  }, \"map\"), mdx(\"span\", {\n    parentName: \"code\",\n    \"className\": \"token punctuation\"\n  }, \"[\"), mdx(\"span\", {\n    parentName: \"code\",\n    \"className\": \"token builtin\"\n  }, \"string\"), mdx(\"span\", {\n    parentName: \"code\",\n    \"className\": \"token punctuation\"\n  }, \"]\"), mdx(\"span\", {\n    parentName: \"code\",\n    \"className\": \"token keyword\"\n  }, \"interface\"), mdx(\"span\", {\n    parentName: \"code\",\n    \"className\": \"token punctuation\"\n  }, \"{\"), mdx(\"span\", {\n    parentName: \"code\",\n    \"className\": \"token punctuation\"\n  }, \"}\"), mdx(\"span\", {\n    parentName: \"code\",\n    \"className\": \"token punctuation\"\n  }, \",\"), \" \", mdx(\"span\", {\n    parentName: \"code\",\n    \"className\": \"token builtin\"\n  }, \"error\"), mdx(\"span\", {\n    parentName: \"code\",\n    \"className\": \"token punctuation\"\n  }, \")\"), \" \", mdx(\"span\", {\n    parentName: \"code\",\n    \"className\": \"token punctuation\"\n  }, \"{\"), \"\\n\\tobjMap \", mdx(\"span\", {\n    parentName: \"code\",\n    \"className\": \"token operator\"\n  }, \":=\"), \" \", mdx(\"span\", {\n    parentName: \"code\",\n    \"className\": \"token keyword\"\n  }, \"map\"), mdx(\"span\", {\n    parentName: \"code\",\n    \"className\": \"token punctuation\"\n  }, \"[\"), mdx(\"span\", {\n    parentName: \"code\",\n    \"className\": \"token builtin\"\n  }, \"string\"), mdx(\"span\", {\n    parentName: \"code\",\n    \"className\": \"token punctuation\"\n  }, \"]\"), mdx(\"span\", {\n    parentName: \"code\",\n    \"className\": \"token keyword\"\n  }, \"interface\"), mdx(\"span\", {\n    parentName: \"code\",\n    \"className\": \"token punctuation\"\n  }, \"{\"), mdx(\"span\", {\n    parentName: \"code\",\n    \"className\": \"token punctuation\"\n  }, \"}\"), mdx(\"span\", {\n    parentName: \"code\",\n    \"className\": \"token punctuation\"\n  }, \"{\"), mdx(\"span\", {\n    parentName: \"code\",\n    \"className\": \"token punctuation\"\n  }, \"}\"), \"\\n\\t\", mdx(\"span\", {\n    parentName: \"code\",\n    \"className\": \"token keyword\"\n  }, \"if\"), \" db\", mdx(\"span\", {\n    parentName: \"code\",\n    \"className\": \"token punctuation\"\n  }, \".\"), \"Error \", mdx(\"span\", {\n    parentName: \"code\",\n    \"className\": \"token operator\"\n  }, \"==\"), \" \", mdx(\"span\", {\n    parentName: \"code\",\n    \"className\": \"token boolean\"\n  }, \"nil\"), \" \", mdx(\"span\", {\n    parentName: \"code\",\n    \"className\": \"token operator\"\n  }, \"&&\"), \" \", mdx(\"span\", {\n    parentName: \"code\",\n    \"className\": \"token operator\"\n  }, \"!\"), \"db\", mdx(\"span\", {\n    parentName: \"code\",\n    \"className\": \"token punctuation\"\n  }, \".\"), \"DryRun \", mdx(\"span\", {\n    parentName: \"code\",\n    \"className\": \"token punctuation\"\n  }, \"{\"), \"\\n\\t\\tobjectType \", mdx(\"span\", {\n    parentName: \"code\",\n    \"className\": \"token operator\"\n  }, \":=\"), \" reflect\", mdx(\"span\", {\n    parentName: \"code\",\n    \"className\": \"token punctuation\"\n  }, \".\"), mdx(\"span\", {\n    parentName: \"code\",\n    \"className\": \"token function\"\n  }, \"TypeOf\"), mdx(\"span\", {\n    parentName: \"code\",\n    \"className\": \"token punctuation\"\n  }, \"(\"), \"db\", mdx(\"span\", {\n    parentName: \"code\",\n    \"className\": \"token punctuation\"\n  }, \".\"), \"Statement\", mdx(\"span\", {\n    parentName: \"code\",\n    \"className\": \"token punctuation\"\n  }, \".\"), \"ReflectValue\", mdx(\"span\", {\n    parentName: \"code\",\n    \"className\": \"token punctuation\"\n  }, \".\"), mdx(\"span\", {\n    parentName: \"code\",\n    \"className\": \"token function\"\n  }, \"Interface\"), mdx(\"span\", {\n    parentName: \"code\",\n    \"className\": \"token punctuation\"\n  }, \"(\"), mdx(\"span\", {\n    parentName: \"code\",\n    \"className\": \"token punctuation\"\n  }, \")\"), mdx(\"span\", {\n    parentName: \"code\",\n    \"className\": \"token punctuation\"\n  }, \")\"), \"\\n\\n\\t\\t\", mdx(\"span\", {\n    parentName: \"code\",\n    \"className\": \"token comment\"\n  }, \"// Create a new instance of the object type\"), \"\\n\\t\\ttargetObj \", mdx(\"span\", {\n    parentName: \"code\",\n    \"className\": \"token operator\"\n  }, \":=\"), \" reflect\", mdx(\"span\", {\n    parentName: \"code\",\n    \"className\": \"token punctuation\"\n  }, \".\"), mdx(\"span\", {\n    parentName: \"code\",\n    \"className\": \"token function\"\n  }, \"New\"), mdx(\"span\", {\n    parentName: \"code\",\n    \"className\": \"token punctuation\"\n  }, \"(\"), \"objectType\", mdx(\"span\", {\n    parentName: \"code\",\n    \"className\": \"token punctuation\"\n  }, \")\"), mdx(\"span\", {\n    parentName: \"code\",\n    \"className\": \"token punctuation\"\n  }, \".\"), mdx(\"span\", {\n    parentName: \"code\",\n    \"className\": \"token function\"\n  }, \"Interface\"), mdx(\"span\", {\n    parentName: \"code\",\n    \"className\": \"token punctuation\"\n  }, \"(\"), mdx(\"span\", {\n    parentName: \"code\",\n    \"className\": \"token punctuation\"\n  }, \")\"), \"\\n\\n\\t\\tprimaryKeyValue \", mdx(\"span\", {\n    parentName: \"code\",\n    \"className\": \"token operator\"\n  }, \":=\"), \" \", mdx(\"span\", {\n    parentName: \"code\",\n    \"className\": \"token string\"\n  }, \"\\\"\\\"\"), \"\\n\\t\\tvalue \", mdx(\"span\", {\n    parentName: \"code\",\n    \"className\": \"token operator\"\n  }, \":=\"), \" db\", mdx(\"span\", {\n    parentName: \"code\",\n    \"className\": \"token punctuation\"\n  }, \".\"), \"Statement\", mdx(\"span\", {\n    parentName: \"code\",\n    \"className\": \"token punctuation\"\n  }, \".\"), \"ReflectValue\\n\\n\\t\\t\", mdx(\"span\", {\n    parentName: \"code\",\n    \"className\": \"token comment\"\n  }, \"// Check if the value is a struct\"), \"\\n\\t\\t\", mdx(\"span\", {\n    parentName: \"code\",\n    \"className\": \"token keyword\"\n  }, \"if\"), \" value\", mdx(\"span\", {\n    parentName: \"code\",\n    \"className\": \"token punctuation\"\n  }, \".\"), mdx(\"span\", {\n    parentName: \"code\",\n    \"className\": \"token function\"\n  }, \"Kind\"), mdx(\"span\", {\n    parentName: \"code\",\n    \"className\": \"token punctuation\"\n  }, \"(\"), mdx(\"span\", {\n    parentName: \"code\",\n    \"className\": \"token punctuation\"\n  }, \")\"), \" \", mdx(\"span\", {\n    parentName: \"code\",\n    \"className\": \"token operator\"\n  }, \"==\"), \" reflect\", mdx(\"span\", {\n    parentName: \"code\",\n    \"className\": \"token punctuation\"\n  }, \".\"), \"Struct \", mdx(\"span\", {\n    parentName: \"code\",\n    \"className\": \"token punctuation\"\n  }, \"{\"), \"\\n\\t\\t\\tprimaryKeyValue \", mdx(\"span\", {\n    parentName: \"code\",\n    \"className\": \"token operator\"\n  }, \"=\"), \" value\", mdx(\"span\", {\n    parentName: \"code\",\n    \"className\": \"token punctuation\"\n  }, \".\"), mdx(\"span\", {\n    parentName: \"code\",\n    \"className\": \"token function\"\n  }, \"FieldByName\"), mdx(\"span\", {\n    parentName: \"code\",\n    \"className\": \"token punctuation\"\n  }, \"(\"), mdx(\"span\", {\n    parentName: \"code\",\n    \"className\": \"token string\"\n  }, \"\\\"Id\\\"\"), mdx(\"span\", {\n    parentName: \"code\",\n    \"className\": \"token punctuation\"\n  }, \")\"), mdx(\"span\", {\n    parentName: \"code\",\n    \"className\": \"token punctuation\"\n  }, \".\"), mdx(\"span\", {\n    parentName: \"code\",\n    \"className\": \"token function\"\n  }, \"String\"), mdx(\"span\", {\n    parentName: \"code\",\n    \"className\": \"token punctuation\"\n  }, \"(\"), mdx(\"span\", {\n    parentName: \"code\",\n    \"className\": \"token punctuation\"\n  }, \")\"), \"\\n\\t\\t\", mdx(\"span\", {\n    parentName: \"code\",\n    \"className\": \"token punctuation\"\n  }, \"}\"), \"\\n\\n\\t\\t\", mdx(\"span\", {\n    parentName: \"code\",\n    \"className\": \"token comment\"\n  }, \"// Fetch the target object separately\"), \"\\n\\t\\t\", mdx(\"span\", {\n    parentName: \"code\",\n    \"className\": \"token keyword\"\n  }, \"if\"), \" err \", mdx(\"span\", {\n    parentName: \"code\",\n    \"className\": \"token operator\"\n  }, \":=\"), \" db\", mdx(\"span\", {\n    parentName: \"code\",\n    \"className\": \"token punctuation\"\n  }, \".\"), mdx(\"span\", {\n    parentName: \"code\",\n    \"className\": \"token function\"\n  }, \"Session\"), mdx(\"span\", {\n    parentName: \"code\",\n    \"className\": \"token punctuation\"\n  }, \"(\"), mdx(\"span\", {\n    parentName: \"code\",\n    \"className\": \"token operator\"\n  }, \"&\"), \"gorm\", mdx(\"span\", {\n    parentName: \"code\",\n    \"className\": \"token punctuation\"\n  }, \".\"), \"Session\", mdx(\"span\", {\n    parentName: \"code\",\n    \"className\": \"token punctuation\"\n  }, \"{\"), \"SkipHooks\", mdx(\"span\", {\n    parentName: \"code\",\n    \"className\": \"token punctuation\"\n  }, \":\"), \" \", mdx(\"span\", {\n    parentName: \"code\",\n    \"className\": \"token boolean\"\n  }, \"true\"), mdx(\"span\", {\n    parentName: \"code\",\n    \"className\": \"token punctuation\"\n  }, \",\"), \" NewDB\", mdx(\"span\", {\n    parentName: \"code\",\n    \"className\": \"token punctuation\"\n  }, \":\"), \" \", mdx(\"span\", {\n    parentName: \"code\",\n    \"className\": \"token boolean\"\n  }, \"true\"), mdx(\"span\", {\n    parentName: \"code\",\n    \"className\": \"token punctuation\"\n  }, \"}\"), mdx(\"span\", {\n    parentName: \"code\",\n    \"className\": \"token punctuation\"\n  }, \")\"), mdx(\"span\", {\n    parentName: \"code\",\n    \"className\": \"token punctuation\"\n  }, \".\"), mdx(\"span\", {\n    parentName: \"code\",\n    \"className\": \"token function\"\n  }, \"Where\"), mdx(\"span\", {\n    parentName: \"code\",\n    \"className\": \"token punctuation\"\n  }, \"(\"), mdx(\"span\", {\n    parentName: \"code\",\n    \"className\": \"token string\"\n  }, \"\\\"id = ?\\\"\"), mdx(\"span\", {\n    parentName: \"code\",\n    \"className\": \"token punctuation\"\n  }, \",\"), \" primaryKeyValue\", mdx(\"span\", {\n    parentName: \"code\",\n    \"className\": \"token punctuation\"\n  }, \")\"), mdx(\"span\", {\n    parentName: \"code\",\n    \"className\": \"token punctuation\"\n  }, \".\"), mdx(\"span\", {\n    parentName: \"code\",\n    \"className\": \"token function\"\n  }, \"First\"), mdx(\"span\", {\n    parentName: \"code\",\n    \"className\": \"token punctuation\"\n  }, \"(\"), mdx(\"span\", {\n    parentName: \"code\",\n    \"className\": \"token operator\"\n  }, \"&\"), \"targetObj\", mdx(\"span\", {\n    parentName: \"code\",\n    \"className\": \"token punctuation\"\n  }, \")\"), mdx(\"span\", {\n    parentName: \"code\",\n    \"className\": \"token punctuation\"\n  }, \".\"), \"Error\", mdx(\"span\", {\n    parentName: \"code\",\n    \"className\": \"token punctuation\"\n  }, \";\"), \" err \", mdx(\"span\", {\n    parentName: \"code\",\n    \"className\": \"token operator\"\n  }, \"!=\"), \" \", mdx(\"span\", {\n    parentName: \"code\",\n    \"className\": \"token boolean\"\n  }, \"nil\"), \" \", mdx(\"span\", {\n    parentName: \"code\",\n    \"className\": \"token punctuation\"\n  }, \"{\"), \"\\n\\t\\t\\tlogrus\", mdx(\"span\", {\n    parentName: \"code\",\n    \"className\": \"token punctuation\"\n  }, \".\"), mdx(\"span\", {\n    parentName: \"code\",\n    \"className\": \"token function\"\n  }, \"Error\"), mdx(\"span\", {\n    parentName: \"code\",\n    \"className\": \"token punctuation\"\n  }, \"(\"), \"fmt\", mdx(\"span\", {\n    parentName: \"code\",\n    \"className\": \"token punctuation\"\n  }, \".\"), mdx(\"span\", {\n    parentName: \"code\",\n    \"className\": \"token function\"\n  }, \"Errorf\"), mdx(\"span\", {\n    parentName: \"code\",\n    \"className\": \"token punctuation\"\n  }, \"(\"), mdx(\"span\", {\n    parentName: \"code\",\n    \"className\": \"token string\"\n  }, \"\\\"gorm callback: error while finding target object: %s\\\"\"), mdx(\"span\", {\n    parentName: \"code\",\n    \"className\": \"token punctuation\"\n  }, \",\"), \" err\", mdx(\"span\", {\n    parentName: \"code\",\n    \"className\": \"token punctuation\"\n  }, \".\"), mdx(\"span\", {\n    parentName: \"code\",\n    \"className\": \"token function\"\n  }, \"Error\"), mdx(\"span\", {\n    parentName: \"code\",\n    \"className\": \"token punctuation\"\n  }, \"(\"), mdx(\"span\", {\n    parentName: \"code\",\n    \"className\": \"token punctuation\"\n  }, \")\"), mdx(\"span\", {\n    parentName: \"code\",\n    \"className\": \"token punctuation\"\n  }, \")\"), mdx(\"span\", {\n    parentName: \"code\",\n    \"className\": \"token punctuation\"\n  }, \")\"), \"\\n\\t\\t\\t\", mdx(\"span\", {\n    parentName: \"code\",\n    \"className\": \"token keyword\"\n  }, \"return\"), \" \", mdx(\"span\", {\n    parentName: \"code\",\n    \"className\": \"token boolean\"\n  }, \"nil\"), mdx(\"span\", {\n    parentName: \"code\",\n    \"className\": \"token punctuation\"\n  }, \",\"), \" err\\n\\t\\t\", mdx(\"span\", {\n    parentName: \"code\",\n    \"className\": \"token punctuation\"\n  }, \"}\"), \"\\n\\n\\t\\tjsonBytes\", mdx(\"span\", {\n    parentName: \"code\",\n    \"className\": \"token punctuation\"\n  }, \",\"), \" err \", mdx(\"span\", {\n    parentName: \"code\",\n    \"className\": \"token operator\"\n  }, \":=\"), \" json\", mdx(\"span\", {\n    parentName: \"code\",\n    \"className\": \"token punctuation\"\n  }, \".\"), mdx(\"span\", {\n    parentName: \"code\",\n    \"className\": \"token function\"\n  }, \"Marshal\"), mdx(\"span\", {\n    parentName: \"code\",\n    \"className\": \"token punctuation\"\n  }, \"(\"), \"targetObj\", mdx(\"span\", {\n    parentName: \"code\",\n    \"className\": \"token punctuation\"\n  }, \")\"), \"\\n\\t\\t\", mdx(\"span\", {\n    parentName: \"code\",\n    \"className\": \"token keyword\"\n  }, \"if\"), \" err \", mdx(\"span\", {\n    parentName: \"code\",\n    \"className\": \"token operator\"\n  }, \"!=\"), \" \", mdx(\"span\", {\n    parentName: \"code\",\n    \"className\": \"token boolean\"\n  }, \"nil\"), \" \", mdx(\"span\", {\n    parentName: \"code\",\n    \"className\": \"token punctuation\"\n  }, \"{\"), \"\\n\\t\\t\\tlogrus\", mdx(\"span\", {\n    parentName: \"code\",\n    \"className\": \"token punctuation\"\n  }, \".\"), mdx(\"span\", {\n    parentName: \"code\",\n    \"className\": \"token function\"\n  }, \"Error\"), mdx(\"span\", {\n    parentName: \"code\",\n    \"className\": \"token punctuation\"\n  }, \"(\"), \"fmt\", mdx(\"span\", {\n    parentName: \"code\",\n    \"className\": \"token punctuation\"\n  }, \".\"), mdx(\"span\", {\n    parentName: \"code\",\n    \"className\": \"token function\"\n  }, \"Errorf\"), mdx(\"span\", {\n    parentName: \"code\",\n    \"className\": \"token punctuation\"\n  }, \"(\"), mdx(\"span\", {\n    parentName: \"code\",\n    \"className\": \"token string\"\n  }, \"\\\"gorm callback: error while marshalling json data: %s\\\"\"), mdx(\"span\", {\n    parentName: \"code\",\n    \"className\": \"token punctuation\"\n  }, \",\"), \" err\", mdx(\"span\", {\n    parentName: \"code\",\n    \"className\": \"token punctuation\"\n  }, \".\"), mdx(\"span\", {\n    parentName: \"code\",\n    \"className\": \"token function\"\n  }, \"Error\"), mdx(\"span\", {\n    parentName: \"code\",\n    \"className\": \"token punctuation\"\n  }, \"(\"), mdx(\"span\", {\n    parentName: \"code\",\n    \"className\": \"token punctuation\"\n  }, \")\"), mdx(\"span\", {\n    parentName: \"code\",\n    \"className\": \"token punctuation\"\n  }, \")\"), mdx(\"span\", {\n    parentName: \"code\",\n    \"className\": \"token punctuation\"\n  }, \")\"), \"\\n\\t\\t\\t\", mdx(\"span\", {\n    parentName: \"code\",\n    \"className\": \"token keyword\"\n  }, \"return\"), \" \", mdx(\"span\", {\n    parentName: \"code\",\n    \"className\": \"token boolean\"\n  }, \"nil\"), mdx(\"span\", {\n    parentName: \"code\",\n    \"className\": \"token punctuation\"\n  }, \",\"), \" err\\n\\t\\t\", mdx(\"span\", {\n    parentName: \"code\",\n    \"className\": \"token punctuation\"\n  }, \"}\"), \"\\n\\t\\tjson\", mdx(\"span\", {\n    parentName: \"code\",\n    \"className\": \"token punctuation\"\n  }, \".\"), mdx(\"span\", {\n    parentName: \"code\",\n    \"className\": \"token function\"\n  }, \"Unmarshal\"), mdx(\"span\", {\n    parentName: \"code\",\n    \"className\": \"token punctuation\"\n  }, \"(\"), \"jsonBytes\", mdx(\"span\", {\n    parentName: \"code\",\n    \"className\": \"token punctuation\"\n  }, \",\"), \" \", mdx(\"span\", {\n    parentName: \"code\",\n    \"className\": \"token operator\"\n  }, \"&\"), \"objMap\", mdx(\"span\", {\n    parentName: \"code\",\n    \"className\": \"token punctuation\"\n  }, \")\"), \"\\n\\t\", mdx(\"span\", {\n    parentName: \"code\",\n    \"className\": \"token punctuation\"\n  }, \"}\"), \"\\n\\t\", mdx(\"span\", {\n    parentName: \"code\",\n    \"className\": \"token keyword\"\n  }, \"return\"), \" objMap\", mdx(\"span\", {\n    parentName: \"code\",\n    \"className\": \"token punctuation\"\n  }, \",\"), \" \", mdx(\"span\", {\n    parentName: \"code\",\n    \"className\": \"token boolean\"\n  }, \"nil\"), \"\\n\", mdx(\"span\", {\n    parentName: \"code\",\n    \"className\": \"token punctuation\"\n  }, \"}\"), \"\\n\\n\", mdx(\"span\", {\n    parentName: \"code\",\n    \"className\": \"token keyword\"\n  }, \"func\"), \" \", mdx(\"span\", {\n    parentName: \"code\",\n    \"className\": \"token function\"\n  }, \"RegisterCallbacks\"), mdx(\"span\", {\n    parentName: \"code\",\n    \"className\": \"token punctuation\"\n  }, \"(\"), \"db \", mdx(\"span\", {\n    parentName: \"code\",\n    \"className\": \"token operator\"\n  }, \"*\"), \"gorm\", mdx(\"span\", {\n    parentName: \"code\",\n    \"className\": \"token punctuation\"\n  }, \".\"), \"DB\", mdx(\"span\", {\n    parentName: \"code\",\n    \"className\": \"token punctuation\"\n  }, \")\"), \" \", mdx(\"span\", {\n    parentName: \"code\",\n    \"className\": \"token builtin\"\n  }, \"error\"), \" \", mdx(\"span\", {\n    parentName: \"code\",\n    \"className\": \"token punctuation\"\n  }, \"{\"), \"\\n\\tdb\", mdx(\"span\", {\n    parentName: \"code\",\n    \"className\": \"token punctuation\"\n  }, \".\"), mdx(\"span\", {\n    parentName: \"code\",\n    \"className\": \"token function\"\n  }, \"Callback\"), mdx(\"span\", {\n    parentName: \"code\",\n    \"className\": \"token punctuation\"\n  }, \"(\"), mdx(\"span\", {\n    parentName: \"code\",\n    \"className\": \"token punctuation\"\n  }, \")\"), mdx(\"span\", {\n    parentName: \"code\",\n    \"className\": \"token punctuation\"\n  }, \".\"), mdx(\"span\", {\n    parentName: \"code\",\n    \"className\": \"token function\"\n  }, \"Create\"), mdx(\"span\", {\n    parentName: \"code\",\n    \"className\": \"token punctuation\"\n  }, \"(\"), mdx(\"span\", {\n    parentName: \"code\",\n    \"className\": \"token punctuation\"\n  }, \")\"), mdx(\"span\", {\n    parentName: \"code\",\n    \"className\": \"token punctuation\"\n  }, \".\"), mdx(\"span\", {\n    parentName: \"code\",\n    \"className\": \"token function\"\n  }, \"After\"), mdx(\"span\", {\n    parentName: \"code\",\n    \"className\": \"token punctuation\"\n  }, \"(\"), mdx(\"span\", {\n    parentName: \"code\",\n    \"className\": \"token string\"\n  }, \"\\\"gorm:create\\\"\"), mdx(\"span\", {\n    parentName: \"code\",\n    \"className\": \"token punctuation\"\n  }, \")\"), mdx(\"span\", {\n    parentName: \"code\",\n    \"className\": \"token punctuation\"\n  }, \".\"), mdx(\"span\", {\n    parentName: \"code\",\n    \"className\": \"token function\"\n  }, \"Register\"), mdx(\"span\", {\n    parentName: \"code\",\n    \"className\": \"token punctuation\"\n  }, \"(\"), mdx(\"span\", {\n    parentName: \"code\",\n    \"className\": \"token string\"\n  }, \"\\\"custom_plugin:create_audit_log\\\"\"), mdx(\"span\", {\n    parentName: \"code\",\n    \"className\": \"token punctuation\"\n  }, \",\"), \" createAuditLog\", mdx(\"span\", {\n    parentName: \"code\",\n    \"className\": \"token punctuation\"\n  }, \")\"), \"\\n\\tdb\", mdx(\"span\", {\n    parentName: \"code\",\n    \"className\": \"token punctuation\"\n  }, \".\"), mdx(\"span\", {\n    parentName: \"code\",\n    \"className\": \"token function\"\n  }, \"Callback\"), mdx(\"span\", {\n    parentName: \"code\",\n    \"className\": \"token punctuation\"\n  }, \"(\"), mdx(\"span\", {\n    parentName: \"code\",\n    \"className\": \"token punctuation\"\n  }, \")\"), mdx(\"span\", {\n    parentName: \"code\",\n    \"className\": \"token punctuation\"\n  }, \".\"), mdx(\"span\", {\n    parentName: \"code\",\n    \"className\": \"token function\"\n  }, \"Update\"), mdx(\"span\", {\n    parentName: \"code\",\n    \"className\": \"token punctuation\"\n  }, \"(\"), mdx(\"span\", {\n    parentName: \"code\",\n    \"className\": \"token punctuation\"\n  }, \")\"), mdx(\"span\", {\n    parentName: \"code\",\n    \"className\": \"token punctuation\"\n  }, \".\"), mdx(\"span\", {\n    parentName: \"code\",\n    \"className\": \"token function\"\n  }, \"After\"), mdx(\"span\", {\n    parentName: \"code\",\n    \"className\": \"token punctuation\"\n  }, \"(\"), mdx(\"span\", {\n    parentName: \"code\",\n    \"className\": \"token string\"\n  }, \"\\\"gorm:update\\\"\"), mdx(\"span\", {\n    parentName: \"code\",\n    \"className\": \"token punctuation\"\n  }, \")\"), mdx(\"span\", {\n    parentName: \"code\",\n    \"className\": \"token punctuation\"\n  }, \".\"), mdx(\"span\", {\n    parentName: \"code\",\n    \"className\": \"token function\"\n  }, \"Register\"), mdx(\"span\", {\n    parentName: \"code\",\n    \"className\": \"token punctuation\"\n  }, \"(\"), mdx(\"span\", {\n    parentName: \"code\",\n    \"className\": \"token string\"\n  }, \"\\\"custom_plugin:update_audit_log\\\"\"), mdx(\"span\", {\n    parentName: \"code\",\n    \"className\": \"token punctuation\"\n  }, \",\"), \" updateAuditLog\", mdx(\"span\", {\n    parentName: \"code\",\n    \"className\": \"token punctuation\"\n  }, \")\"), \"\\n\\tdb\", mdx(\"span\", {\n    parentName: \"code\",\n    \"className\": \"token punctuation\"\n  }, \".\"), mdx(\"span\", {\n    parentName: \"code\",\n    \"className\": \"token function\"\n  }, \"Callback\"), mdx(\"span\", {\n    parentName: \"code\",\n    \"className\": \"token punctuation\"\n  }, \"(\"), mdx(\"span\", {\n    parentName: \"code\",\n    \"className\": \"token punctuation\"\n  }, \")\"), mdx(\"span\", {\n    parentName: \"code\",\n    \"className\": \"token punctuation\"\n  }, \".\"), mdx(\"span\", {\n    parentName: \"code\",\n    \"className\": \"token function\"\n  }, \"Delete\"), mdx(\"span\", {\n    parentName: \"code\",\n    \"className\": \"token punctuation\"\n  }, \"(\"), mdx(\"span\", {\n    parentName: \"code\",\n    \"className\": \"token punctuation\"\n  }, \")\"), mdx(\"span\", {\n    parentName: \"code\",\n    \"className\": \"token punctuation\"\n  }, \".\"), mdx(\"span\", {\n    parentName: \"code\",\n    \"className\": \"token function\"\n  }, \"Before\"), mdx(\"span\", {\n    parentName: \"code\",\n    \"className\": \"token punctuation\"\n  }, \"(\"), mdx(\"span\", {\n    parentName: \"code\",\n    \"className\": \"token string\"\n  }, \"\\\"gorm:delete\\\"\"), mdx(\"span\", {\n    parentName: \"code\",\n    \"className\": \"token punctuation\"\n  }, \")\"), mdx(\"span\", {\n    parentName: \"code\",\n    \"className\": \"token punctuation\"\n  }, \".\"), mdx(\"span\", {\n    parentName: \"code\",\n    \"className\": \"token function\"\n  }, \"Register\"), mdx(\"span\", {\n    parentName: \"code\",\n    \"className\": \"token punctuation\"\n  }, \"(\"), mdx(\"span\", {\n    parentName: \"code\",\n    \"className\": \"token string\"\n  }, \"\\\"custom_plugin:delete_audit_log\\\"\"), mdx(\"span\", {\n    parentName: \"code\",\n    \"className\": \"token punctuation\"\n  }, \",\"), \" deleteAuditLog\", mdx(\"span\", {\n    parentName: \"code\",\n    \"className\": \"token punctuation\"\n  }, \")\"), \"\\n\\t\", mdx(\"span\", {\n    parentName: \"code\",\n    \"className\": \"token keyword\"\n  }, \"return\"), \" \", mdx(\"span\", {\n    parentName: \"code\",\n    \"className\": \"token boolean\"\n  }, \"nil\"), \"\\n\", mdx(\"span\", {\n    parentName: \"code\",\n    \"className\": \"token punctuation\"\n  }, \"}\"), \"\\n\"))), mdx(\"p\", null, \"The changes are currently saved in \", mdx(\"strong\", {\n    parentName: \"p\"\n  }, \"your_database.db\"), \" SQLite database file.\"), mdx(\"p\", null, \"With the database and model set up, we can now proceed to implement the audit log functionality using GORM.\"), mdx(\"h2\", {\n    \"id\": \"implementing-the-audit-log\",\n    \"style\": {\n      \"position\": \"relative\"\n    }\n  }, mdx(\"a\", {\n    parentName: \"h2\",\n    \"href\": \"#implementing-the-audit-log\",\n    \"aria-label\": \"implementing the audit log permalink\",\n    \"className\": \"anchor before\"\n  }, mdx(\"svg\", {\n    parentName: \"a\",\n    \"aria-hidden\": \"true\",\n    \"focusable\": \"false\",\n    \"height\": \"16\",\n    \"version\": \"1.1\",\n    \"viewBox\": \"0 0 16 16\",\n    \"width\": \"16\"\n  }, mdx(\"path\", {\n    parentName: \"svg\",\n    \"fillRule\": \"evenodd\",\n    \"d\": \"M4 9h1v1H4c-1.5 0-3-1.69-3-3.5S2.55 3 4 3h4c1.45 0 3 1.69 3 3.5 0 1.41-.91 2.72-2 3.25V8.59c.58-.45 1-1.27 1-2.09C10 5.22 8.98 4 8 4H4c-.98 0-2 1.22-2 2.5S3 9 4 9zm9-3h-1v1h1c1 0 2 1.22 2 2.5S13.98 12 13 12H9c-.98 0-2-1.22-2-2.5 0-.83.42-1.64 1-2.09V6.25c-1.09.53-2 1.84-2 3.25C6 11.31 7.55 13 9 13h4c1.45 0 3-1.69 3-3.5S14.5 6 13 6z\"\n  }))), \"Implementing the Audit Log\"), mdx(\"p\", null, \"In the above code, we have defined several functions that are responsible for creating audit log entries. These functions are registered as GORM callbacks for the respective operations (create, update, and delete).\"), mdx(\"p\", null, \"The \", mdx(\"code\", {\n    parentName: \"p\",\n    \"className\": \"language-text\"\n  }, \"createAuditLog\"), \", \", mdx(\"code\", {\n    parentName: \"p\",\n    \"className\": \"language-text\"\n  }, \"updateAuditLog\"), \", and \", mdx(\"code\", {\n    parentName: \"p\",\n    \"className\": \"language-text\"\n  }, \"deleteAuditLog\"), \" functions retrieve the necessary data before the operation using the \", mdx(\"code\", {\n    parentName: \"p\",\n    \"className\": \"language-text\"\n  }, \"getDataBeforeOperation\"), \" function. They construct an \", mdx(\"code\", {\n    parentName: \"p\",\n    \"className\": \"language-text\"\n  }, \"AuditLog\"), \" object with the required information and use GORM's \", mdx(\"code\", {\n    parentName: \"p\",\n    \"className\": \"language-text\"\n  }, \"Create\"), \" method to store the audit log entry in the \", mdx(\"code\", {\n    parentName: \"p\",\n    \"className\": \"language-text\"\n  }, \"audit_logs\"), \" table. The callbacks ensure that creating an audit log does not trigger that callback again by performing the check at the start of each callback. \"), mdx(\"p\", null, \"The \", mdx(\"code\", {\n    parentName: \"p\",\n    \"className\": \"language-text\"\n  }, \"getDataBeforeOperation\"), \" function retrieves the data before the database operation by reflecting on the GORM statement's reflected value. It is essential to note that a new \", mdx(\"strong\", {\n    parentName: \"p\"\n  }, \"GORM session\"), \" should be initialized with a \", mdx(\"strong\", {\n    parentName: \"p\"\n  }, \"NewDB\"), \" so that the existing conditions(of the create, update or delete query) do not affect the find query. It creates a new instance of the object type, fetches the target object from the database, and serializes it to JSON. Finally, it deserializes the JSON into a map.\"), mdx(\"p\", null, \"The \", mdx(\"code\", {\n    parentName: \"p\",\n    \"className\": \"language-text\"\n  }, \"RegisterCallbacks\"), \" function is responsible for registering the audit log callbacks for the respective GORM operations. It also ensures that the necessary database table (\", mdx(\"code\", {\n    parentName: \"p\",\n    \"className\": \"language-text\"\n  }, \"your_tables\"), \") is created or migrated using \", mdx(\"code\", {\n    parentName: \"p\",\n    \"className\": \"language-text\"\n  }, \"db.AutoMigrate\"), \".\"), mdx(\"h2\", {\n    \"id\": \"conclusion\",\n    \"style\": {\n      \"position\": \"relative\"\n    }\n  }, mdx(\"a\", {\n    parentName: \"h2\",\n    \"href\": \"#conclusion\",\n    \"aria-label\": \"conclusion permalink\",\n    \"className\": \"anchor before\"\n  }, mdx(\"svg\", {\n    parentName: \"a\",\n    \"aria-hidden\": \"true\",\n    \"focusable\": \"false\",\n    \"height\": \"16\",\n    \"version\": \"1.1\",\n    \"viewBox\": \"0 0 16 16\",\n    \"width\": \"16\"\n  }, mdx(\"path\", {\n    parentName: \"svg\",\n    \"fillRule\": \"evenodd\",\n    \"d\": \"M4 9h1v1H4c-1.5 0-3-1.69-3-3.5S2.55 3 4 3h4c1.45 0 3 1.69 3 3.5 0 1.41-.91 2.72-2 3.25V8.59c.58-.45 1-1.27 1-2.09C10 5.22 8.98 4 8 4H4c-.98 0-2 1.22-2 2.5S3 9 4 9zm9-3h-1v1h1c1 0 2 1.22 2 2.5S13.98 12 13 12H9c-.98 0-2-1.22-2-2.5 0-.83.42-1.64 1-2.09V6.25c-1.09.53-2 1.84-2 3.25C6 11.31 7.55 13 9 13h4c1.45 0 3-1.69 3-3.5S14.5 6 13 6z\"\n  }))), \"Conclusion\"), mdx(\"p\", null, \"Implementing an audit log using GORM allows you to track changes made to your application data, enabling auditing, debugging, and maintaining data integrity. By following the steps outlined in this blog post, you can easily incorporate audit log functionality into your Go applications.\\nRemember to customize the code to fit your specific application needs, such as the structure of your application data and any additional fields you want to include in the audit log entries.\\nHaving an audit log in place provides transparency, accountability, and traceability for data changes, which is essential for many applications.\"));\n}\n;\nMDXContent.isMDXComponent = true;","frontmatter":{"title":"Implementing Audit Log using GORM in Go","date":"July 14th 2023","datetime":"2023-07-14T00:00:00.000Z","updated":null,"tags":["Go","gORM"],"updated_datetime":null,"description":"This is a tutorial for creating audit log in gorm using callbacks.","toc":true},"excerpt":"In many applications, it's essential to keep track of changes made to data in the database for auditing and debugging purposes. One common…","tableOfContents":{"items":[{"url":"#prerequisites","title":"Prerequisites"},{"url":"#initial-setup","title":"Initial setup"},{"url":"#implementing-the-audit-log","title":"Implementing the Audit Log"},{"url":"#conclusion","title":"Conclusion"}]},"timeToRead":2},"ogImage":{"childImageSharp":{"fixed":{"src":"/static/b6241a2d384cfbd938ff2159a4167e09/e4d72/og-audit-log-gorm.png"}}}},"pageContext":{"id":"afbd3cd5-37a5-5a02-871e-cca5ca3c6e61","ogImageSlug":"og-audit-log-gorm.png"}},"staticQueryHashes":["633160921"]}