{"componentChunkName":"component---src-components-post-layout-js","path":"/blog/papers-inspiring-bitcoin/","result":{"data":{"mdx":{"id":"c8ee3bff-14f7-547a-8ece-1ae6dc5c076d","body":"var _excluded = [\"components\"];\n\nfunction _extends() { _extends = Object.assign || function (target) { for (var i = 1; i < arguments.length; i++) { var source = arguments[i]; for (var key in source) { if (Object.prototype.hasOwnProperty.call(source, key)) { target[key] = source[key]; } } } return target; }; return _extends.apply(this, arguments); }\n\nfunction _objectWithoutProperties(source, excluded) { if (source == null) return {}; var target = _objectWithoutPropertiesLoose(source, excluded); var key, i; if (Object.getOwnPropertySymbols) { var sourceSymbolKeys = Object.getOwnPropertySymbols(source); for (i = 0; i < sourceSymbolKeys.length; i++) { key = sourceSymbolKeys[i]; if (excluded.indexOf(key) >= 0) continue; if (!Object.prototype.propertyIsEnumerable.call(source, key)) continue; target[key] = source[key]; } } return target; }\n\nfunction _objectWithoutPropertiesLoose(source, excluded) { if (source == null) return {}; var target = {}; var sourceKeys = Object.keys(source); var key, i; for (i = 0; i < sourceKeys.length; i++) { key = sourceKeys[i]; if (excluded.indexOf(key) >= 0) continue; target[key] = source[key]; } return target; }\n\n/* @jsxRuntime classic */\n\n/* @jsx mdx */\nvar _frontmatter = {\n  \"title\": \"Papers inspiring - Bitcoin: A Peer-to-Peer Electronic Cash System\",\n  \"date\": \"2022-10-02T00:00:00.000Z\",\n  \"published\": true,\n  \"tags\": [\"Paper review\", \"Distributed systems\"],\n  \"description\": \"We discuss papers inspiring the most popular cryptocurrency, bitcoin.\",\n  \"toc\": true,\n  \"image\": \"og-papers-inspiring-bitcoin.png\",\n  \"seoImage\": \"og-papers-inspiring-bitcoin.png\"\n};\n\nvar makeShortcode = function makeShortcode(name) {\n  return function MDXDefaultShortcode(props) {\n    console.warn(\"Component \" + name + \" was not imported, exported, or provided by MDXProvider as global scope\");\n    return mdx(\"div\", props);\n  };\n};\n\nvar Callout = makeShortcode(\"Callout\");\nvar layoutProps = {\n  _frontmatter: _frontmatter\n};\nvar MDXLayout = \"wrapper\";\nreturn function MDXContent(_ref) {\n  var components = _ref.components,\n      props = _objectWithoutProperties(_ref, _excluded);\n\n  return mdx(MDXLayout, _extends({}, layoutProps, props, {\n    components: components,\n    mdxType: \"MDXLayout\"\n  }), mdx(\"p\", null, \"In 2008, Satoshi Nakamoto's paper 'Bitcoin: A Peer-to-Peer Electronic Cash System' unleashed a seismic shift in finance and technology. By proposing a decentralized digital currency and introducing blockchain technology, Nakamoto laid the foundation for Bitcoin, the world's first cryptocurrency.\\nIt challenged traditional financial systems, sparked debates on monetary policy and digital privacy, and led to a global movement towards financial sovereignty and innovation, leaving an enduring impact on the modern world.\\nThis groundbreaking paper has since inspired a vast ecosystem of cryptocurrencies and transformative blockchain applications across industries, which begs the question: \", mdx(\"strong\", {\n    parentName: \"p\"\n  }, \"How was it inspired?\"), \" \"), mdx(Callout, {\n    mdxType: \"Callout\"\n  }, \"\\uD83D\\uDCA1 Did you know: An estimated 20% of bitcoins have been lost forever due to forgotten passwords or misplaced wallets, contributing to added value of the remaining ones.\"), mdx(\"h2\", {\n    \"id\": \"about-bitcoin\",\n    \"style\": {\n      \"position\": \"relative\"\n    }\n  }, mdx(\"a\", {\n    parentName: \"h2\",\n    \"href\": \"#about-bitcoin\",\n    \"aria-label\": \"about bitcoin permalink\",\n    \"className\": \"anchor before\"\n  }, mdx(\"svg\", {\n    parentName: \"a\",\n    \"aria-hidden\": \"true\",\n    \"focusable\": \"false\",\n    \"height\": \"16\",\n    \"version\": \"1.1\",\n    \"viewBox\": \"0 0 16 16\",\n    \"width\": \"16\"\n  }, mdx(\"path\", {\n    parentName: \"svg\",\n    \"fillRule\": \"evenodd\",\n    \"d\": \"M4 9h1v1H4c-1.5 0-3-1.69-3-3.5S2.55 3 4 3h4c1.45 0 3 1.69 3 3.5 0 1.41-.91 2.72-2 3.25V8.59c.58-.45 1-1.27 1-2.09C10 5.22 8.98 4 8 4H4c-.98 0-2 1.22-2 2.5S3 9 4 9zm9-3h-1v1h1c1 0 2 1.22 2 2.5S13.98 12 13 12H9c-.98 0-2-1.22-2-2.5 0-.83.42-1.64 1-2.09V6.25c-1.09.53-2 1.84-2 3.25C6 11.31 7.55 13 9 13h4c1.45 0 3-1.69 3-3.5S14.5 6 13 6z\"\n  }))), \"About Bitcoin\"), mdx(\"p\", null, \"The novelty of the Bitcoin protocol lies in its groundbreaking concept of a decentralized digital currency. It introduced the first-ever successful implementation of a trustless, peer-to-peer electronic cash system, eliminating the need for intermediaries like banks. Additionally, its use of blockchain technology, combining cryptographic hashing and proof-of-work, set a precedent for transparent, tamper-resistant, and immutable transaction records.\\nLike every good paper, it derives some of it's work from existing literature. I am going to go through a couple of them in depth.\"), mdx(\"h2\", {\n    \"id\": \"hashcash---a-denial-of-service-counter-measure\",\n    \"style\": {\n      \"position\": \"relative\"\n    }\n  }, mdx(\"a\", {\n    parentName: \"h2\",\n    \"href\": \"#hashcash---a-denial-of-service-counter-measure\",\n    \"aria-label\": \"hashcash   a denial of service counter measure permalink\",\n    \"className\": \"anchor before\"\n  }, mdx(\"svg\", {\n    parentName: \"a\",\n    \"aria-hidden\": \"true\",\n    \"focusable\": \"false\",\n    \"height\": \"16\",\n    \"version\": \"1.1\",\n    \"viewBox\": \"0 0 16 16\",\n    \"width\": \"16\"\n  }, mdx(\"path\", {\n    parentName: \"svg\",\n    \"fillRule\": \"evenodd\",\n    \"d\": \"M4 9h1v1H4c-1.5 0-3-1.69-3-3.5S2.55 3 4 3h4c1.45 0 3 1.69 3 3.5 0 1.41-.91 2.72-2 3.25V8.59c.58-.45 1-1.27 1-2.09C10 5.22 8.98 4 8 4H4c-.98 0-2 1.22-2 2.5S3 9 4 9zm9-3h-1v1h1c1 0 2 1.22 2 2.5S13.98 12 13 12H9c-.98 0-2-1.22-2-2.5 0-.83.42-1.64 1-2.09V6.25c-1.09.53-2 1.84-2 3.25C6 11.31 7.55 13 9 13h4c1.45 0 3-1.69 3-3.5S14.5 6 13 6z\"\n  }))), \"Hashcash - A Denial of Service Counter-Measure\"), mdx(\"p\", null, \"In the late 90s, spam emails were becoming a vexing problem for email providers. Back then, there were a lot fewer tools to mitigate spam emails, and content-based filtering was still in its infancy. As a result, spam was much more prevalent and often flooded users' inboxes. \"), mdx(\"p\", null, \"Adam Back, a British cryptographer, proposed a way to prevent email spam and denial-of-service (DoS) attacks. It introduced the concept of using computational puzzles as a means of making resource-intensive computations in order to deter abuse. \"), mdx(\"p\", null, \"The key idea behind \", mdx(\"em\", {\n    parentName: \"p\"\n  }, \"Hashcash\"), \", proposed in 1997, is to require the sender of an email (or any digital message) to perform a certain amount of computational work before the message can be sent or verified. This work is measured by adding a nonce to the email and computing the hash until a certain number of leading zeros appears, and it acts as proof that the sender has expended a significant amount of computing power to generate the required hash value.\"), mdx(\"p\", null, \"By requiring computational effort to send a message using a cost function difficult to compute but easy to verify, hashcash aims to make it economically infeasible for spammers to flood the network with unwanted messages or for attackers to launch large-scale DoS attacks. It effectively raises the cost of sending spam or launching an attack, making these activities less attractive and less likely to occur on a massive scale.\"), mdx(\"p\", null, \"This very \", mdx(\"strong\", {\n    parentName: \"p\"\n  }, \"Proof-of-work system\"), \" is used in Bitcoin to validate transactions, achieve distributed consensus and create computational effort for adding new blocks in the chain.\"), mdx(\"h2\", {\n    \"id\": \"wei-dais-b-money\",\n    \"style\": {\n      \"position\": \"relative\"\n    }\n  }, mdx(\"a\", {\n    parentName: \"h2\",\n    \"href\": \"#wei-dais-b-money\",\n    \"aria-label\": \"wei dais b money permalink\",\n    \"className\": \"anchor before\"\n  }, mdx(\"svg\", {\n    parentName: \"a\",\n    \"aria-hidden\": \"true\",\n    \"focusable\": \"false\",\n    \"height\": \"16\",\n    \"version\": \"1.1\",\n    \"viewBox\": \"0 0 16 16\",\n    \"width\": \"16\"\n  }, mdx(\"path\", {\n    parentName: \"svg\",\n    \"fillRule\": \"evenodd\",\n    \"d\": \"M4 9h1v1H4c-1.5 0-3-1.69-3-3.5S2.55 3 4 3h4c1.45 0 3 1.69 3 3.5 0 1.41-.91 2.72-2 3.25V8.59c.58-.45 1-1.27 1-2.09C10 5.22 8.98 4 8 4H4c-.98 0-2 1.22-2 2.5S3 9 4 9zm9-3h-1v1h1c1 0 2 1.22 2 2.5S13.98 12 13 12H9c-.98 0-2-1.22-2-2.5 0-.83.42-1.64 1-2.09V6.25c-1.09.53-2 1.84-2 3.25C6 11.31 7.55 13 9 13h4c1.45 0 3-1.69 3-3.5S14.5 6 13 6z\"\n  }))), \"Wei Dai's b-money\"), mdx(\"p\", null, \"Wei Dai's b-money was a novel proposal for an anonymous, distributed electronic cash system. In 1998, computer scientist and cryptographer Wei Dai outlined the concept in his seminal essay titled \\\"b-money: An anonymous, distributed electronic cash system.\\\" The main idea behind b-money was to create a decentralized digital currency that would allow users to conduct secure and anonymous transactions directly with one another, without relying on any central authority or intermediary.\"), mdx(\"p\", null, \"In the b-money system, participants would engage in cryptographic proof-of-work to generate new coins and verify transactions. The world envisaged by Wei Dai was a little different than that by Nakamoto. For instance, Wei Dai assumed the identities of the transacting parties to remain anonymous. Furthermore, the coordination mechanism was a bit impractical among servers, for instance, Wei Dai proposed few trusted servers to deposit money for fines or rewards for proof of misconduct.\"), mdx(\"p\", null, \"Still, Wei Dai's b-money essay is cited in the original Bitcoin whitepaper, referring to the fact that it is essential to publicly announce transactions in a decentralized distributed ledger. \"), mdx(\"h2\", {\n    \"id\": \"secrecy-authentication-and-public-key-systems\",\n    \"style\": {\n      \"position\": \"relative\"\n    }\n  }, mdx(\"a\", {\n    parentName: \"h2\",\n    \"href\": \"#secrecy-authentication-and-public-key-systems\",\n    \"aria-label\": \"secrecy authentication and public key systems permalink\",\n    \"className\": \"anchor before\"\n  }, mdx(\"svg\", {\n    parentName: \"a\",\n    \"aria-hidden\": \"true\",\n    \"focusable\": \"false\",\n    \"height\": \"16\",\n    \"version\": \"1.1\",\n    \"viewBox\": \"0 0 16 16\",\n    \"width\": \"16\"\n  }, mdx(\"path\", {\n    parentName: \"svg\",\n    \"fillRule\": \"evenodd\",\n    \"d\": \"M4 9h1v1H4c-1.5 0-3-1.69-3-3.5S2.55 3 4 3h4c1.45 0 3 1.69 3 3.5 0 1.41-.91 2.72-2 3.25V8.59c.58-.45 1-1.27 1-2.09C10 5.22 8.98 4 8 4H4c-.98 0-2 1.22-2 2.5S3 9 4 9zm9-3h-1v1h1c1 0 2 1.22 2 2.5S13.98 12 13 12H9c-.98 0-2-1.22-2-2.5 0-.83.42-1.64 1-2.09V6.25c-1.09.53-2 1.84-2 3.25C6 11.31 7.55 13 9 13h4c1.45 0 3-1.69 3-3.5S14.5 6 13 6z\"\n  }))), \"Secrecy, authentication, and public key systems\"), mdx(\"p\", null, \"Although this paper of Ralph Merkle is not cited in the original whitepaper, it is probably more impactful towards bitcoin architecture than the other paper of Merkle which is cited, \\\"Protocols for Public Key Cryptosystems\\\". Ralph Merkle's paper \\\"Secrecy, authentication, and public key systems,\\\" published in 1979, introduced the concept of Merkle trees, a fundamental cryptographic data structure.\\nIn the paper, Merkle proposed a method to efficiently verify large sets of data by creating a binary hash tree, now known as a Merkle tree.\\nThe process involves hashing data in pairs until a single root hash is obtained, representing the entire dataset's integrity.\\nThis structure enables secure and fast verification of individual data elements without the need to store the entire dataset, making it ideal for applications like digital signatures and data authentication. \"), mdx(\"p\", null, \"Hash trees in general have also found widespread application in various technologies such as the InterPlanetary File System (IPFS), Btrfs, and ZFS file systems to protect against data degradation. They are also utilized in protocols like the Dat protocol and Apache Wave protocol, as well as distributed revision control systems like Git and Mercurial.\"));\n}\n;\nMDXContent.isMDXComponent = true;","frontmatter":{"title":"Papers inspiring - Bitcoin: A Peer-to-Peer Electronic Cash System","date":"October 2nd 2022","datetime":"2022-10-02T00:00:00.000Z","updated":null,"tags":["Paper review","Distributed systems"],"updated_datetime":null,"description":"We discuss papers inspiring the most popular cryptocurrency, bitcoin.","toc":true},"excerpt":"In 2008, Satoshi Nakamoto's paper 'Bitcoin: A Peer-to-Peer Electronic Cash System' unleashed a seismic shift in finance and technology. By…","tableOfContents":{"items":[{"url":"#about-bitcoin","title":"About Bitcoin"},{"url":"#hashcash---a-denial-of-service-counter-measure","title":"Hashcash - A Denial of Service Counter-Measure"},{"url":"#wei-dais-b-money","title":"Wei Dai's b-money"},{"url":"#secrecy-authentication-and-public-key-systems","title":"Secrecy, authentication, and public key systems"}]},"timeToRead":3},"ogImage":{"childImageSharp":{"fixed":{"src":"/static/6b809bf6f373a9dba4ac8928ac248ef0/e4d72/og-papers-inspiring-bitcoin.png"}}}},"pageContext":{"id":"c8ee3bff-14f7-547a-8ece-1ae6dc5c076d","ogImageSlug":"og-papers-inspiring-bitcoin.png"}},"staticQueryHashes":["633160921"]}